idVaga,NomeVaga,Cidade,Salario,QuantidadeVaga,DataPesquisa,Perfil,Descricao,Empresa,DataPubli,Pesquisa
v1954504,Estatístico,São Paulo,Salário a combinar,1,2019-09-20,Júnior/Trainee,QUALIFICAÇÕES NECESSÁRIAS:Conhecimento de modelagem estatística utilizando RConhecimento em Python Inglês AvançadoQUALIFICAÇÕES DESEJÁVEIS:Conhecimento em Machine LearningConhecimento em linguagem SQLConhecimento em AlteryxO profissional atuará no desenvolvimento de modelos estatísticos em R e Python para uso associado ao Qlik e Alteryx.,Nórdica Software,09/09/2019,Estatístico
v1924547,Estatístico,São Paulo,Salário a combinar,1,2019-09-20,Pleno,Responsabilidades:O profissional será responsável pelas seguintes atividades:• Realizar cálculos estatísticos a partir de dados educacionais oficiais e dados coletados em pesquisas avaliações e plataformas educacionais. • Acompanhar e validar análises estatísticas realizadas por fornecedores. • Realizar com autonomia e assertividade as principais etapas do processo de análise de dados: captura e manipulação tratamento e higienização exploração e análises descritivas interpretação e apresentação dos resultados.Requisitos:*Formação: Estatística Matemática Economia Engenharia Tecnologia ou áreas afins. Mestrado é um diferencial.*Conhecimentos Técnicos:• Habilidades de captura manipulação tratamento e higienização de dados• Necessário conhecimento em ferramentas de bancos de dados (SQL)• Excel avançado e programas de pacotes estatísticos• Desejável experiência com modelos e ferramentas de machine learning (R e/ou Python)• Desejável vivência com análise de dados educacionais preferencialmente com avaliação educacional por meio da Teoria da resposta ao Item (TRI).Modalidade de contratação:CLTLocal de trabalho:Matriz Zona Leste de São PauloHorário:ComercialRemuneração:A combinarFacilidades:Convênio médio o odonto VT VARestaurante na empresa Seguro de vida Previdência privada e PLR.,Editora Moderna,16/07/2019,Estatístico
v1945218,Atuário / Estatístico Sr.,São Paulo,Salário a combinar,1,2019-09-20,Sênior,Atividades do cargo: Elaboração de nota técnica atuarial Precificação de planos de saúde Provisões técnicas Análise de indicadores por carteira (por produto tipo de contratação etc.) Teste de Adequação de Passivo e Cálculo de capital mínimo Acompanhar obrigações junto a ANS Apuração de despesas assistenciais (sinistralidade) Análise demográfica dos beneficiários. Conhecimentos necessários: Ensino Superior completo em Ciências Atuariais Matemática ou Estatística Pósgraduação cursando/completa em áreas relacionadas (Finanças Economia Estatística Matemática e afins) Excel avançado Conhecimento em programas estatísticos como: SAS SQL R Pyton Stata SPSS etc Desejável inglês intermediário Essencial ter atuado em empresas dos ramos de: assistência médica previdência ou seguros.,UNIMED FESP,22/08/2019,Estatístico
v1955694,Estágio - Estatística,Belo Horizonte,Salário a combinar,1,2019-09-20,Estágio,ATRIBUIÇÕES DO CARGO:Auxiliar nos programas de monitoramento do Projeto Básico Ambiental da UHE Belo Monte e em outros projetos de licenciamento ambiental.Realizar atividades relacionadas à compilação atualização e gestão de planilhas e banco de dados específicos dos referidos programas ambientais.Apoio na elaboração das análises dos relatórios técnicos desenhos gráficos tabelas e mapas (AutoCad e/ou Gis) relacionados às demandas em processos de licenciamento ambiental incluindo o desenvolvimento e modificação de sintaxes e algoritmos.    COMPETÊNCIAS NECESSÁRIAS: Conhecimento em Excel R (intermediário) e AccessBons conhecimentos nos demais programas do Pacote OfficeDesejável conhecimento avançado do RCursando Estatística 3º anoOUTRAS INFORMAÇÕES:Todas as nossas vagas estão disponíveis também para candidatos com deficiência ou beneficiários reabilitados pelo INSS.,Tractebel,10/09/2019,Estatístico
v1960257,Estágio em Estatística,Brasília,Salário a combinar,1,2019-09-20,Estágio,Empresa: Caixa SeguradoraAtividades a serem desenvolvidas:Contribuir com a consistência análise e interpretação de dados numéricos nos estudos realizados pelo Núcleo de Pesquisa da Diretoria de Comunicação e Experiência do Cliente.Requisitos:A partir do 3º semestreConhecimento do Pacote Office Intermediário/AvançadoDisponibilidade para estagiar 6h/diárias.Local de trabalho: Asa NorteHorário de trabalho: 6h/diárias flexíveisBenefícios: bolsa auxílio VT e VR.,STAG Central de Estágios e Desenvolvimento,Há 2 dias,Estatístico
v1925657,Cientista de Dados (Estatístico),São Paulo,Salário a combinar,1,2019-09-20,Sênior,O que você terá de responsabilidade: • Para essa vaga contamos que você nos ajude a analisar os dados disponíveis e a tirar o máximo valor destes para que possamos tomar decisões de negócio baseadas em dados e a construir novos modelos de machine learning• Sugerir novas fontes de dados além das que possuímos atualmente• Selecionar features para construir e/ou otimizar modelos utilizando técnicas de machine learning• Aprimorar/sugerir procedimentos de coleta de dados para incluir informações relevantes para a construção dos modelos• Usar modelagem preditiva para melhorar e otimizar as experiências dos clientes e outros resultados de negócios• Ter perfil de pesquisador. Explorar e estudar artigos científicos que auxiliem no desenvolvimento de novos algoritmos. Temos muitos desafios e várias investigações e pesquisas a serem feitas!  O que buscamos em você:  • Domínio de Python ou R• Desenvolvimento de APIs em Python• Feature Engineering• Jupyter numpy pandas scikitlearn matplotlib seaborn etc• Machine Learning (supervisionado e não supervisionado)• Domínio em algoritmos de processamento em linguagem natural• Mineração transformação e análise de dados• Métricas de performance de modelos: precision recall ROC F1 accuracy etc.  + Plus + • Flask• SQL (busca/recuperação de informação)• Modelagem Matemática e Estatística• Hadoop Hive Spark. O que iremos te oferecer: Pacote básico• auxílio desenvolvimento p/ cursos• auxílio creche (crianças até 5 anos)• convênio médico Porto Seguro• convênio odontológico MetLife• VT fretado ou auxílio estacionamento• VR de R$3200/dia• cesta de natal• seguro de vida     Nossos diferenciais• Great Place To Work TI (201420152016)• ambiente informal• horário flexível•possibilidade de fazer homeoffice alguns dias• café da manhã e da tarde + fruta• ginástica laboral quick massage e assessoria esportiva• parceria com a Gympass• videogame revistas & jornais• parabéns com coxinha e bolo todo mês • festas e eventos ao longo do ano• troca de conhecimento através de palestras e workshops internos• wifi aberto para dispositivos pessoais• parcerias com universidades e escolas de idiomas • fácil acesso de carro trem ou fretado Local de trabalho:Brooklin Novo (Zona Sul São Paulo/SP) Se você tem o perfil para trabalhar neste ambiente desafiador onde todos fazem o que querem e todo mundo tem tudo a ver com isso se inscreva!,VAGAS.com,17/07/2019,Estatístico
v1953616,Estagiário em Estatística ou Matemática,Rio de Janeiro,R$ 1.004,1,2019-09-20,Estágio,Atividades do cargo: Preenchimento e criação de planilhas de Excel Envio e apuração de pesquisas de opinião através de programa específico Relatórios estatístico de eficiência dos projetos Envio de maladireta pelo word. Requisitos mandatórios: Estar cursando matemática ou estatística Excel avançado Ter disponibilidade de atuar de seg a sexta de 9h às 16h Possuir fácil acesso a São Cristóvão.,Manpower Staffing,06/09/2019,Estatístico
v1950642,Consultor - Estatístico - SAS,Rio de Janeiro,Salário a combinar,1,2019-09-20,Pleno,Descrição das atividadesExtração de base de dados (SAS/SQL) confecção de relátorios e análises financeiras.Desenvolvimento de informações e apresentações gerenciais para comitês executivos.Desenvolvimento de modelos estatísticos voltados para aumento da curva recupureção e redução de churn.Identificação de desvios no bad debt.Conhecimento e Experiência desejávelExperiência em manipulação de bases de dados com grande volume. (SAS)Formação desejávelAnálise de Sistemas ou EstatisticaEscolaridade MínimaSuperior CompletoEmpresa e Local de TrabalhoM300 TIM S.A.RJ Rio de Janeiro,TIM Brasil,10/09/2019,Estatístico
v1950707,Consultor Sênior - Estatístico - SAS,Rio de Janeiro,Salário a combinar,1,2019-09-20,Sênior,Descrição das atividadesFocal de Informações gerenciais para os Clientes Live residencial e convergencia.Extração de base de dados (SAS/SQL) confecção de relátorios e análises financeiras.Desenvolvimento de informações e apresentações gerenciais para comitês executivos.Desenvolvimento de modelos estatísticos voltados para aumento da curva recupureção e redução de churn.Identificação de desvios no bad debt.Conhecimento e Experiência desejávelManipulação de dados em SAS e desenvolvimento de diagnosticos.Formação desejávelAnálise de Sistemas ou EstatisticaEscolaridade MínimaSuperior CompletoEmpresa e Local de TrabalhoM300 TIM S.A.RJ Rio de Janeiro,TIM Brasil,10/09/2019,Estatístico
v1955641,Assistente de Avaliação em Estatística,Belo Horizonte,Salário a combinar,1,2019-09-20,Júnior/Trainee,Atividades a serem desempenhadas:•         Organização do cronograma e pastas do repositório•         Acompanhamento abertura  e atualização de quadros e cards nas ferramentas de gestão à vista•         Confecção e atualização de planilhas de controle (Ex: Banco de Itens Erratas Anulações)•         Trâmite de conferências de questões com analistas pedagógicos em rodagens•         Conferência das máscaras dos simulados na plataforma•         Elaboração de planilhas e relatórios de reports à coordenação e gerência. Requisitos:Superior completo ou cursando em Estatística. Jornada de Trabalho: 44hs semanais.,Bernoulli Educação,10/09/2019,Estatístico
v1960858,Analista de Avaliação e Estatística,Belo Horizonte,Salário a combinar,1,2019-09-20,Júnior/Trainee,Atividades a serem desempenhadas: Preparar arquivos de rodagemRodar simulado com TRIAnálise de dados dos resultadosAtualizar Dashboard com SimuladosEntregar/conferir o ranking ENEM (anual). Requisitos:• Superior completo ou cursando em Estatística.,Bernoulli Educação,Há 2 dias,Estatístico
v1954379,"Estágio em Administração, Economia ou Estatística",Brasília,R$ 1.200,1,2019-09-20,Estágio,Segmento da empresa: TelecomunicaçãoAtividades a serem desenvolvidas:Auxiliar nas atividades operacionais na Diretoria de planejamento comercial. Geração de relatórios gerenciai manipulação de base de dados.Atender e preparar informações para atualização de banco de dados em sistema Tablo.Requisitos: a partir do 6º semestre e conhecimento intermediário em Excel.Local de trabalho: Asa NorteHorário de trabalho: 9h às 16h (com 1h de almoço) de segunda a sexta.Remuneração: R$ 1.20000Benefícios: VT + VR,STAG Central de Estágios e Desenvolvimento,09/09/2019,Estatístico
v1954856,Analista de Informações Gerenciais - Júnior (Estatística),São Paulo,Salário a combinar,1,2019-09-20,Júnior/Trainee,Do dia a dia:Elaboração de relatórios gerenciais técnicoestatísticos para acompanhar indicadores e resultados dos produtos de segurosElaboração de algoritmos de extração de dados para suporte de análises e relatórios estatísticosManipulação e manutenção de base de dadosParticipar do desenvolvimento de projetos de informação e análise de dados. O que é importante:Formação superior completa em: Administração Finanças Matemática Estatística e áreas similaresConhecimentos em SAS/SQL. Local de trabalho: Morumbi São Paulo SP.,HDI SEGUROS,09/09/2019,Estatístico
v1958292,Estágio - Matemática ou Estatística - Inteligência de Mercado,São Paulo,Salário a combinar,1,2019-09-20,Estágio,Buscamos talentos que tenham paixão em transformar números em informações estratégicas. Vaga exclusiva para: Estudantes de Matemática ou Estatística. Requisitos: Cursando Matemática ou Estatística a partir do 5° semestre Será um diferencial ter habilidades em Excel (gerar relatórios gráficos). Informações:Atuação: Inteligência de Mercado departamento responsável pela organização e análises de bases de dados para fins estratégicos da empresa. Local de realização do estágio:  Zona Oeste/SP  Vila Progredior/MorumbiOferecemos: Bolsa Auxílio + ValeTransporte + restaurante no local (café da manhã e almoço) e seguro de vidaJornada: segunda a sexta 06 horas de estágio período manhã. Responsabilidades: O estagiário será desenvolvido para realizar construção interpretar informações e  tratamento de bases de dados (Excel e Access) Construir relatórios analíticos Dar suporte às áreas de Inteligência de Mercado e Planejamento Estratégico.,CRISTÁLIA  Produtos Químicos Farmacêuticos,Há 7 dias,Estatístico
v1943426,Consultor Sênior - Marketing - CRM - Estatístico (Telecomunicações),Rio de Janeiro,Salário a combinar,1,2019-09-20,Sênior,Descrição das atividades Monitoramento de novas receitas do negócio PréPago (TIM Ads e Crédito Especial) Análises estatísticas para subsidiar o negócio pré pago por novas formas de receita Alinhamento de Projetos das demais áreas que impactam o negócio Pré Pago Análises dos impactos ou possíveis impactos nos indicadores Pré Pago das novas receitasConhecimento e Experiência desejável Experiência no mercado de Telecom Conhecimento em SAS SQL Excel Power Point Bom relacionamento interpessoal com áreas paresFormação desejávelEstatística Administração Engenharia da Produção Ciência de Dados Sistemas de InformaçãoEscolaridade MínimaSuperior CompletoEmpresa e Local de TrabalhoM300 TIM S.A.RJ Rio de Janeiro,TIM Brasil,26/08/2019,Estatístico
v1934956,"Consultor - Banco de Dados, Indicadores e Modelos - Foco em Estatística",Rio de Janeiro,Salário a combinar,1,2019-09-20,Júnior/Trainee,Descrição das atividadesCriação e manutenção de relatórios gerenciais e painéis de indicadoresGeração de bases de dados para realização de Análises Realização de análises de comportamento de clientes.Conhecimento e Experiência desejávelExperiência em Banco de Dados para extração de informação e construção de relatórios e dashboards. Possuir bom conhecimento em Excel e em SAS Enterprise Guide. Conhecimento em BIG DATA será considerado um diferencialExperiência em geração de indicadores e extração de dados Importante: ser flexível à mudanças de escopo de trabalho ter senso de urgência e comprometimento com prazos possuir forte espírito de equipe e colaboração.Formação desejávelGraduado em Estatística Ciência da Computação Análise de Sistemas Sistemas de Informação ou Tecnologia da Informação.Escolaridade MínimaSuperior CompletoEmpresa e Local de TrabalhoM300 TIM S.A.RJ Rio de Janeiro,TIM Brasil,12/09/2019,Estatístico
v1946843,Cientista de Dados,Distrito Federal,Salário a combinar,1,2019-09-20,Sênior,Conhecimentos: Conhecimentos avançados em Data Mining Conhecimento avançado de SQL Conhecimento e experiência no desenvolvimetno de modelos utilizando algoritmos de Machine Learning Regressão logísticaÁrvore de decisão KNN Random Forests Técnicas resampling Validação de Performance de Modelos Domínio de um pacote estatístico R ou Python ou SASVisualização de Dados Será um diferencial:  Conhecimento de SAS enterprise Miner – Reiforcement Learning Redes Neurais autoregressivas e Modelos Bayesianos – Experiência em estatística aplicada a serviços financeiros (Banking)Atividades a serem Desenvolvidas:Análise exploratória dos dadosImplantação e desenvolvimento de modelos estatísticos Validação de performance dos modelos,Vert Soluções em TIC,26/08/2019,Estatístico
v1949959,Analista Operacional,Canaã dos Carajás,Salário a combinar,1,2019-09-20,Pleno,Principais Requisitos:•             Conhecimento com tratamento estatístico de dados•             Conhecimento na aplicação de softwares estatísticos•             Elaboração e aplicação de PDCA•             Aplicação da metodologia de 6 Sigmas para tratamento de desvios e problemas tratando a causa raiz.Controle operacional de variáveis de processo análise estatística de dados.Acompanhar as operações das Usinas monitorando as variáveis de processo controlando e fazendo as tratativas de desvios e Não conformidadesFazer interface da operação dos turnos com a gestão das UsinasIdentificação de riscos e de melhorias e atuar para a manutenção dos níveis de produtividadeAssessorar o planejamento estratégico da operação de UsinaCoordenar e/ou orientar as ferramentas da qualidade e segurança.Disponibilidade para atuar com revezamento de turno.,Search Consultoria em Recursos Humanos,30/08/2019,Estatístico
v1929136,Cientista de Dados (Analista de Dados),Uberlândia,Salário a combinar,1,2019-09-20,Pleno,Requisitos:• Superior em Estatística Matemática Análise de Sistemas  Sistemas de Informação Ciência da Computação Gestão da Informação ou áreas correlatas • Experiência em banco de dados – SQL e com modelagem estatística (Machine Learning)• Experiência em linguagens de programação (preferencialmente  R e Python).• Experiência em tratamento manipulação e qualificação de dados. * Todas as vagas do Martins são também disponibilizadas para Pessoas com Deficiência,Martins S/A,24/07/2019,Estatístico
v1943684,Consultor Data Science - Júnior,São Paulo,Salário a combinar,1,2019-09-20,Júnior/Trainee,Funções:          Tratamento estatístico de dados (data mining).          Modelagem preditiva mediante técnicas de machine learning e data science          Modelagem de eventos temporais (séries temporais modelos ARIMA).          Desenvolvimento de modelos de simulação (Monte Carlo).          Revisão e validação de modelos de rating e scoring RAROC e parâmetros de risco.          Apoio matemático ao negócio: desenvolvimento de algoritmos estatística e probabilidade.          Projetos de I+D (Pesquisa e desenvolvimento).  Requisitos:         Estudantes com formação em Julho de 2019 nos cursos: Matemática Física Estatística Engenharia ou outros estudos com forte componente quantitativo.         Também valorizamos conhecimento de técnicas de modelagem (logit GLM séries temporais árvores de decisão clustering etc.) linguagens de programação estatística (SAS R Python Matlab etc) e ferramentas de plataformas de Big Data (Hadoop MongoDB Cassandra Pig Hive etc.)          Valorizamos a realização de estudos específicos de pósgraduação em especial Data Science Finanças Quantitativas ou similar         Alto nível de inglês e conhecimento de outros idiomas.         Disponibilidade para viajar.Outros aspectos: sólida trajetória acadêmica dinamismo vontade de superação capacidade de trabalho Maturidade responsabilidade e facilidade de integração em equipes de trabalho multidisciplinar.Vaga disponível para PCD's,MANAGEMENT SOLUTIONS,20/08/2019,Estatístico
v1945989,Analista de Planejamento de Materiais,Manaus,R$ 3.000 a R$ 4.000,1,2019-09-20,Pleno,Grande Indústria Distribuidora de Energia localizada em Manaus/AM busca profissional para ocupar a posição de Planejador de Materiais (TEMPORÁRIO COM CHANCES DE EFETIVAÇÃO). Formação em Superior Completo em Administração ou Logística Experiência na área de planejamento de estoques Conhecimento em conceitos como classificação ABC PQR XYZ 123 e Estatística (Estatística Descritiva Inferência e modelos de previsão) Conhecimento em indicadores de estoque (Giro Cobertura de Estoque e Nível de Serviço). Domínio no Pacote Office Excel avançado Residir em Manaus.,Luandre,23/08/2019,Estatístico
v1946337,Cientista de Dados (Vaga para Maringá - PR),Maringá,Salário a combinar,1,2019-09-20,Sênior,ATIVIDADES:Mineração e análise de grande volume de dados com o objetivo de prover informações estratégicas para a instituiçãoUtilização de dados para propor melhorias de processos e novos produtosDesenvolvimento de algoritmos de prediçãoTrabalhar em conjunto com outras áreas da empresa e propor soluções.FORMAÇÃO:Curso superior completo em Estatística Economia Tecnologia da Informação Engenharia MatemáticaCONHECIMENTOS TÉCNICOS NECESSÁRIOS:Python / R / SQL avançadosEstatísticaBig Data BI Machine Learning e  IAConhecimento Contábil e Sistema FinanceiroExperiência na área.,Sicoob Central Unicoob,23/08/2019,Estatístico
v1960191,Analista de Garantia da Qualidade-Temporário,Juiz de Fora,Salário a combinar,1,2019-09-20,Júnior/Trainee,Responsável pelas atividades relacionadas a Revisão Periódica de Produtos: Lançamento de dados Elaboração de relatórios Análise estatística Participação nos comitês de RPP.,MEDQUÍMICA INDÚSTRIA FARMACEUTICA,Há 2 dias,Estatístico
v1956270,Técnico em eletrônica ou mecatrônica (equipamentos biomédicos),São Paulo,R$ 3.500 a R$ 3.700,1,2019-09-20,Técnico,Executar tarefas de manutenção corretiva e preventiva em equipamentos biomédicos de alta complexidade. Tarefas administrativas de controles e estatísticas relativas ao setor de engenharia clinica,Confidencial,11/09/2019,Estatístico
v1918393,Bolsista Programa Inova Talentos - IEL / CNPq,Osasco,Salário a combinar,5,2019-09-20,Sênior,Mestres e Doutores em: Matemática Aplicada Estatística e áreas afinsComo utilizar métodos analíticos para gerar vantagem competitiva em uma organização inserida em um ambiente altamente competitivo Conhecimento técnico: Capacitado em técnicas e ferramentas para o tratamento de grande volumes de dados. Ferramentas Estatística (SAS SQL R SPSS Stata)Carga horária de acordo com o plano de atividades acordado com o Tutor do Projeto. Duração: 12 meses. Valor da bolsa: R$3.00000 para MESTRES com no máximo 5 (cinco) anos de titulação.R$4.50000 para DOUTORES com no máximo 5 (cinco) anos de titulação.  Local: Osasco SP,IEL /SP - Inova Talentos,07/08/2019,Estatístico
v1898062,Analista de Dados - BI / Analytics,Niterói,Salário a combinar,1,2019-09-20,Sênior,Prérequisitos: Formação em Estatística Tecnologia da Informação ou Ciência da Computação Pacote Office avançado Fluência em estatística Experiência de programação e familiaridade com sistemas de dados Conhecimentos de Linguagem de Programação em R e SQL Conhecimento de ferramenta de BI Inglês nível avançado para leitura. Principais atribuições: Análise dos resultados quantitativos e qualitativos Definição de plano amostral para estudos Desenvolvimento validação calibração e atualização de modelos preditivos Elaboração de relatórios dashboards e análise de indicadores Elaboração de apresentação para os diferentes níveis de gestão da organização. Local de trabalho: NiteróiSalário + Benefícios: PS+PO+ VT+ TR+ PP+ SVCLT 44 horas semanais,Confidencial,27/05/2019,Estatístico
v1953176,Estagiário -  QHSE,Rio de Janeiro,Salário a combinar,1,2019-09-20,Estágio,Prérequisito necessário:*Cursando:Engenharia (Produção Química Mecânica Naval ou Ambiental).*A partir do 4º período e com disponibilidade mínima de 1 ano para estagiar.*Disponibilidade de 6 horas/diárias (horário comercial).*Desejável conhecimento em dados estatísticos e elaboração de apresentações.*Inglês Fluente.Atividades da área:Implementação/Manutenção do sistema de gestão HSE dos PLSVs Skandis.Atividades do estagiário:O estagiário trabalhará sob mentoria dos Eng. HSE da equipe interfaciando com os times dos projetos PLSVs Skandis. Atuará como na gestão das ferramentas programas e procedimentos de HSE nos PLSVs Skandis assim como registro e análise de dados estatísticos referentes ao desempenho HSE.   Local de Trabalho: Cidade Nova.,TechnipFMC,05/09/2019,Estatístico
v1961161,Especialista de Planejamento de Demanda,São Paulo,Salário a combinar,1,2019-09-20,Pleno,Descrição:Garantir um plano de demanda e previsão com alta qualidade para a Região Sul da América Latina através do trabalho ativo e interação com a equipe de Marketing e Vendas.Executar e garantir processos de planejamento de demanda e enriquecimento com dados de atividades de mercado informações de novos produtos e informações de clientes mensal e semanalmente.Fornece informações por meio do uso de ferramentas de estatísticas considerando dados históricos tendências e sazonalidades.Requisitos:Ter formação completa em administração engenharia estatística ou economiaInglês e Espanhol Microsoft Office (proficiente em Excel)Conhecimentos com  SAP / APOExperiência em planejamento de demandaConhecimento desejável em Supply Chain Vendas Marketing Ciclo de vida do produto.,Adecco,Ontem,Estatístico
