idVaga,NomeVaga,Cidade,Salario,QuantidadeVaga,DataPesquisa,Perfil,Descricao,Empresa,DataPubli,Pesquisa
v1938140,Gestão Projetos /Scrum Master,São Paulo,Salário a combinar,2,2019-09-20,Gerência,Responsabilidades Perfil Senior com foco em gestão de projetos:Imprescindível: Certificação Scrum Master experiência em gestão de projetos PMO boa comunicação organização experiências em projetos ágeis (Scrum Master ou PO)Desejável:  Conhecimento em Big Data  experiência em banco conhecimento em baixa e alta plataforma>> Scrum Master certificados por uma destas entidades:  • Scrum.org • ScrumAlliance.org • Scaledagileframework.com. Atividades:Articulação com várias frentes de projetoReporte do andamento do projeto aos executivosOrganização e condução dos comitês de projetoAcompanhamento do projeto junto a outros timesSuporte aos times de desenvolvimento da definição da solução,GrupoSITI,08/08/2019,cientista-de-dados
v1956582,Estágiário em Dados (Analytics),Barueri,Salário a combinar,1,2019-09-20,Estágio,Você gostaria de trabalhar em um lugar que busca inovar a forma de lidar com dados E o mais legal transformandoo de forma positivaBuscamos estudantes de Engenharias Ciências da Computação Matemática e afins com conhecimento em linguagem SQL para compor nosso time de Dados!Como membro da equipe irá explorar e analisar diversos tipos de dados em grande volume os tratando em plataforma de Big Data e SQL server.Apoiará a automação de processos de geração de bases de dados e relatórios como também o monitoramento de métricas de qualidade de dados. Também irá contribuir com pesquisas sobre novas técnicas estatísticas e computacionais.Quer fazer parte de tudo issoSim você Quod!,Quod,11/09/2019,cientista-de-dados
v1949028,Cientista de Dados,São Paulo,Salário a combinar,1,2019-09-20,Sênior,ATIVIDADES DA ÁREA:Criar analisar e otimizar a performance e engajamento das campanhas no CRMCaptar KPI’s no CRM de dados LTV e estratégiasDefinir estratégias de retenção por categorias e desenvolver um conhecimento aprofundado do que se adequa a cada tipo de usuárioMensurar o sucesso de todas as campanhas e gatilhos através de BI e da plataforma CRM para desenvolver dados e dashboardsTrabalhar com AI na definição de perfis e critérios de segmentação de dadosDesenvolver e implementar uma estrutura analítica no contexto de performance geral dos objetivos de marketing como a efetividade das mídias otimização da taxa de otimização engajamento do consumidor e personalizaçãoEntregar alta performance de Ciência de Dados incluindo informações da fonte de dados processos modelo/algoritmo desenvolvido e tornar insights em ações recomendáveis e sistemáticasAdepto em demonstrar tecnologias analíticas resolvendo problemas de negócios ad hoc inovando em possíveis soluções futuras e trabalhando com parceiros de tecnologia para traduzir suas inovações em soluções analíticas robustas e dimensionadas. REQUISITOS:Conhecimento avançado em BI AI CRM e Data ScienceExperiência e conhecimento em linguagens como Python R JavaInglês avançado e Espanhol (desejável)Graduação completa em Engenharia Estatística Matemática Data Science Marketing correlatas.,Bridgestone,24/07/2019,cientista-de-dados
v1929608,Cientista de Dados,São Paulo,Salário a combinar,1,2019-09-20,Sênior,Data & InsightsPerfil capaz de identificar oportunidades de negócioDescobrir insights de comportamento de clientes e utilizálo na busca de soluçõesBuscar por problemas antes não pensadosDesenvolver aplicações de Machine Learning para impulsionar os resultados do negócio.NecessárioLinguagem SQLBibliotecas Analíticas/ Gráficas como Python ou RTransferir histórias de programação para uma linguagem visual e práticaSerá considerado um diferencialExperiência em desenvolvimento de aprendizado de máquina para precificação dinâmica e banco de dados relacionais (MySQl Oracle Redshift) e também não relacionais (BigQuery)Horário de Trabalho: 8h diárias (horário flexível)Local de Trabalho: Zona Sul de São PauloModelo de Contratação: CLTSalário: A combinarBenefícios: VA ou VR de 3100 por dia (podendo ser divido metade VR e metade VA) / VT conforme necessidade / Assistência medica e odontológica sem coparticipação / Gympass,STATO - São Paulo,26/08/2019,cientista-de-dados
v1947136,Cientista de Dados Sênior,São Paulo,R$ 10 a R$ 14,1,2019-09-20,Sênior,OPORTUNIDADE RANDSTAD: CIENTISTA DE DADOS SÊNIORData Science e Analytics: Hadoop Hive Spark SQL MongoDB Rotinas de ETL Tableau Power BIMachine Learning: Modelos de regressão Árvores de decisão Máquina de vetores de suporte Classificadores Naive Bayes Clusterização Redes neurais PCA Detecção de anomalias Sistemas de recomendaçãoFamiliaridade com tecnologias de ML e Data Science: Python Jupyter Notebook NumPy ScikitLearn SciPy PyTorch Keras TensorFlow e NLTKSoluções AWS de Big Data Machine Learning e Analytics: S3 Glue (Crawlers e ETL) Athena Redshift QuickSight SageMakerConceitos de Estatística Cálculo e Álgebra linear,Randstad,29/08/2019,cientista-de-dados
v1951998,Cientista de Dados,Curitiba,Salário a combinar,1,2019-09-20,Sênior,A BRF uma das maiores empresas de alimentos do Mundo tem investido constantemente em inovação e digitalização para o crescimento e alavancagem dos nossos negócios.O Cientista de Dados será responsável por desenvolver modelos matemáticos de soluções de Business Intelligence (BI) & Analytics em interface direta com as demais áreas da companhia sendo principalmente áreas de tecnologia financeiro e operações.  Se você tem paixão por dados e números gosta de projetos de inovação tem perfil analítico e quer fazer a diferença esperamos por você!! Atividades: Desenvolver modelos matemáticos para implementação de soluções de Business Intelligence (BI) & Analytics Gerar informações requeridas pelas diversas áreas da empresa através de Dashboards Reports e base de dados nos bancos  Interfaces com demais áreas de Tecnologia da companhia e de parceiros para garantir perenidade dos processos desenhados  Realizar testes para garantir a consistência e acuracidade das informações definidas Modelagem de Dados e Gerenciamento de Múltiplas Bases de Dados  Criar e manter a documentação de projeto técnico para assegurar o desenvolvimento preciso de demandas futuras  Seguir políticas procedimentos metodologias e regras de governança de TI Requisitos: Ensino Superior em ciência da computação Estatística Engenharia Matemática ou similares  Conhecimentos necessários:Power BIPythonRSQLWeb Services (REST)ScrapingC# (.NET Core)Estrutura conceitual de Machine learning/data scienceFerramentas de visualização de dados (ex.: Seaborn/Matplotlib/Plotly)Frameworks/softwares de machine learning/data science (ex.: Scikitlearn TensorFlow Weka) Conhecimentos desejáveis:TableauHadoop (Amazon S3 Azure Data Lake Google BigTable)Tecnologias Microsoft Azure para dados (Data Warehouse DataBricks Data Lake Analysis Services Data Factory etc.) Inglês:Leitura escrita e conversação avançada.,BRF,04/09/2019,cientista-de-dados
v1952002,Cientista de Dados,São Paulo,Salário a combinar,1,2019-09-20,Pleno,A BRF uma das maiores empresas de alimentos do Mundo tem investido constantemente em inovação e digitalização para o crescimento e alavancagem dos nossos negócios.O Cientista de Dados será responsável por desenvolver modelos matemáticos de soluções de Business Intelligence (BI) & Analytics em interface direta com as demais áreas da companhia sendo principalmente áreas de tecnologia financeiro e operações.  Se você tem paixão por dados e números gosta de projetos de inovação tem perfil analítico e quer fazer a diferença esperamos por você!! Atividades: Desenvolver modelos matemáticos para implementação de soluções de Business Intelligence (BI) & Analytics Gerar informações requeridas pelas diversas áreas da empresa através de Dashboards Reports e base de dados nos bancos  Interfaces com demais áreas de Tecnologia da companhia e de parceiros para garantir perenidade dos processos desenhados  Realizar testes para garantir a consistência e acuracidade das informações definidas Modelagem de Dados e Gerenciamento de Múltiplas Bases de Dados  Criar e manter a documentação de projeto técnico para assegurar o desenvolvimento preciso de demandas futuras  Seguir políticas procedimentos metodologias e regras de governança de TI Requisitos: Ensino Superior em ciência da computação Estatística Engenharia Matemática ou similares  Conhecimentos necessários:Power BIPythonRSQLWeb Services (REST)ScrapingC# (.NET Core)Estrutura conceitual de Machine learning/data scienceFerramentas de visualização de dados (ex.: Seaborn/Matplotlib/Plotly)Frameworks/softwares de machine learning/data science (ex.: Scikitlearn TensorFlow Weka) Conhecimentos desejáveis:TableauHadoop (Amazon S3 Azure Data Lake Google BigTable)Tecnologias Microsoft Azure para dados (Data Warehouse DataBricks Data Lake Analysis Services Data Factory etc.) Inglês:Leitura escrita e conversação avançada.,BRF,04/09/2019,cientista-de-dados
v1914268,Cientista de Dados,Chapecó,Salário a combinar,1,2019-09-20,Pleno,Resolver problemas a partir da análise de dados coletados Identificar tendência para o alcance de bons resultados Interpretar algoritmos matemáticos entre outros.,Confidencial,10/07/2019,cientista-de-dados
v1921628,Cientista de Dados,São Paulo,Salário a combinar,1,2019-09-20,Sênior,Prérequisitos:• Graduação completa: Preferencialmente em Estatística Matemática ou Ciências da Computação. • Mandatório experiência com softwares R Alteryx e Tableau.• Necessário conhecimento em estatística avançada.• Necessário Excel avançado. • Inglês intermediário Desejável.• Imprescindível ter experiência prévia em manipulação e análise de dados. Atividades inerentes ao cargo:• Responsável pela manipulação de grandes volumes de informações de diferentes fontes e em diferentes formatos.• Desenvolver modelos matemáticos para implementação de soluções de Business Intelligence (BI) & Analytics que tragam insights relacionados a produtos e tipos de clientes.• Usar modelagem preditiva para aumentar e otimizar geração de receita através de mudanças nos preços e avaliação da efetividade promocional.• Identificar novas oportunidades de alavancar os dados da empresa para gerar soluções de negócioão de mudanças nos scripts da programação dos softwares requeridas pelo time de Pricing.• Identificar novas oportunidades de alavancar os dados da empresa para gerar soluções de negócioão de mudanças nos scripts da programação dos softwares requeridas pelo time de Pricing. *Diversidade e igualdade andam lado a lado na Avon. Esta vaga também destinase a pessoas com deficiência.,Avon,21/07/2019,cientista-de-dados
v1927402,Cientista de Dados,São Paulo,Salário a combinar,1,2019-09-20,Pleno,AtividadesUtilizar grande quantidade de dados estruturados ou não estruturados na resolução de problemas de negócios através da utilização de técnicas orientadas a dadosEncontrar ordem ou padrão dos dados através de análises garantindo identificação de tendênciasApresentação daS análises utilizando metodologias de data visualization e garantindo maior entendimento das áreas de negócioSolução de problemas de negócio através da utilização de recursos de machine learning garantindo aperfeiçoamento de tarefas que podem ser desempenhadas por máquinasIdentificação de insights através de análise de dados textuais para enriquecimento de modelos de dadosRequisitosEnsino Superior CompletoAtuação como Cientista de dados em times ágeisHorário de Trabalho08:00 18:00 horas (2ª a 6ª feira)LocalUnidade Bela Vista São Paulo/SP (próximo ao Metrô Trianon/MASP) No SírioLibanês temos o compromisso com a diversidade e a inclusão. Todas as nossas vagas respeitam essas premissas. Faça parte da nossa equipe!,Hospital Sírio-Libanês,Há 7 dias,cientista-de-dados
v1957835,Cientista de Dados,São Paulo,Salário a combinar,1,2019-09-20,Pleno,Atividades a serem realizadas: Desenvolvimento implementação integração e manutenção de préprocessamento e análise exploratória de dados visualizações e modelos preditivosDesign e integração de soluções endtoend para ambientes analíticos utilizando Big Data Garantir escalabilidade disponibilidade constante atualização tolerância a falhas e desempenho otimizado de soluções analíticas implementadas em contexto Big Data Criar e manter visualizações interativas avançadas para facilitar interpretação e análise de dados integrando vários componentes de relatórios de várias fontes de dados Documentação de rotinas utilizadas para análise a fim de garantir reproducibilidade por outros membros da área Garantir prazos de entrega de acordo com planos de trabalho reportando cronogramas e definindo ações de melhorias Trabalhar em colaboração com os gerentes de projeto para entender suas necessidades analíticas a fim de fornecer insights e soluções para a tomada de decisão Dar suporte às equipes de projetos e demais membros da área possibilitando a rápida movimentação e análise de dadosRequisitos: Proficiência em Python ou R Domínio de bibliotecas essenciais para ciências de dados como: numpy pandas scipy re seaborn sklearn plotly dash e Tensorflow ou PyTorch Experiência em preprocessamento visualização e análise de dados e modelos preditivos Experiência com desenvolvimento colaborativo em sistema de version control (Git) Experiência com práticas de engenharia de software para desenvolvimento sustentável  Experiência com queries SQL bancos relacionais e conhecimento de ecossistema Hadoop Proatividade em encontrar soluções de forma independente para problemas do diaadia Análise crítica e criativa com enfoque em dados e resultados de análises e predições Capacidade de trabalhar em equipe interdisciplinar valorizando os potenciais individuais Engajamento e contribuição ativa com desenvolvimento e conclusão de projetos da áreaDesejável: Nível de inglês avançado Conhecimento em sistema Linux/Unix Conhecimentos avançados de inferência estatística Conhecimentos teóricos matemáticos de modelos preditivos Conhecimento em desenvolvimento de testes de integração automatizados Conhecimento de fundamentos de segurança de dados e informações sensíveis Conhecimento de agendamento de tarefas periódicas para atualizações automatizadasLocal de Trabalho: MorumbiÁrea: Big DataCarga horária: 220 Horas/ mês,Hospital Albert Einstein,11/09/2019,cientista-de-dados
v1957395,Cientista de Dados,São Paulo,Salário a combinar,1,2019-09-20,Sênior,Na Recovery o Cientista de dados será responsável por otimizar as estratégias digitais (canais marketing e CRM) a partir de análises de dados.O que seria bacana você ter e conhecer:Graduação: Estatística Ciência da Computação Física Matemática Engenharia ou áreas afinsConhecimentos em R Python SQL e SAS                                 Experiência com técnicas de modelagem estatística e machine learning (regressão clustering árvores de decisão redes neurais artificiais etc.)Conhecimento em Processamento de Linguagem Natural  e experiência com dados não estruturados            Experiência com banco de dados relacionais (NoSQL SQL Server Oracle MySQL PostgreSQL)Desejável conhecimento em frameworks de deep learning (Tensorflow Keras PyTorch CNTK etc). O que você terá que fazer:Estruturar bases de dados para viabilização de análises estatísticas e de aprendizado de máquina      Investigar avaliar a utilidade e criar processos de coleta de novas fontes de dados para o negócioClusterizar bases de dados para otimização das ações e testes da estratégia digital da empresaUtilizar modelagem preditiva para criação de triggers digitais a fim de maximizar a geração de receita solucionar problemas de negócio (contactabilidade e abandono) bem como melhorar a experiência do cliente e impulsionar sua adoção às plataformas digitais da empresaSelecionar e implantar técnicas de modelagem e de processamento de linguagem natural para alavancar performance dos BOTs de negociaçãoImplementação e mensuração de testes A/B para avaliação das ações testadas.              Quer saber o que temos de mais legal por aqui Dá uma olhada!Incentivamos nossa galera a buscar conhecimento sempre por isso temos um Programa de Incentivo à Educação que pode bancar parte dos estudos de quem tiver interesseUm dos momentos mais importantes na vida de uma pessoa é o nascimento do seu filho. Pensando nisso a Recovery oferece para as mamães a licençamaternidade estendida de 6 meses e para os papais a possibilidade de ficar 20 dias com a família em licençapaternidadeEstimulamos que o nosso time esteja sempre em movimento para isso temos por aqui o GymPass e Ginástica Laboral no escritórioGostamos de comemorar nosso desempenho e um dos nossos lemas é celebrar os bons momentos. Encontramos a melhor forma de fazer isso: Happy Hour com a galera no escritórioEstamos no coração de São Paulo a Avenida Paulista é a nossa casa. Quer ser parte do nosso time Vem #todosjuntos fazemos a diferença!,Grupo Recovery,12/09/2019,cientista-de-dados
v1946337,Cientista de Dados (Vaga para Maringá - PR),Maringá,Salário a combinar,1,2019-09-20,Sênior,ATIVIDADES:Mineração e análise de grande volume de dados com o objetivo de prover informações estratégicas para a instituiçãoUtilização de dados para propor melhorias de processos e novos produtosDesenvolvimento de algoritmos de prediçãoTrabalhar em conjunto com outras áreas da empresa e propor soluções.FORMAÇÃO:Curso superior completo em Estatística Economia Tecnologia da Informação Engenharia MatemáticaCONHECIMENTOS TÉCNICOS NECESSÁRIOS:Python / R / SQL avançadosEstatísticaBig Data BI Machine Learning e  IAConhecimento Contábil e Sistema FinanceiroExperiência na área.,Sicoob Central Unicoob,21/08/2019,cientista-de-dados
v1944831,Talent Pool - Diversidade na TI : Cientista de Dados,São Paulo,Salário a combinar,30,2019-09-20,Pleno,O mercado de trabalho segue em constante evolução e aprimoramento e nós seguimos fluindo junto aos nossos clientes neste movimento de inovação e igualdade no ambiente corporativo. Necessário Superior Completo e Experiência prévia na função.Inglês Avançado Nós Apoiamos a Diversidade!  Deixe seu currículo em nosso banco de talentos para oportunidades como Cientista de Dados !,Confidencial,23/08/2019,cientista-de-dados
v1927404,Cientista da Computação,São Paulo,Salário a combinar,1,2019-09-20,Pleno,AtividadesSolução de problemas através da aplicação de algoritmos e garantindo utilização adequada de recursos computacionaisIntegração de sistemas através do desenvolvimento de camadas agnósticas permitindo aderência ao desenho de arquitetura corporativaTrabalhar com um time multidisciplinar formado por outros profissionais de TI e áreas de negócio garantindo a entrega de solução com máximo atendimento ao negócioSolução de problemas de negócio através da utilização de recursos de machine learning garantindo aperfeiçoamento de tarefas que podem ser desempenhadas por máquinasIdentificação de insights através de análise de dados textuais para enriquecimento de modelos de dados RequisitosEnsino Superior CompletoDesejável pósgraduaçãoAtuação como desenvolvedor/arquiteto em times ágeisHorário de Trabalho08:00 18:00 horas (2ª a 6ª feira)LocalUnidade Bela Vista São Paulo/SP (próximo ao Metrô Trianon/MASP) No SírioLibanês temos o compromisso com a diversidade e a inclusão. Todas as nossas vagas respeitam essas premissas. Faça parte da nossa equipe!,Hospital Sírio-Libanês,21/07/2019,cientista-de-dados
v1927403,Engenheiro de Dados,São Paulo,Salário a combinar,1,2019-09-20,Pleno,AtividadesCriar pipelines de integração através do desenvolvimento alinhado com o time de arquitetura e garantindo qualidade no dadoCombinação de fontes de dados nos processos de ingestão garantindo maior qualidade de informações disponíveis para cientistas de dados e demais consumidoresColaborar com a equipe de cientistas de dados entendendo suas reais necessidades e garantindo aderência da entrega ao timeIdentificação do dado correto através do entendimento da operação permitindo geração de dados consumíveis e com alta capacidade de utilizaçãoRequisitosEnsino Superior CompletoDesejável pósgraduaçãoAtuação como engenheiro de dados em times ágeisHorário de Trabalho08:00 18:00 horas (2ª a 6ª feira)LocalUnidade Bela Vista São Paulo/SP (próximo ao Metrô Trianon/MASP) No SírioLibanês temos o compromisso com a diversidade e a inclusão. Todas as nossas vagas respeitam essas premissas. Faça parte da nossa equipe!,Hospital Sírio-Libanês,21/07/2019,cientista-de-dados
v1959576,Engenheiro de Dados,São Paulo,Salário a combinar,1,2019-09-20,Pleno,Sobre a vaga:Você fará parte do time de dados que suporta todos os produtos da Geofusion. Como Engenheiro de Dados seu trabalho será desenvolver soluções confiáveis e escaláveis para nossos dados com foco em processamento armazenamento e disponibilização de grandes volumes de informação utilizando múltiplas plataformas. Para se candidatar a esta vaga precisamos que você tenha: Formação em Ciência  da Computação Engenharia de Computação Análise de Sistemas Sistemas de Informação ou área relacionada Experiência criando gerenciando e otimizando modelos de dados e databases NoSQL (MongoDB e Solr) e RDBMS (Oracle) Experiência em linguagem de programação preferencialmente Python Conhecimento em sistema Linux Experiência prática interagindo e programando em plataforma de processamento paralelo massivo em no mínimo uma das seguintes ferramentas: Hadoop Hive MapReduce Spark. Requisitos desejáveis: Experiência criando pipelines de fluxo de dados Experiência criando APIs de dados Experiência com Docker GoCD e/ou outras ferramentas de entrega contínua. Suas principais responsabilidades serão: Trabalhar nas definições de dados (levantamento e preparação) Desenvolver soluções para que as/os Cientistas de Dados e Analistas possam fazer suas análises Ajudar a definir as tecnologias de banco de dados mais indicadas apra cada tipo de cenário Resolver problemas de processamento armazenamento e disponibilização de grandes volumes de dados Implantar e escalar soluções de dados. Benefícios: Auxílio creche para crianças até 5 anos Vale refeição Vale transporte Seguro de vida Assistência Médica (AMIL) Assistência Odontológica (AMIL) Desconto no Gympass Dayoff no seu aniversário Horário flexível.,Geofusion,Há 3 dias,cientista-de-dados
