idVaga,NomeVaga,Cidade,Salario,QuantidadeVaga,DataPesquisa,Perfil,Descricao,Empresa,DataPubli,Pesquisa
v1954504,Estatístico,São Paulo,Salário a combinar,1,2019-09-27,Júnior/Trainee,QUALIFICAÇÕES NECESSÁRIAS:Conhecimento de modelagem estatística utilizando RConhecimento em Python Inglês AvançadoQUALIFICAÇÕES DESEJÁVEIS:Conhecimento em Machine LearningConhecimento em linguagem SQLConhecimento em AlteryxO profissional atuará no desenvolvimento de modelos estatísticos em R e Python para uso associado ao Qlik e Alteryx.,Nórdica Software,09/09/2019,Estatístico
v1924547,Estatístico,São Paulo,Salário a combinar,1,2019-09-27,Pleno,Responsabilidades:O profissional será responsável pelas seguintes atividades:• Realizar cálculos estatísticos a partir de dados educacionais oficiais e dados coletados em pesquisas avaliações e plataformas educacionais. • Acompanhar e validar análises estatísticas realizadas por fornecedores. • Realizar com autonomia e assertividade as principais etapas do processo de análise de dados: captura e manipulação tratamento e higienização exploração e análises descritivas interpretação e apresentação dos resultados.Requisitos:*Formação: Estatística Matemática Economia Engenharia Tecnologia ou áreas afins. Mestrado é um diferencial.*Conhecimentos Técnicos:• Habilidades de captura manipulação tratamento e higienização de dados• Necessário conhecimento em ferramentas de bancos de dados (SQL)• Excel avançado e programas de pacotes estatísticos• Desejável experiência com modelos e ferramentas de machine learning (R e/ou Python)• Desejável vivência com análise de dados educacionais preferencialmente com avaliação educacional por meio da Teoria da resposta ao Item (TRI).Modalidade de contratação:CLTLocal de trabalho:Matriz Zona Leste de São PauloHorário:ComercialRemuneração:A combinarFacilidades:Convênio médio o odonto VT VARestaurante na empresa Seguro de vida Previdência privada e PLR.,Editora Moderna,16/07/2019,Estatístico
v1955694,Estágio - Estatística,Belo Horizonte,Salário a combinar,1,2019-09-27,Estágio,ATRIBUIÇÕES DO CARGO:Auxiliar nos programas de monitoramento do Projeto Básico Ambiental da UHE Belo Monte e em outros projetos de licenciamento ambiental.Realizar atividades relacionadas à compilação atualização e gestão de planilhas e banco de dados específicos dos referidos programas ambientais.Apoio na elaboração das análises dos relatórios técnicos desenhos gráficos tabelas e mapas (AutoCad e/ou Gis) relacionados às demandas em processos de licenciamento ambiental incluindo o desenvolvimento e modificação de sintaxes e algoritmos.    COMPETÊNCIAS NECESSÁRIAS: Conhecimento em Excel R (intermediário) e AccessBons conhecimentos nos demais programas do Pacote OfficeDesejável conhecimento avançado do RCursando Estatística 3º anoOUTRAS INFORMAÇÕES:Todas as nossas vagas estão disponíveis também para candidatos com deficiência ou beneficiários reabilitados pelo INSS.,Tractebel,10/09/2019,Estatístico
v1945218,Atuário / Estatístico Sr.,São Paulo,Salário a combinar,1,2019-09-27,Sênior,Atividades do cargo: Elaboração de nota técnica atuarial Precificação de planos de saúde Provisões técnicas Análise de indicadores por carteira (por produto tipo de contratação etc.) Teste de Adequação de Passivo e Cálculo de capital mínimo Acompanhar obrigações junto a ANS Apuração de despesas assistenciais (sinistralidade) Análise demográfica dos beneficiários. Conhecimentos necessários: Ensino Superior completo em Ciências Atuariais Matemática ou Estatística Pósgraduação cursando/completa em áreas relacionadas (Finanças Economia Estatística Matemática e afins) Excel avançado Conhecimento em programas estatísticos como: SAS SQL R Pyton Stata SPSS etc Desejável inglês intermediário Essencial ter atuado em empresas dos ramos de: assistência médica previdência ou seguros.,UNIMED FESP,22/08/2019,Estatístico
v1960257,Estágio em Estatística,Brasília,Salário a combinar,1,2019-09-27,Estágio,Empresa: Caixa SeguradoraAtividades a serem desenvolvidas:Contribuir com a consistência análise e interpretação de dados numéricos nos estudos realizados pelo Núcleo de Pesquisa da Diretoria de Comunicação e Experiência do Cliente.Requisitos:A partir do 3º semestreConhecimento do Pacote Office Intermediário/AvançadoDisponibilidade para estagiar 6h/diárias.Local de trabalho: Asa NorteHorário de trabalho: 6h/diárias flexíveisBenefícios: bolsa auxílio VT e VR.,STAG Central de Estágios e Desenvolvimento,18/09/2019,Estatístico
v1925657,Cientista de Dados (Estatístico),São Paulo,Salário a combinar,1,2019-09-27,Sênior,O que você terá de responsabilidade: • Para essa vaga contamos que você nos ajude a analisar os dados disponíveis e a tirar o máximo valor destes para que possamos tomar decisões de negócio baseadas em dados e a construir novos modelos de machine learning• Sugerir novas fontes de dados além das que possuímos atualmente• Selecionar features para construir e/ou otimizar modelos utilizando técnicas de machine learning• Aprimorar/sugerir procedimentos de coleta de dados para incluir informações relevantes para a construção dos modelos• Usar modelagem preditiva para melhorar e otimizar as experiências dos clientes e outros resultados de negócios• Ter perfil de pesquisador. Explorar e estudar artigos científicos que auxiliem no desenvolvimento de novos algoritmos. Temos muitos desafios e várias investigações e pesquisas a serem feitas!  O que buscamos em você:  • Domínio de Python ou R• Desenvolvimento de APIs em Python• Feature Engineering• Jupyter numpy pandas scikitlearn matplotlib seaborn etc• Machine Learning (supervisionado e não supervisionado)• Domínio em algoritmos de processamento em linguagem natural• Mineração transformação e análise de dados• Métricas de performance de modelos: precision recall ROC F1 accuracy etc.  + Plus + • Flask• SQL (busca/recuperação de informação)• Modelagem Matemática e Estatística• Hadoop Hive Spark. O que iremos te oferecer: Pacote básico• auxílio desenvolvimento p/ cursos• auxílio creche (crianças até 5 anos)• convênio médico Porto Seguro• convênio odontológico MetLife• VT fretado ou auxílio estacionamento• VR de R$3200/dia• cesta de natal• seguro de vida     Nossos diferenciais• Great Place To Work TI (201420152016)• ambiente informal• horário flexível•possibilidade de fazer homeoffice alguns dias• café da manhã e da tarde + fruta• ginástica laboral quick massage e assessoria esportiva• parceria com a Gympass• videogame revistas & jornais• parabéns com coxinha e bolo todo mês • festas e eventos ao longo do ano• troca de conhecimento através de palestras e workshops internos• wifi aberto para dispositivos pessoais• parcerias com universidades e escolas de idiomas • fácil acesso de carro trem ou fretado Local de trabalho:Brooklin Novo (Zona Sul São Paulo/SP) Se você tem o perfil para trabalhar neste ambiente desafiador onde todos fazem o que querem e todo mundo tem tudo a ver com isso se inscreva!,VAGAS.com,17/07/2019,Estatístico
v1953616,Estagiário em Estatística ou Matemática,Rio de Janeiro,R$ 1.004,1,2019-09-27,Estágio,Atividades do cargo: Preenchimento e criação de planilhas de Excel Envio e apuração de pesquisas de opinião através de programa específico Relatórios estatístico de eficiência dos projetos Envio de maladireta pelo word. Requisitos mandatórios: Estar cursando matemática ou estatística Excel avançado Ter disponibilidade de atuar de seg a sexta de 9h às 16h Possuir fácil acesso a São Cristóvão.,Manpower Staffing,06/09/2019,Estatístico
v1955641,Assistente de Avaliação em Estatística,Belo Horizonte,Salário a combinar,1,2019-09-27,Júnior/Trainee,Atividades a serem desempenhadas:•         Organização do cronograma e pastas do repositório•         Acompanhamento abertura  e atualização de quadros e cards nas ferramentas de gestão à vista•         Confecção e atualização de planilhas de controle (Ex: Banco de Itens Erratas Anulações)•         Trâmite de conferências de questões com analistas pedagógicos em rodagens•         Conferência das máscaras dos simulados na plataforma•         Elaboração de planilhas e relatórios de reports à coordenação e gerência. Requisitos:Superior completo ou cursando em Estatística. Jornada de Trabalho: 44hs semanais.,Bernoulli Educação,18/09/2019,Estatístico
v1960858,Analista de Avaliação e Estatística,Belo Horizonte,Salário a combinar,1,2019-09-27,Júnior/Trainee,Atividades a serem desempenhadas: Preparar arquivos de rodagemRodar simulado com TRIAnálise de dados dos resultadosAtualizar Dashboard com SimuladosEntregar/conferir o ranking ENEM (anual). Requisitos:• Superior completo ou cursando em Estatística.,Bernoulli Educação,10/09/2019,Estatístico
v1962878,Analista de Modelagem e Estatística Júnior / Pleno e Sênior,São Paulo,Salário a combinar,3,2019-09-27,Sênior,Descrição da área:A Modelagem Estatística é referência para testar hipóteses e fornecer insights para as áreas de negócios. No departamento Automóvel por exemplo além de fornecer informações estratégicas é responsável pela construção e manutenção dos modelos de risco que compõem o processo de precificação dos seguros.O papel do analista é manipular um grande volume de dados conhecer todos os processos o negócio e a forma como seus clientes e corretores atuam. Uma condição importante é equilibrar o conhecimento estatístico e o de negócio além de transmitir as informações e insights produzidos de forma direta e simples.A área faz parte da Diretoria de Atuária e Estatística. Requisitos:Superior Completo preferencialmente nos cursos de Estatística Atuária Matemática ou Engenharia.Domínio do Pacote OfficeConhecimento do Software SASConhecimentos de Técnicas de Modelagem: Regressão Logística Modelos Lineares Generalizado Árvore de Decisão e outros (conhecimento será avaliado em teste técnico).Atividades:Participar da construção de modelos interagindo com os clientes internos para levantamento de suas necessidades com a equipe de estatísticos para identificação da melhor forma de desenvolvimento e aplicação e com a área de sistemas para obtenção de dados e definição da implantação dos modelos.Validar e a implantar os modelos de precificação fraude e aceitação.Auxiliar a equipe na aplicação de novas técnicas de segmentação e de modelagem preditiva (frequência e custo de sinistro) servindose da técnica mais adequada à realidade de nossa carteira.Acompanhar o resultado e o desempenho dos modelos preditivos por meio de relatórios de monitoramento mensal avaliando a necessidade de substituição de um modelo preditivo por um novo com acréscimo de novas variáveis e novas técnicas.Auxiliar a equipe no processo de levantamento e identificação de variáveis descriminantes do ponto de vista do seguro pesquisando no mercado as bases existentes e acompanhando o processo de obtenção das bases.Auxiliar a equipe na pesquisa de novas técnicas e ferramentas estatísticas no meio acadêmico ou em outros setores de atividades e adaptálas a realidade de seguros visando atender as necessidades dos clientes internos e melhorar a performance da área.Participar da construção de estudos estatísticos que auxiliem os Clientes Internos na tomada de decisão.Monitorar continuamente os resultados para buscar oportunidades de captura de margem ou insuficiência de prêmio.Validar as diversas alterações relativas a preço para que as mesmas sejam implementadas corretamente no processo tarifário. Principais Competências: Foco em Resultado Capacidade Crítica Visão Sistêmica e Foco no Cliente são competências que complementam o perfil desejado.,Porto Seguro Seguros,Há 4 dias,Estatístico
v1954856,Analista de Informações Gerenciais - Júnior (Estatística),São Paulo,Salário a combinar,1,2019-09-27,Júnior/Trainee,Do dia a dia:Elaboração de relatórios gerenciais técnicoestatísticos para acompanhar indicadores e resultados dos produtos de segurosElaboração de algoritmos de extração de dados para suporte de análises e relatórios estatísticosManipulação e manutenção de base de dadosParticipar do desenvolvimento de projetos de informação e análise de dados. O que é importante:Formação superior completa em: Administração Finanças Matemática Estatística e áreas similaresConhecimentos em SAS/SQL. Local de trabalho: Morumbi São Paulo SP.,HDI SEGUROS,09/09/2019,Estatístico
v1958292,Estágio - Matemática ou Estatística - Inteligência de Mercado,São Paulo,Salário a combinar,1,2019-09-27,Estágio,Buscamos talentos que tenham paixão em transformar números em informações estratégicas. Vaga exclusiva para: Estudantes de Matemática ou Estatística. Requisitos: Cursando Matemática ou Estatística a partir do 5° semestre Será um diferencial ter habilidades em Excel (gerar relatórios gráficos). Informações:Atuação: Inteligência de Mercado departamento responsável pela organização e análises de bases de dados para fins estratégicos da empresa. Local de realização do estágio:  Zona Oeste/SP  Vila Progredior/MorumbiOferecemos: Bolsa Auxílio + ValeTransporte + restaurante no local (café da manhã e almoço) e seguro de vidaJornada: segunda a sexta 06 horas de estágio período manhã. Responsabilidades: O estagiário será desenvolvido para realizar construção interpretar informações e  tratamento de bases de dados (Excel e Access) Construir relatórios analíticos Dar suporte às áreas de Inteligência de Mercado e Planejamento Estratégico.,CRISTÁLIA  Produtos Químicos Farmacêuticos,26/08/2019,Estatístico
v1943426,Consultor Sênior - Marketing - CRM - Estatístico (Telecomunicações),Rio de Janeiro,Salário a combinar,1,2019-09-27,Sênior,Descrição das atividades Monitoramento de novas receitas do negócio PréPago (TIM Ads e Crédito Especial) Análises estatísticas para subsidiar o negócio pré pago por novas formas de receita Alinhamento de Projetos das demais áreas que impactam o negócio Pré Pago Análises dos impactos ou possíveis impactos nos indicadores Pré Pago das novas receitasConhecimento e Experiência desejável Experiência no mercado de Telecom Conhecimento em SAS SQL Excel Power Point Bom relacionamento interpessoal com áreas paresFormação desejávelEstatística Administração Engenharia da Produção Ciência de Dados Sistemas de InformaçãoEscolaridade MínimaSuperior CompletoEmpresa e Local de TrabalhoM300 TIM S.A.RJ Rio de Janeiro,TIM Brasil,13/09/2019,Estatístico
v1940030,"Estágio em Administração de Empresas, Eng. Produção, Estatística - Dasa / PE",Recife,Salário a combinar,1,2019-09-27,Estágio,Requisitos:Cursando Administração de Empresas Matemática Eng. Produção com formação prevista a partir de 12/2020Área Atuação/ Atividades:Núcleo Técnico Operacional –  (1 vagas)Acompanhamento de IndicadoresGestão do Modelo DASA de ProduçãoDesenvolvimento de dashboard de indicadores da produção e acompanhamentoRelatórios gerenciais Bolsa Auxílio e Benefícios:Bolsa estágio: R$ 95500Possibilidade de prorrogação de contratoPossibilidade de efetivaçãoHorário de Estágio:6 horas/dia das 9h às 16hLocais de Estágio: RecifeBOA VIAGEM/ PE,Instituto Via de Acesso,13/08/2019,Estatístico
v1963780,Analista Atuarial Sênior com foco em Modelagem,Rio de Janeiro,Salário a combinar,1,2019-09-27,Sênior,Prérequisito:Graduação em Estatística Matemática Atuária ou Engenharia.Experiência com Bancos de DadosDomínio dos indicadores de performance de carteira e indicadores de performance de modelos estatísticos (árvore de decisão e regressão logística) de scoring.Vivência com ferramenta SAS e Modelos de segmentação Excel Avançado Programação SAS ou SQL.Necessário experiência com Modelagem.Atividades:Elaborar/acompanhar modelos estatísticos de risco oportunidade e perfil para operadora de saúdeGerar Leads para açõesOtimizar política de retenção e fidelizaçãoTratar as bases de dados e compilar informações.,Unimed-Rio,Há 3 dias,Estatístico
v1949959,Analista Operacional,Canaã dos Carajás,Salário a combinar,1,2019-09-27,Pleno,Principais Requisitos:•             Conhecimento com tratamento estatístico de dados•             Conhecimento na aplicação de softwares estatísticos•             Elaboração e aplicação de PDCA•             Aplicação da metodologia de 6 Sigmas para tratamento de desvios e problemas tratando a causa raiz.Controle operacional de variáveis de processo análise estatística de dados.Acompanhar as operações das Usinas monitorando as variáveis de processo controlando e fazendo as tratativas de desvios e Não conformidadesFazer interface da operação dos turnos com a gestão das UsinasIdentificação de riscos e de melhorias e atuar para a manutenção dos níveis de produtividadeAssessorar o planejamento estratégico da operação de UsinaCoordenar e/ou orientar as ferramentas da qualidade e segurança.Disponibilidade para atuar com revezamento de turno.,Search Consultoria em Recursos Humanos,30/08/2019,Estatístico
v1929136,Cientista de Dados (Analista de Dados),Uberlândia,Salário a combinar,1,2019-09-27,Pleno,Requisitos:• Superior em Estatística Matemática Análise de Sistemas  Sistemas de Informação Ciência da Computação Gestão da Informação ou áreas correlatas • Experiência em banco de dados – SQL e com modelagem estatística (Machine Learning)• Experiência em linguagens de programação (preferencialmente  R e Python).• Experiência em tratamento manipulação e qualificação de dados. * Todas as vagas do Martins são também disponibilizadas para Pessoas com Deficiência,Martins S/A,24/07/2019,Estatístico
v1943684,Consultor Data Science - Júnior,São Paulo,Salário a combinar,1,2019-09-27,Júnior/Trainee,Funções:          Tratamento estatístico de dados (data mining).          Modelagem preditiva mediante técnicas de machine learning e data science          Modelagem de eventos temporais (séries temporais modelos ARIMA).          Desenvolvimento de modelos de simulação (Monte Carlo).          Revisão e validação de modelos de rating e scoring RAROC e parâmetros de risco.          Apoio matemático ao negócio: desenvolvimento de algoritmos estatística e probabilidade.          Projetos de I+D (Pesquisa e desenvolvimento).  Requisitos:         Estudantes com formação em Julho de 2019 nos cursos: Matemática Física Estatística Engenharia ou outros estudos com forte componente quantitativo.         Também valorizamos conhecimento de técnicas de modelagem (logit GLM séries temporais árvores de decisão clustering etc.) linguagens de programação estatística (SAS R Python Matlab etc) e ferramentas de plataformas de Big Data (Hadoop MongoDB Cassandra Pig Hive etc.)          Valorizamos a realização de estudos específicos de pósgraduação em especial Data Science Finanças Quantitativas ou similar         Alto nível de inglês e conhecimento de outros idiomas.         Disponibilidade para viajar.Outros aspectos: sólida trajetória acadêmica dinamismo vontade de superação capacidade de trabalho Maturidade responsabilidade e facilidade de integração em equipes de trabalho multidisciplinar.Vaga disponível para PCD's,MANAGEMENT SOLUTIONS,20/08/2019,Estatístico
v1960191,Analista de Garantia da Qualidade-temporário,Juiz de Fora,Salário a combinar,1,2019-09-27,Júnior/Trainee,Responsável pelas atividades relacionadas a Revisão Periódica de Produtos:Lançamento de dadosElaboração de relatóriosAnálise estatísticaParticipação nos comitês de RPP.,MEDQUÍMICA INDÚSTRIA FARMACEUTICA,18/09/2019,Estatístico
v1965241,Analista Técnico I e II (Análise de Dados / Planos de Saúde),São Paulo,Salário a combinar,2,2019-09-27,Júnior/Trainee,PréRequisitos:Ensino superior completo Formação em ciências atuariais ou curso de exatas como por exemplo estatística será um diferencialExcel intermediário (procv tabela dinâmica)Experiência com relatórios gerenciais indicadores análise de dadosConhecimento básico em regulamentações de plano de saúde e estatística. Atividades a desempenhar:Definir metodologias de apuração de resultados e análises técnicasPreparar relatórios gerenciais de sinistralidade por entidades e operadorasOrganizar indicadores da áreaPreparar e acompanhar status de tratativas da áreaAuxiliar área técnica atuarial na obtenção da base de dados (operadoras x clientes).,Qualicorp São Paulo,Ontem,Estatístico
v1956270,Técnico em eletrônica ou mecatrônica (equipamentos biomédicos),São Paulo,R$ 3.500 a R$ 3.700,1,2019-09-27,Técnico,Executar tarefas de manutenção corretiva e preventiva em equipamentos biomédicos de alta complexidade. Tarefas administrativas de controles e estatísticas relativas ao setor de engenharia clinica,Confidencial,11/09/2019,Estatístico
v1963961,Analista Inteligência Analítica Sr,Olímpia,Salário a combinar,1,2019-09-27,Sênior,O que buscamos num profissionalNeste cenário de crescimento sustentável buscamos talentos para enfrentar os desafios do setor que tenham atitude sejam engajados e saibam estabelecer parcerias na busca pela excelência.A Tereos acredita que todos os profissionais podem contribuir com o crescimento do grupo. Por isso pessoas com deficiência são bemvindas a nossa empresa.Que desafio temos para vocêEstamos em busca de um/a Analista de Inteligência Analítica Sr para atuar no nosso time de Inteligência Analítica.Quais as responsabilidades* Desenhar arquitetar e analisar soluções para os problemas do negócio* Desenvolver projetos desde a preparação dos dados até a sua utilização pelo cliente final* Realizar tratamento estatístico de dados modelagem preditiva revisão e validação de modelos de rating e scoring* Oferecer apoio matemático ao negócio desenvolvendo algoritmos estatística e probabilidade.Quais os requisitos* Ensino superior completo em áreas correlatas* Necessário ter experiência comprovada em rodar o pipeline de datascience da modelagem dos datasets e datacleaning criação de features seleção de modelos até a implementação do modelos preditivos / prescritivos* Experiência com tratamento estatístico (data mining) e modelagem preditiva machine learning e Data Science* Conhecimento em banco de dados: SQL (Postgre) / Oracle etc bem como ferramentas de BI / Visualização:Tableau QLikSense Matplotlib Seaborn etc* Conhecimento avançado de linguagens de programação estatística e de pacotes de Data Science: R e/ou Python* Experiência com métodos ágeis ex.: Scrum* Desejável inglês intermediário.Qual localidadeOlímpia SP,Tereos,Há 3 dias,Estatístico
v1914361,Auxiliar Administrativo - Pessoa com Deficiência,Brasília,R$ 1.000 a R$ 1.600,1,2019-09-27,Auxiliar/Operacional,Atender ao público interno e externo – presencial e telefônicoArquivar documentosDigitar e elaborar relatórios e estatísticas diversasTramitar os processos internos e Atender e dar suporte aos assuntos acadêmicos.,Centro de Ensino Unificado do Distrito Federal,Há 2 dias,Estatístico
v1918393,Bolsista Programa Inova Talentos - IEL / CNPq,Osasco,Salário a combinar,5,2019-09-27,Sênior,Mestres e Doutores em: Matemática Aplicada Estatística e áreas afinsComo utilizar métodos analíticos para gerar vantagem competitiva em uma organização inserida em um ambiente altamente competitivo Conhecimento técnico: Capacitado em técnicas e ferramentas para o tratamento de grande volumes de dados. Ferramentas Estatística (SAS SQL R SPSS Stata)Carga horária de acordo com o plano de atividades acordado com o Tutor do Projeto. Duração: 12 meses. Valor da bolsa: R$3.00000 para MESTRES com no máximo 5 (cinco) anos de titulação.R$4.50000 para DOUTORES com no máximo 5 (cinco) anos de titulação.  Local: Osasco SP,IEL /SP - Inova Talentos,07/08/2019,Estatístico
v1953176,Estagiário -  QHSE,Rio de Janeiro,Salário a combinar,1,2019-09-27,Estágio,Prérequisito necessário:*Cursando:Engenharia (Produção Química Mecânica Naval ou Ambiental).*A partir do 4º período e com disponibilidade mínima de 1 ano para estagiar.*Disponibilidade de 6 horas/diárias (horário comercial).*Desejável conhecimento em dados estatísticos e elaboração de apresentações.*Inglês Fluente.Atividades da área:Implementação/Manutenção do sistema de gestão HSE dos PLSVs Skandis.Atividades do estagiário:O estagiário trabalhará sob mentoria dos Eng. HSE da equipe interfaciando com os times dos projetos PLSVs Skandis. Atuará como na gestão das ferramentas programas e procedimentos de HSE nos PLSVs Skandis assim como registro e análise de dados estatísticos referentes ao desempenho HSE.   Local de Trabalho: Cidade Nova.,TechnipFMC,05/09/2019,Estatístico
