idVaga,NomeVaga,Cidade,Salario,QuantidadeVaga,DataPesquisa,Perfil,Descricao,Empresa,DataPubli,Pesquisa
v1960634,Analista de Modelagem Júnior,São Paulo,Salário a combinar,1,2019-09-27,Júnior/Trainee,Na Recovery o Analista de Modelagem Junior será responsável por desenvolver modelos estatísticos para definição da estratégia de cobrança da Recovery O que seria bacana você ter e conhecer:Graduação: Cursos de exatas (Estatística Matemática Física Economia Ciência da Computação Engenharias ou áreas afins) O que você terá que fazer:Estudo de segmentações de públicos para modelos estatísticosParticipar de todas as etapas da modelagem estatística (extração de base criação de variáveis definições de variáveis respostas/explicativas desenvolvimento da equação testes de acurácia)Backtest de modelos previamente desenvolvidos (internos/externos) para busca de melhoria de performanceAcompanhamento de aderência dos modelos (relatórios de MIS)Manipulação de bases de dadosProgramação em SAS/SQL/Python/R           Para fechar com chave de ouro: Vontade de aprenderDinamismoPensamento “fora da caixa”Proatividade Boa capacidade na resolução de problemasRaciocínio analítico e computacional Quer saber o que temos de mais legal por aqui Dá uma olhada!Incentivamos nossa galera a buscar conhecimento sempre por isso temos um Programa de Incentivo à Educação que pode bancar parte dos estudos de quem tiver interesseUm dos momentos mais importantes na vida de uma pessoa é o nascimento do seu filho. Pensando nisso a Recovery oferece para as mamães a licençamaternidade estendida de 6 meses e para os papais a possibilidade de ficar 20 dias com a família em licençapaternidadeEstimulamos que o nosso time esteja sempre em movimento para isso temos por aqui o GymPass e Ginástica Laboral no escritórioGostamos de comemorar nosso desempenho e um dos nossos lemas é celebrar os bons momentos. Encontramos a melhor forma de fazer isso: Happy Hour com a galera no escritórioEstamos no coração de São Paulo a Avenida Paulista é a nossa casa. Quer ser parte do nosso time Vem #todosjuntos fazemos a diferença!,Grupo Recovery,18/09/2019,big-data
v1962332,Estagiário de Gestão de Riscos,São Paulo,R$ 1.372 a R$ 1.509,1,2019-09-27,Estágio,ESTAGIÁRIO DE GESTÃO DE RISCOSAtribuições do Cargo:Consolidação de dados das análises de riscos acompanhamento de indicadores e montagem de apresentações. Manutenção das informações no sistema Siclope.Interação com as áreas de controles internos e auditória interna. Apoio no desenvolvimento do Programa PERTO (análise de leis procedimentos normas matriz e fichas de riscos por função).Prérequisitos:Cursando o penúltimo/último ano do ensino superior em Administração Estatística ou Engenharia.Informática Inglês.Conhecimentos específicos:Planilhas tratamento estatístico de dados tabelas e gráficos dinâmicos matemática financeira apresentações desejável automação de dados.Horário de Trabalho das 09:00h às 16:00h.VR VT AO Seguro de vida.Empresa localizada na região do Jaguaré (Zona Oeste).,Solví Corporativo,Há 7 dias,big-data
v1911451,Analista de Inteligência de Dados,Rio de Janeiro,Salário a combinar,1,2019-09-27,Pleno,DESCRIÇÃOAtuar na interface entre a área de negócios e cientistas de dados para auxiliar no desenvolvimento de estratégias segmentadas para otimização do valor da base de clientes.Análise e discussão das estratégias de segmentação e das campanhas.Criação e análise de KPIs para monitorar a performance do programa e contribuir com o desenvolvimento de ações de marketing que potencializem as oportunidades de retenção de clientes e expansão do programa assim como mensurar a rentabilização do programa.Aplicação de inteligência analítica em negócios.Formular e analisar hipóteses que ajudem na tomada de decisões estratégicas.Dar suporte às ações de planejamento e gestão de resultados com a finalidade de garantir a rentabilidade sustentabilidade e crescimento dos negócios. Auxiliar no desenvolvimento e mensuração de Testes A/B e na modelagem das análises estatísticas do programa. PRÉREQUISITOS Formação superior completa em Estatística Engenharia Ciência da computação e afins. Experiência com inteligência analítica aplicada a campanhas de aquisição de clientes retenção ou criação de estratégias ou ofertas personalizadas Raciocínio analítico Domínio do Pacote Office e conhecimento avançado de Excel Disponibilidade para viagens Nível mínimo do idioma Inglês: intermediário DESEJÁVEL Habilidade de Comunicação Conhecimento de Microstrategy (ferramenta de Business Intelligence BI) Experiência com criação de indicadores de performance ou criação de modelos de propensão Conhecimento em estatística Desejável conhecimento de marketing estratégico e experiência em varejo Experiência com gestão de base de clientes,Ipiranga Produtos de Petróleo S/A,29/08/2019,big-data
v1961944,Estágio em Relações Trabalhistas,Piracicaba,Salário a combinar,1,2019-09-27,Estágio,O time:Você é apaixonado por carros Gostaria de fazer parte do time responsável por relações com os empregados da Hyundai Motor Brasil O que você vai fazer:Irá atuar na área de relações trabalhistas controlando diariamente os indicadores da área elaborando relatórios estatísticos e planos de ação. Garantir o cumprimento de políticas e procedimentos criando uma cultura de relações positivas entre empresa e empregados minimizando riscos Atuar preventivamente em demandas dos empregados que possam impactar no clima organizacional da área ou empresa Elaborar relatórios estatísticos de indicadores gerais da área de relações trabalhistas consolidando e atualizando informações gerenciais que atendam as necessidades da empresa Apoiar ações que sejam facilitadoras na adaptação a novas culturas melhorando os relacionamentos internos Cumprir as políticas procedimentos normas ou legislações relativas à empresa código de conduta acordos de confidencialidade processo de trabalho sistemas degestão da qualidade meio ambiente saúde e segurança do trabalho Realizar outras atividades correlatas e ou inerentes aos procedimentos do seu processo de trabalho ou em relação aos procedimentos do sistema da qualidade.Quem é vocêEstá cursando Administração Economia ou EstatísticaConhece as ferramentas do pacote officePossui inglês avançadoTem disponibilidade para estagiar de segunda a sextafeira das 8h às 15hTem disponibilidade para estagiar na unidade de Piracicaba E aí está dentro do perfil Venha fazer parte da família #HyundaiBrasil,Hyundai Motor Brasil,Há 7 dias,big-data
v1939283,Pesquisador,Iracemápolis,Salário a combinar,1,2019-09-27,Júnior/Trainee,O que irei fazerPlanejar implementar e conduzir ensaios de pesquisa e desenvolvimento de fertilizantes de estimulantes e de produtos biológicos em campo casa de vegetação e/ou laboratório dentro e fora do centro de pesquisa gerando resultados e relatórios que auxiliam na tomada de decisão sobre o desenvolvimento do produto de nutrição vegetal fisiológicos e biológicos.Formação: Engenharia Agronômica ou Agronomia Mestrado na área de nutrição vegetal fisiologia de plantas bioquímica de plantas ou fitotecnia. Desejável doutorado na área de nutrição vegetal fisiologia de plantas bioquímica de plantas ou fitotecnia.Experiência comprovada em desenvolvimento de pesquisa agrícola com amplo conhecimento em experimentação agrícola. Conhecimento em estatística.Conhecimento desejável do mercado de fertilizantes foliares e especiais. Experiência com pesquisa a campo na cultura do milho e/ou soja.Informática: Pacote Office programas de estatística (ex. Minitab) Idioma: Inglês avançadoLocal de trabalho: Iracemápolis / SP,Confidencial,12/08/2019,big-data
v1957792,Auditor Pleno,Belo Horizonte,Salário a combinar,1,2019-09-27,Pleno,Atividades a serem desenvolvidas: Investigação de Denúncias ou suspeitas de fraudes realizando investigação local Auditoria de controles internos e adequação à SOX incluindo a criação e execução de testes de controles internos Definição do escopo e programa de trabalho de acordo com o planejamento de auditoria Execução de projetos de auditoria interna reportando deficiências do processo Elaborar o relatório de auditoria interna dentro do prazo estabelecido Executar o programa anual de auditoria interna segundo suas áreas de responsabilidade Propor implementação de controles internos para melhoria e atendimento das políticas e procedimentos da companhia. Escolaridade exigida: Superior em Administração Ciências Contábeis Economia ou áreas afins. Escolaridade desejável: PósGraduação em áreas afins. Conhecimento específico: Pacote Office Excel Avançado Metodologia COSO Análise de dados e estatística SOX. Desejável: Conhecimento do sistema RM e softwares estatísticos com ACL ou IDEA entre.,JAGUAR MINING,13/09/2019,big-data
v1928448,Analista Administrativo Pleno,Rio de Janeiro,R$ 3.000 a R$ 3.500,1,2019-09-27,Pleno,Requisitos: Cursos Superior em Economia Estatística ou áreas correlatasVivência profissional com Excel e emissão de relatórios estratégicos da área.Demandas: Controle da Segurança EmpresarialElaboração de relatórios periódicosConsolidação de dadosControle e atualização da base de dadosOrientação às áreas. Informar pretensão salarial.,Confidencial,23/07/2019,big-data
v1956148,Analista BI Sr.,Campinas,Salário a combinar,1,2019-09-27,Sênior,Excel e Acess AvançadoConhecimento em SQLContato com ferramentas BI (MicroStrategy Quick View Power BI)Vivência com Projetos e ProcessosConhecimento de IQVEA e Close UpInglês IntermediárioConhecimento Sistemas R e PythonFormação Superior Completa em Estatística Economia Engenharia ou Matemática,Confidencial,11/09/2019,big-data
v1963065,Engenheiro de Processos,São José dos Pinhais,Salário a combinar,1,2019-09-27,Júnior/Trainee,Requisitos:Superior completo em Engenharia de Produção Mecânica ou afins.Desejável Pósgraduação na área industrial. Inglês intermediário. Domínio de ferramentas de análise  estatística autocad e pacote office.  Disponibilidade para atuar de segunda a sextafeiras em horário comercial. Salário + pacote amplo de benefícios.,AGP,Há 4 dias,big-data
v1958313,Analista de Risco Jr,Rio de Janeiro,R$ 3.000 a R$ 3.300,1,2019-09-27,Júnior/Trainee,Principais atividadesMonitoração e realização de controles relacionados à gestão dos principais riscos (Risco de Crédito Mercado Liquidez e Operacional).Fornecer relatórios de Risco de Mercado e Risco de Liquidez à gerência estrangeira e local.Configuração de limites nas plataformas de Risco utilizadas de acordo com o apetite de Risco de cada cliente e sua exposição global.Confecção de relatórios oficiais de incidentes.Mapeamento/monitoração de erros operacionais.Participação nas auditorias realizadas e elaborações de relatórios solicitados por órgãos reguladores.Auxiliar na gestão de projetos ações de melhora e planos de ação.Monitoração e controle relacionado à distribuição de produtos. PrérequisitosExperiência na área de Gestão de Riscos ou de Controles Internos.Conhecimento básico em Fundos de investimentos.Ensino Superior Completo preferencialmente em: Economia Administração Ciências Atuariais Estatística Matemática ou Engenharia.Domínio do Excel avançado (Macros em VBA) e Ferramenta estatística (Análise de dados Excel).Inglês intermediário.,Confidencial,17/09/2019,big-data
v1924771,Bolsista Programa Inova Talentos - IEL / CNPq,Osasco,Salário a combinar,1,2019-09-27,Sênior,Mestres com interesse em atuar com manipulação de dados e modelagemDESAFIO: Pensando numa área comercial que tem como foco gerar negócios como a estruturação e uso de dados pode contribuir para os processos de gestão gerar novas oportunidades (ou até mesmos correção de rumo) otimizando os resultados Conhecimento técnico:Conhecimentos avançados em manipulação de dados e base estatística/ matemática.Conhecimento na utilização de algoritmos para geração de análises e negócios.Conhecimento desejável em softwares de BI como Tableau MicroStrategy Power BI.Experiência em softwares estatísticos como SPSS SAS.Atividades:1. Revisão / Otimização dos processos da área2. Estruturação de dados3. Criação de BI’s4. Criação de Dashboards e Indicadores de ResultadosCarga horária de acordo com o plano de atividades acordado com o Tutor do Projeto. Duração: 12 meses. Valor da bolsa: R$3.00000 para MESTRES com no máximo 5 (cinco) anos de titulação. Local: Osasco SP,IEL /SP - Inova Talentos,13/09/2019,big-data
v1965655,Estágio em Ciência de Dados - Telecine | RJ,Rio de Janeiro,Salário a combinar,1,2019-09-27,Estágio,O que você precisaEstar cursando Matemática Estatística ou áreas afins tendo pelo menos 1 ano e meio para se formarManjar muito de ExcelTer noções de lógica de programaçãoConhecer Python ou RConhecer Modelos EstatísticosSer comunicativo proativo e organizadoTer um perfil analítico e que tope desafiosDisponibilidade para estagiar 6h por dia na Barra da Tijuca – RJ. O que você vai fazerApoiar nas análises focadas em OKRs e KPIs de acordo com a jornada do cliente no TelecineDar suporte no desenvolvimento de dashboards para acompanhamento de metas trimestraisApoiar na elaboração de apresentações para diretoria da empresaAuxiliar na automatizar processos de extração de dados de diversas ferramentasDar suporte na implementação de ferramentas de Digital Analytics e Business Inteligence.Valorizamos a diversidade e todas as nossas vagas estão abertas a pessoas com deficiência! Local de trabalho: Rio de Janeiro / Barra de Tijuca,Globosat,Ontem,big-data
v1958740,Analista de Inteligência de Mercado,São José dos Pinhais,Salário a combinar,1,2019-09-27,Pleno,Vaga extensiva a PCD'sAtividades: Monitorar informações (investimentos etc) e tendências de mercado identificar novas oportunidades de negócio. Monitorar principais clientes (ou segmentos de mercado) identificando tendências e oportunidades. Recomendar potenciais inciativas estratégicas relativas a cobertura de mercado e lançamentos de produtos para diferentes regiões e /ou segmentos de mercado. Desenvolver relatórios diversos (ad hoc) que reforcem a tomada de decisão da Gerência e Diretoria. Desenvolver relatórios de vendas e dashboards através da ferramenta Power BI. Mapeamento e organização das informações. Mapear e monitorar a concorrência. Analisar carteiras potenciais e novas oportunidades/estratégias de atendimento da Força de Vendas. Acompanhar as campanhas de vendas.Requisitos: Ensino superior completo em Administração Matemática Engenharia Economia ou área afins. Desejável formações adicionais em Big Data Inteligência de Mercado e Sales Analytics. Inglês intermediário. Excel avançado. Disponibilidade para atuar em São José dos Pinhais.,Bematech,09/09/2019,big-data
v1954924,Analista de Segurança da Informação (Gestão de Riscos),Rio de Janeiro,Salário a combinar,1,2019-09-27,Pleno,Requisitos:Superior completo em Ciência da Computação Análise e Desenvolvimento de Sistemas Segurança da Informação ou áreas afins.Sólidos conhecimentos de requisitos de segurança para: sistemas elementos de rede fornecedores APPs etc. Sólidos conhecimentos no software GRC Archer (usuário e configuração). Bom português. Conhecimentos de Segurança da informação. Habilidade para realizar reuniões e auxiliar as áreas relacionadas a responderem corretamente todos requisitos de segurança. Habilidade para verificar se os planos de ação estão em conformidade com o que é solicitado e se as evidências de implementação estão em conformidade com o definido. Conhecimento de segurança em Cloud BYOD BIG DATA dispositivos móveis e processo de desenvolvimento DEVOPS. Inglês intermediário/ avançado Atividades: Classificar e manter o PDCA do processo de Gestão de Riscos de Segurança do cliente rodando dentro do prazo e escopo estipulado. Auxiliar a equipe de Mapeamento e melhoria de processos em Segurança nos temas relacionados a Gestão de Riscos de Segurança.  Local de Trabalho: Barra da Tijuca,Ericsson Gestão e Serviços de Telecomunicações,16/09/2019,big-data
v1962594,Analista de BI Pleno,São Paulo,Salário a combinar,1,2019-09-27,Pleno,Principais atividades:Desenvolver projetos de Business Intelligence e Analytics implementando aplicações de BI sobre plataformas convencionais trabalhando conceito de modelos multidimensionais.Em alguns casos será necessário desenvolver arquiteturas alternativas adotando mineração em dados semiestruturadas no SQL e trabalhos relacionados a alta escalabilidade de dados (projetos de Big Data e Analytics). O que iremos avaliar:Qual curso superior você concluiu e no que poderá contribuir em sua atuação profissionalVivência ou bons conhecimentos de ETL programação relacionada a banco de dados relacional e noSQL.Levantamento Modelagem Design e Implementação de aplicações de Business Intelligence e AnalyticsModelagem dimensional de dadosDesign e implementação de processos de ETL (Extração Transformação e Carga) de dados a partir de bancos de dados e outras fontes para modelos dimensionais envolvendo grandes volumes de dadosConhecimentos em QlikSense ou QlikView Local de trabalho: Jabaquara,Grupo Fleury,Há 5 dias,big-data
v1939394,Especialista de PDV,São Paulo,Salário a combinar,1,2019-09-27,Sênior,Descrição: Administrar e estar alinhado com as prioridades do product backlog de desenvolvimento e entregas dentro das prioridades da CIA trabalhando as prioridades buscando a melhor eficiência e com melhor resultado para CIA. Desenvolver administrar reportar prestar suporte e cobrar as incidências encontradas dentro das prioridades de operações e da CIA trabalhando e buscando a melhor eficiência e com melhor resultado para CIA. Garantir que o Product Backlog esteja sempre visível à todos de forma clara e transparente com datas e expectativas de entregas para que todos estejam alinhadas com as prioridades de operações e da CIA. Desenvolver novas funcionalidade e atualizações no qual seja específica de PDVs a fim de garantir umaentrega rápida e um baixo backlog de desenvolvimento. Relacionamento e coordenação técnica com a equipe da Espanha a fim de manter uma boa comunicação e efetividade das entregas garantido a correta evolução do sistema. Participar e pilotar projetos que envolvam a parte de informática do ponto de venda para garantir o que é possível fazer e adequar novas tecnologias e novos equipamentos de acordo com a estratégia de negócio da empresa. Entender criticar questionar e mapear as necessidades dos processos de negócio garantindo alta eficiência e performance dos interessados na criação e entrega das soluções de tecnologias propostas. Manter os produtos já entregues e desenvolvidos devidamente atualizados garantindo a disponibilidade de serviços e correto funcionamento das aplicações. Levantar requisitos funcionais e não funcionais de sistema a fim de garantir qualidade e cobertura em todos os pontos das solicitações e necessidades Mapear e descrever atores e casos de usos/user stories de sistema a fim de cobrir todas as áreas a serem envolvidas no projeto necessidades e treinamento. Definir complexidade dos requisitos de negócio através de ferramentas como a matriz de esforço e impacto e 5W2H a fim de definir a prioridade correta de cada necessidade. Elaborar documento de escopo do sistema garantindo que tenham claro a necessidade e com o melhor aproveitamento evitando retrabalho. Realizar reuniões de requisitos a fim de garantir a cobertura completa de necessidades de todos os possíveis interessados.Requisitos:Graduação em TINoções de sistemas integrados Windows Android Pacote Office Big data desenvolvimento em linguagem C sobre Linux(C++) Linux console scripts(Bash) sistema de arquivos sockets pacotes(tgz rpm) ssh ftp programação de estrutura de dados clássica(pilhas ponteiros) abstração de dados sistema de controle de versão(cvs svn git) conhecimento webservice SOAP REST XML XSD Espanhol avançadoCompetências Técnicas:  Domínio – Análise de documento e sistemas. Domínio – Excel Domínio – Sistemas integrados e Big Data. Metodologia de trabalho Scrum Domínio – Desenvolvimento sobre Linux C++ Conhecimento WebserviceLocal de Trabalho: São Paulo SPHorário de Trabalho:De segunda a sextas das 8:00 às 17:48,Dia Brasil,12/08/2019,big-data
v1939399,Especialista PDV (PcD),São Paulo,Salário a combinar,1,2019-09-27,Sênior,Descrição: Administrar e estar alinhado com as prioridades do product backlog de desenvolvimento e entregas dentro das prioridades da CIA trabalhando as prioridades buscando a melhor eficiência e com melhor resultado para CIA. Desenvolver administrar reportar prestar suporte e cobrar as incidências encontradas dentro das prioridades de operações e da CIA trabalhando e buscando a melhor eficiência e com melhor resultado para CIA. Garantir que o Product Backlog esteja sempre visível à todos de forma clara e transparente com datas e expectativas de entregas para que todos estejam alinhadas com as prioridades de operações e da CIA. Desenvolver novas funcionalidade e atualizações no qual seja específica de PDVs a fim de garantir uma entrega rápida e um baixo backlog de desenvolvimento. Relacionamento e coordenação técnica com a equipe da Espanha a fim de manter uma boa comunicação e efetividade das entregas garantido a correta evolução do sistema. Participar e pilotar projetos que envolvam a parte de informática do ponto de venda para garantir o que é possível fazer e adequar novas tecnologias e novos equipamentos de acordo com a estratégia de negócio da empresa. Entender criticar questionar e mapear as necessidades dos processos de negócio garantindo alta eficiência e performance dos interessados na criação e entrega das soluções de tecnologias propostas. Manter os produtos já entregues e desenvolvidos devidamente atualizados garantindo a disponibilidade de serviços e correto funcionamento das aplicações. Levantar requisitos funcionais e não funcionais de sistema a fim de garantir qualidade e cobertura em todos os pontos das solicitações e necessidades Mapear e descrever atores e casos de usos/user stories de sistema a fim de cobrir todas as áreas a serem envolvidas no projeto necessidades e treinamento. Definir complexidade dos requisitos de negócio através de ferramentas como a matriz de esforço e impacto e 5W2H a fim de definir a prioridade correta de cada necessidade. Elaborar documento de escopo do sistema garantindo que tenham claro a necessidade e com o melhor aproveitamento evitando retrabalho. Realizar reuniões de requisitos a fim de garantir a cobertura completa de necessidades de todos os possíveis interessados.Requisitos:Graduação em TINoções de sistemas integrados Windows AndroidPacote OfficeBig dataDesenvolvimento em linguagemC sobre Linux (C++) Linux console scripts (Bash) sistema de arquivos sockets pacotes (tgz rpm) ssh ftp programação de estrutura de dados clássica (pilhas ponteiros) abstração de dados sistema de controle de versão (cvs svn git) conhecimento webservice SOAP REST XML XSD Espanhol avançadoCompetências Técnicas:  Domínio – Análise de documento e sistemas. Domínio – Excel Domínio – Sistemas integrados e Big Data. Metodologia de trabalho Scrum Domínio – Desenvolvimento sobre Linux C++ Conhecimento WebserviceLocal de Trabalho: São Paulo SPHorário de Trabalho:De segunda a sextas das 8:00 às 17:48,Dia Brasil,12/08/2019,big-data
v1943694,Consultor de Novas Tecnologias e Transformação Digital,São Paulo,Salário a combinar,1,2019-09-27,Júnior/Trainee,Funções Conceitualização e implantação de soluções tecnológicas avançadas para problemas complexos que requerem um conhecimento elevado e específico dos negócios dos clientes nos seguintes âmbitos: ·         Implantação de Tecnologias Especialistas: Definição de arquiteturas Big Data Desenvolvimento de soluções e Implantação de ferramentas.·         Estratégia e Governança de TI: Planos Estratégicos de TI Servicing de IT Project Management Office (PMO) Transformação Organização e Eficiência.·         Gestão de Riscos e Regulação: Cibersegurança Qualidade e Governança do dado. Requisitos: Estudantes Recém formados ou com formação em Dezembro de 2019 nos cursos:Sistemas de Informação Ciências da Computação ou Engenharia da Computação.          Recémformados ou estudantes de último semestre.          Sólida trajetória acadêmica.          Dinamismo maturidade responsabilidade e capacidade de trabalho.          Nível de inglês avançado.          Alta capacidade de aprendizagem          Valorizamos o conhecimento de outros idiomas pósgraduações e cursos de especialização.          Uso avançado de linguagens de programação banco de dados e técnicas de engenharia de software.          Facilidade de integração em equipes multidisciplinares.          Disponibilidade para ViagensVaga disponível também para PCD's.,MANAGEMENT SOLUTIONS,20/08/2019,big-data
