idVaga,NomeVaga,Cidade,Salario,QuantidadeVaga,DataPesquisa,Perfil,Descricao,Empresa,DataPubli,Pesquisa
v1948513,Analista de Business Intelligence,São Paulo,R$ 3.000 a R$ 3.500,1,2019-09-27,Pleno,•      Acompanhar e monitorar projetos de pequena média e grande escala relacionados à Capital Humano•      Colaborar com recursos de análise do negócio para apoiar ações e iniciativas bemsucedidas•      Realizar atividades de acompanhamento das ações de Capital Humano followup e alinhamento das áreas envolvidas•      Executar estratégias de Capital Humano junto aos líderes de cada negócio•      Apoiar e direcionar o negócio em todas as ações de Capital Humano•      Propor soluções aos líderes em qualquer evento relacionado à Capital Humano•      Apoiar o negócio no dimensionamento de headcount•      Apoiar CoEs na determinação de políticas e procedimentos•      Avaliar abertura de vagas e desligamentos•      Analisar e acompanhar KPIs de Capital Humano•      Propor e monitorar orçamento de pessoas•      Apoiar o desenvolvimento de uma cultura forte e de alto desempenho•      Apoiar líderes para mudanças culturais•      Apoiar a análise de méritos promoções reajustes salariais e transferências de colaboradores•      Acompanhar vagas de cotas: Aprendiz e PCDs•      Realizar integração de novos colaboradores•      Contribuir para uma visão global em todas as ações de Capital Humano•      Estabelecer e manter relações sólidas comunicações efetivas e regulares com as áreas de COEs e negócios.,Luandre,28/08/2019,data-science
v1958586,Estágio em Business Intelligence,Barueri,Salário a combinar,1,2019-09-27,Estágio,HORÁRIO DO ESTÁGIO: 08h às 15hLocal: Alphaville IMPRESCIDÍVEIS: Conhecimentos em BI (Business Intelligence) Forte raciocínio lógico e habilidades de resolução de problemas  Habilidades em programação em alguma das seguintes linguagens: .NET (C# ou VB) JavaScript Xamarin/ Visual Studio Conhecimento em Banco de Dados SQL (design e gerenciamento) Inglês (avançado). ATIVIDADES: Desenvolvimento e implementação de novas soluções Automatizar e/ou simplificar as soluções existentes Gerar relatórios de Dashboards para fins operacionais e comerciais Otimizar e organizar repositórios de dados utilizados pelas soluções da operação Gerar documentação necessária para os projetos das soluções e etapas de processamento. Benefícios:ValeTransporteValerefeiçãoAssistência MédicaAssistência odontológicaSeguro de VidaBolsa auxílio de acordo com o ano que está cursando. VAGA EXCLUSIVA PARA PESSOAS COM DEFICIÊNCIA,T-Systems,16/09/2019,data-science
v1956663,Consultor de Business Intelligence,Sorocaba,Salário a combinar,1,2019-09-27,Pleno,Formação em Tecnologia da Informação e áreas afins Buscamos um Especialista em Business Intelligence que seja curioso analítico  com experiência em desenvolvimento de soluções para o negócio noções em processos e conhecimento  digitalExperiência com análise de informações e construção de soluçõesConstrução de dashboardsFluxo de dados e informações estratégias em mídias sociaisDesenvolvimento de soluções de marketing voltadas para vendas. Principais responsabilidades: Ter uma boa análise para consolidar os dados e trazer insights relevantes. Vontade de desenvolver diferentes visões dos dados através de pesquisa de mídia.,Confidencial,11/09/2019,data-science
v1953436,Analista de Business Intelligence,São Paulo,Salário a combinar,1,2019-09-27,Júnior/Trainee,Principais Atividades:• Criar novas ferramentas e procedimentos utilizando tecnologias de banco de dados e programação• Realizar analises preditivas• Pesquisar novas tecnologias focando na inovação e otimização de processos• Atuar próximo aos clientes internos para entender as necessidades e propor soluções.                                                                                                                                                                         Requisitos:• Formação superior completa em Engenharia da Computação Sistemas da Informação Ciência da Computação ou em áreas relacionadas à tecnologia• Inglês avançado• Necessário ter conhecimento em SQL• Será um diferencial ter conhecimento em PLSQL .NET r Visual Studio Qlik Sense Pentaho e/ou Azure. Horário: AdministrativoLocal: Sede GOL São PauloBaseamos nossa atuação no respeito a todas as pessoas em suas individualidades por isso oferecemos oportunidades a todos.Se você tem os requisitos solicitados deficiência ou não inscrevase para essa vaga.Acreditamos que juntos somos melhores!,GOL - &#8203;Vaga Efetivas,05/09/2019,data-science
v1935988,Analista de Business Intelligence,Rio de Janeiro,Salário a combinar,1,2019-09-27,Pleno,Atribuições: Implementar painéis de controle com indicadores de gestão através do BI em todas as áreas operacionaisPadronizar e converter os principais relatórios gerenciais para a ferramenta do BIPromover treinamentos com as equipes de gestão Necessário: Ensino superior completo em Sistemas de Informação/ Tecnologia da Informação/ Engenharia da computação/ Ciência da ComputaçãoBons conhecimentos em QLIK sense Oracle Power BI,Confidencial,06/08/2019,data-science
v1953984,Estágio Business Intelligence,São Paulo,Salário a combinar,1,2019-09-27,Estágio,Buscamos jovens estudantes com perfil próativo focado ágil organizado responsável e 'handson'.O que você irá fazer Suporte nas atividades de inteligência de mercado atualizações dos relatórios suporte na análise de indicadores e apresentações. Será responsável por todas as atividades de arquivamento e organização da área colaborando com os processos internos e fluxo de trabalho. O que você precisa terCursando Superior preferencialmente a partir do 2º ano nos cursos de Engenharia Economia Administração ou Estatística.Excel Avançado (Mandatório)Inglês IntermediárioO que você vai encontrar na Herbalife·      Day Off  dia livre no dia do aniversário para comemorar e aproveitar o seu dia.·      Temos um bicicletário se você gosta de qualidade de vida e chegar pedalando no trabalho.·      Conte com uma Van para o deslocamento dos colaboradores na estação da Lapa até a Herbalife.·     Programa Qualidade de Vida: com frutas no escritório Programa de Nutrição atendimento Psicológico e muito mais!·     Temos um espaço de lazer do nosso escritório para jogar basquete e ping pong com os colegas nos momentos de intervalo.·     Pode contar com um espaço Zen um ambiente tranquilo para relaxar nos pufs e sofás.·     Disponibilizamos um espaço para lanches e refeições além das máquinas com lanches refri e guloseimas.·     Ah e contamos com um clima muito agradável e informal os meninos por exemplo podem vir trabalhar de bermuda 😊A Herbalife Nutrition é uma empresa global de nutrição que busca profissionais que se identificam com o propósito de contribuir com um mundo mais saudável e feliz! Se você se identificou com o nosso propósito juntese à nós! Gostei quero me candidatar! Se você se identificou e quer fazer parte do nosso time candidatese.Havendo compatibilidade de vagas e de perfil entraremos em contato para o agendamento de uma entrevista.,Herbalife International do Brasil,06/09/2019,data-science
v1959925,Analista de Business Intelligence,São Paulo,R$ 3.000 a R$ 3.200,2,2019-09-27,Pleno,Atuar na criação de aplicações e análise de dadosDefinir padrões e melhores práticas de desenvolvimentoElaborar cronogramas de projetos e relatórios gerenciaisAtuar na negociação com usuários e analisar mercadoTransformar banco de dados em informações estratégicas para a condução dos negócios conquistando novos clientes e retendo os antigosTransformar as fontes de dados e informações em relatórios acessíveis facilitando a tomada de decisão dos gestores da empresaIdentificar novas bases de dados que terão fontes valiosas de informações para o crescimento dos produtos.Requisitos necessários:Superior completo em Tecnologia da Informação ou engenharia.Experiência na área. Ter atuado em empresas de eventos será um diferencialDisponibilidade para trabalhar aos fins de semana feriados e emendas de acordo com a necessidade do calendário de eventos.Excel Avançado e Power BI.Disponibilidade para atuar na Zona Norte de São Paulo.,STATO - São Paulo,17/09/2019,data-science
v1960888,Coordenador Business Intelligence,São Paulo,R$ 5.200,1,2019-09-27,Supervisão/Coordenação,Coordenar a equipe de Sales Intelligence.Desenvolver os relatórios diversos de vendas.Criar melhoria nos processos e procedimentos da área comercial. Apoiar à gestão de vendas.Apoiar à equipe comercial na burocracia de vendas.Realizar análise de dados de mercado.Utilizar ferramentas diversas para obtenção de informações de vendas (TravelClick Sabre STR HRS Lanyon entre outros). Organizar gerenciar e mensurar a produção das carteiras comerciais.Gerenciar a aplicação de política comercial e revisão / atualização dca mesma.Acionar a equipe comercial (corporativa e unidades) no ao atendimento a clientes.Apoiar à gestão de vendas na definição de carteira de clientes. Coordenar Follow Up de orçamentos HTIC / HTSP.Apoiar à gestão na utilização de CRM na equipe comercial.Coordenar base de cadastros na integração com o Photon.Participar do processo de criação e revisão dos materiais promocionais de vendas.Conhecer e disseminar os conceitos de Qualidade e Sustentabilidade do Hotel como prática diária e constante com a equipe fazendo acontecer os procedimentos e práticas adotados pela empresa referentes a ISO 9001 Sustentabilidade e demais normas quando aplicável.,Confidencial,18/09/2019,data-science
v1965689,Analista de Business Intelligence Sênior,Rio de Janeiro,Salário a combinar,1,2019-09-27,Pleno,Prérequisitos:Formação Superior concluída em Administração ou áreas de TINecessário inglês nível avançado. Necessário experiência em Projetos de BI (DAX Power Query e Visuais) e SQL Server (Linguagem SQL TSQL Criação de Views Procedures Jobs) SharePoint Modelagem MultidimensionalHabilidade no contato com o cliente na Identificação dos Requisitos e na Documentação.Diferenciais: Conhecimento de SpotFire SSIS(Integration Services) SSAS (Analysis Services) Tabular e/ou Multidimensional DataLake Conhecimento de Soluções Cloud para BI Linguagem R ou Python para Analise Preditiva. Principais Responsabilidades:Responsável por identificar modelar e documentar requisitos de negócioDesenvolver Dashboards para área financeira e contábil .Fornecer dados para Compliance Realizar estimativas de esforço realizar PoC (Proof of Concept) para validar implementaçõesGerir riscos técnicos. Faremos contato apenas com os profissionais alinhados ao perfil.  Agradecemos a compreensão.,Solon Consultoria,Ontem,data-science
v1931527,Analista de Business Intelligence (Barueri),Não informado,Salário a combinar,1,2019-09-27,Sênior,Principais Atividades:Elaboração de  relatórios gerenciaisExtração manipulação e análise de ETL para modelagem dos relatóriosConstrução de reports e dashboardsAutomatização de relatórios via VBA/SQLEstudos e analises de BIPlanejamento e organização de reuniões estratégicas para a equipe gerencialMelhoria de processos. Requisitos:Superior completoInglês FluenteConhecimento em ferramentas de banco de dados. Local e Carga Horária:Barueri: Segunda a sextafeira horário comercial. Pacote de Remuneração:Salário e benefícios compatíveis com o mercado,Confidencial,29/07/2019,data-science
v1950883,Analista Business Inteligence Jr. (Running),Não informado,Salário a combinar,1,2019-09-27,Júnior/Trainee,Atividades:Garantir a evolução tecnológica do ambiente de BI em Running por meio de planejamento do roadmap de iniciativas de médio e longo prazosAvaliação e adoção de novas tecnologias e ferramentasProvidenciar os dados necessários aos parceiros da equipe para realização de análises e construção de painéisOferecer suporte ao processo de sustentação da Ferramenta Power BI na empresa (extração transformação carregamento (ETL) e integração de dados)Construir modelos de dados e painéis/dashboards relevantes que ajudem na detecção de problemas da áre de Running e Enhancements (melhorias causaraiz problems). Prérequisitos:Experiência como Analista de BIGraduação concluída em Análise de Sistemas ou em áreas correlatasInglês avançado. Fluente será considerado diferencialConhecimento avançado do Pacote Office 365Noções de componentes de infraestrutura (Rede servidores comunicação banco de dados aplicações WIN/WEB)Conhecimentos Básicos de processos gerais de negócios (Comerciais industriais financeiro e exportação)Ter bom relacionamento interpessoal perfil de liderança capacidade de negociação senso de urgência comunicação e organização.,Louis Dreyfus Company,02/09/2019,data-science
v1962461,Analista de Marketing / Business Intelligence,Brasília,Salário a combinar,1,2019-09-27,Pleno,SIGMA CONTRATAANALISTA DE MARKETING / BUSINESS INTELLIGENCEFORMAÇÃO:Ensino Superior CompletoPósGraduação em Marketing BI Gestão Comercial ou áreas afins. DESEJÁVEL:Experiência no segmento educacionalNecessário domínio avançado em Excel.Experiência com redes sociais produção e publicação de relacionamento com o público.Vivência com os canais digitais: site landing page appemail mkt comunicados informativos e newsletter.Experiência e alcance de metas de captação de alunos em diferentes canais desenvolvendo estratégias de captação retenção relacionamento acompanhamento e gestão de carteira.Domínio de ferramentas de CRM para gestão de resultados de call center e atendimento in loco.Criação acompanhamento e analise de dados de mercado para construção de dashboards e painéis de resultados.Expertise no controle do budget mensal x gastos com campanhas. Disponibilidade de 44 horas semanais com flexibilidadede horário. BENEFÍCIOS:ValeTransporteValeAlimentação/RefeiçãoPlano de saúde e odontológicoSeguro de VidaGympass Estacionamento,Kroton Educacional,Há 7 dias,data-science
v1956306,Coordenador de Business Intelligence - Mídia Digital,São Paulo,Salário a combinar,1,2019-09-27,Supervisão/Coordenação,"""Help 'we' need somebody...Help not just anybody"" Os Beatles já diziam e nós já sabemos disso. Cada pessoa é única e estamos buscando alguém que faça o diferencial. Temos uma oportunidade para um(a) Coordenador de Business Intelligence para fazer parte do nosso time.O(a) dia a dia desse(a) profissional será desafiador e com variadas atividades. Pensando nisso aqui vão algumas delas: Desenvolver implantar e gerenciar processos métodos padrões e indicadores de pesquisas de mercado e digitais por meio da identificação de necessidades e oportunidades nas diversas áreas da agência visando gerar informações consistentes e de forma ágil. Realizar pesquisas de mercado e/ou digitais por meio da busca e análise de referências e tendências objetivando criar uma base conceitual e prática que fortaleça as estratégias de planejamento da agência. Participar do planejamento de projetos publicitários mediante a disseminação de tendências e resultados contribuindo com a geração de insights e construção de conceitos. Contribuir com o desenvolvimento e garantir a execução de estratégias e táticas em sua área por meio da atribuição e acompanhamento de objetivos coletivos e individuais assegurando a geração de resultados. Realizar a gestão técnica administrativa e operacional de sua área por meio do desenvolvimento implantação e acompanhamento de processos políticas procedimentos e indicadores que garantam a efetividade das entregas. Gerenciar pessoas e equipes em prol de objetivos comuns definindo papéis responsabilidades objetivos e fornecendo recursos e orientações que garantam a realização das atividades e entrega de resultados. Executar o planejamento orçamentário de sua área e gerenciálo efetivamente ao longo do ano garantindo que os custos despesas e investimentos sejam realizados de acordo com as prioridades da organização. Apoiar a alta liderança no desenvolvimento e execução do planejamento estratégico da agência visando assegurar seu desenvolvimento crescimento e continuidade e contribuindo com a elaboração e implantação de processos de gestão estruturados segundo elevados padrões de qualidade.Requisitos:Inglês Intermediário/AvançadoEnsino superior completoHabilidades em informática como usuário (MS Office Internet email sistemas de gestão)Experiência em agências de publicidadeHabilidade com softwares de pesquisaDesejável experiência como líder de equipe Ter atuado em agências de publicidade.Local de Trabalho: Vila Madalena",NBS,11/09/2019,data-science
v1962965,Analista de Business Intelligence: Crédito e Cobrança,São Paulo,Salário a combinar,1,2019-09-27,Sênior,Executar tarefas de relatórios diários de Contas a Receber (Ageing) base de overdue para agências de cobrança Painel diário de Crédito Cobrança Constas a Receber e Tesouraria contendo principais KPIs. Prover manutenção semanal da base de Contas a Receber (Ageing) geral a ser compartilhada com áreas internas + time corporate e crédito. Relatórios de gestão do DSO PDD e D9 (acordos) além do suporte ao time interno de vendas e áreas parceiras.Responsável pela rotinas de fechamento (prover report para time global).Principais Atividades:Manutenção do relatório de Ageing + carteira de cobrança interna e externaGarantir a manutenção diária do Dashboard de Crédito Cobrança e Contas a ReceberResponsável pelas atividades de fechamento SAP garantindo que os números estejam alinhados com o painel global de crédito buscando sempre a excelência por meio da acuracidade nas informações reportadasSuporte ao time de Vendas para analisar prazos especiais e seus possíveis impactos no DSO. Disponibilizando informações por conceito as quais devem servir de base para tomada de decisões da gerênciaAtuar em projetos de melhorias da área: Report de Acordos (D9) criação de relatórios utilizando ferramenta PowerBI melhorias de DSO etcRequisitos:Ensino superior em Administração Economia ou áreas correlatasTécnica para utilização de MacrosConhecimento de VBA e AccessExcel AvançadoBons conhecimentos em matemática financeiraRelacionamento interpessoalInglês avançado.,Luxottica Brazil,Há 4 dias,data-science
v1955642,Analista de Marketing II - Business Tracking,Rio de Janeiro,Salário a combinar,1,2019-09-27,Pleno,ATRIBUIÇÕES E RESPONSABILIDADES DA FUNÇÃO:Responsável pelo desenvolvimento e controle de sistema de Business Intelligence (Banco de dados Querys)Responsável pela geração de relatórios e dashboard para reuniões de mercado e canais (Lumira PowerBI Excel)Responsável pela geração diária e mensal de informações para equipe de vendas e marketingResponsável pela análise de desempenho do mercado via leitura NielsenParticipação e apresentação em reuniões Comerciais e de Marketing INFORMAÇÕES SOBRE O PERFIL:ESCOLARIDADE/FORMAÇÃO:Ensino Superior completo em Sistemas da Informação Administração Engenharias e EconomiaCONHECIMENTOS E HABILIDADES:Banco de dados PowerBI Excel (nível avançado) SAP PowerPoint (nível avançado)OUTROS:Conhecimento de Nielsen Geomarketing Ferramentas QGIS,Confidencial,10/09/2019,data-science
v1961433,Assistente de Atendimento,Belo Horizonte,Salário a combinar,1,2019-09-27,Auxiliar/Operacional,ATRIBUIÇÕES:Responsável pela operacionalização dos processos de busca e manutenção do doador coletando dados e gerando relatórios gerenciais bem como os processos de cobrança dos clientes incluindo o acompanhamento de eventualidades que possam surgir nestes processos observando as diretrizes da Salvaguarda InfantilRealizar o contato com doadores e possíveis doadores em potencialConfeccionar relatórios para tomada de decisãoTrabalhar com Business Intelligence. REQUISITOS:Experiência na área de atendimento ao cliente rotinas de escritório análises e desenvolvimento de relatórios.Desejável experiência com Business Intelligence. Ensino Médio Completo. Pacote Office.Excel Intermediário.Conhecimento em Power BI.,Grupo SELPE,19/09/2019,data-science
v1961258,Analista de Sistema Sênior (SAP-BW),Brasília,Salário a combinar,1,2019-09-27,Sênior,Requisitos:Formação superior completa em Ciências da computação Análise de Sistemas ou áreas afinsVivência em atividades de elaboração de indicadores e relatórios elaboração de apresentações gerenciais desenho de solução organização de banco modelagem de dados e ETLExperiência de TI voltada ao negócioSólida experiência em SAP BW extrações de dados do SAP ECC dos diversos módulos funcionaisDesejável experiência na indústria farmacêuticaDesejável conhecimento em ferramentas de Business Intelligence e Analytics (QlikView/Qlik Sense Power BI). Atividades:Levantamento de atividades junto as áreasAnálise e entendimento de requisitos especificações funcionais testes e treinamentoConfiguração e customização em ferramentas de business intelligence e analyticsModelagem e extração de dadosResponsável por projetos e sustentação.,União Química Farmacêutica Nacional,19/09/2019,data-science
v1956327,Analista de BI,São Paulo,R$ 3.000 a R$ 3.500,1,2019-09-27,Pleno,Plena compreensão de como a organização funciona para alcançar seus objetivos Elaboração de apresentações gráficos e relatórios para discussão com a gestão superior Interação com os gestores da área fornecendo insumo para a tomada de decisões Utilização de conceitos de BI (Business Intelligence) e BA (Business Analytics) para geração de dados da operação da área Envolvimento com as áreas de TI para utilização de novas ferramentas a serem utilizadas na área.,Luandre,11/09/2019,data-science
v1948539,Coordenador de Sistemas e BI,Curitiba,Salário a combinar,1,2019-09-27,Supervisão/Coordenação,Coordenar times de desenvolvimento internos e fornecedores garantindo a entrega dos projetos com qualidade dentro do prazo e custo utilizando metodologias ágeis ou cascata (quando esta se adequar melhor). Sistemas de business intelligence fazem parte do escopo de trabalho da função. O coordenador apresentará relatórios e dashboards de desempenho para o nível executivo sendo responsável pelos resultados.   PréRequisitos:Experiência com gestão de times e projetos de sistemas incluindo BI (business intelligence). Será considerado diferencial se o candidato possuir experiência em sistemas WMS TMS e Manutenção. Experiência com entregas de BI é mandatória.Atividades: Elaborar relatórios para nível executivo analisar necessidades do clientes elaborar orçamentos negociar propostas gerir times de desenvolvimento e fornecedores controlar custos fixos (OPex) e investimento (CAPex)Horário de trabalho: comercialBase de trabalho: Curitiba com disponibilidade para viagens semanais para Paranaguá,TCP,28/08/2019,data-science
v1962594,Analista de BI Pleno,São Paulo,Salário a combinar,1,2019-09-27,Pleno,Principais atividades:Desenvolver projetos de Business Intelligence e Analytics implementando aplicações de BI sobre plataformas convencionais trabalhando conceito de modelos multidimensionais.Em alguns casos será necessário desenvolver arquiteturas alternativas adotando mineração em dados semiestruturadas no SQL e trabalhos relacionados a alta escalabilidade de dados (projetos de Big Data e Analytics). O que iremos avaliar:Qual curso superior você concluiu e no que poderá contribuir em sua atuação profissionalVivência ou bons conhecimentos de ETL programação relacionada a banco de dados relacional e noSQL.Levantamento Modelagem Design e Implementação de aplicações de Business Intelligence e AnalyticsModelagem dimensional de dadosDesign e implementação de processos de ETL (Extração Transformação e Carga) de dados a partir de bancos de dados e outras fontes para modelos dimensionais envolvendo grandes volumes de dadosConhecimentos em QlikSense ou QlikView Local de trabalho: Jabaquara,Grupo Fleury,Há 5 dias,data-science
v1951261,Vendedor Interno,Campinas,Salário a combinar,1,2019-09-27,Júnior/Trainee,Atividades do cargo: Atendimento ao cliente prospecção negociação de preços e contrato vendas pesquisa de mercado visitas pontuais entre outras atividades. Formação: Superior completo em Química ou Farmácia.Idioma: Inglês avançadoCompetência: conhecimento em sistema SAP.Experiência: na área comercial/ vendas internas ou business intelligence. Será um diferencial ter experiência em empresas Químicas ou farmacêuticas.,Global Empregos,18/09/2019,data-science
v1950241,Analista de Negócios,São Paulo,Salário a combinar,1,2019-09-27,Sênior,Requisitos: Gestão ode requisitos Gestão de projetos Gestão de fornecedores (RFP contratos...) Metodologia ágil (Scrum) Gestão de serviços de IT (ITIL) Inglês avançado. Atividades: Entender as necessidades de negócio e entregar soluções incluindo especificação de requerimentos Gerir projetos e fornecedores Atendimento da área comercia do mercado Pharma (carteira de pedidos Business Intelligence Eventos Serviços e Operações).,Talent Group (T.I.),30/08/2019,data-science
