idVaga,NomeVaga,Cidade,Salario,QuantidadeVaga,DataPesquisa,Perfil,Descricao,Empresa,DataPubli
v1950547,Consultor (a) - Desenvolvedor Servicenow,São Paulo,Salário a combinar,1,2019-09-05,Sênior,No processo de encantamento do cliente atuar no relacionamento com grandes corporações governo pequenas médias e grandes empresas é o que mais te agrada Se é isso que faz a sua cabeça o B2B da Vivo é o caminho mais promissor para você. Desenvolva canais de vendas planeje e acompanhe os processos de venda e pósvenda defina diretrizes ofertas campanhas metas comerciais e planos de incentivo. Mais do que conquistar aqui a missão é desenvolver e manter os clientes com um portfólio completo de soluções de mobilidade voz e dados fixos produtos digitais e de TI como Data Center Segurança Big Data além de inovações alinhadas à estratégia global. Nosso trabalho contribui com o crescimento da receita e da base de clientes corporativos da Vivo.  O que você terá de responsabilidades: Responsável pelo desenvolvimento de novas soluções com a plataforma Service Now e integração a outras Portais InternosConstrução de Jobs em Sql ServerInglês intermediário.Desenvolver aplicações FrontEnd com  HTML5 CSS C # Angulas JS Bootstrap React e JavaScript Desenvolver APIs usando JavaScript.O que buscamos em você: Formação Superior em Engenharia/Ciência da computação Sistemas de Informação Tecnólogo em TI ou área afinsConhecimento em Desenvolvimento e Manutenção na plataforma Service Now e nas linguagens HTML Angular vs 4 ou + C# e ASP.NET MVCConhecimento de banco de dados SQL Server 05/08/08R2/12/14 principalmente em Tsql criação de views e proceduresConhecimento em ETL: SSIS Sql Server Integration Services.O que oferecemos para você*Remuneração compatível com o mercadoVale Refeição e Vale AlimentaçãoPlano de Saúde e OdontológicoBenefício de academiaSeguro de VidaComplemento Salarial por AfastamentoPrevidência PrivadaPPRHorário FlexívelDay Off no AniversárioAuxilio creche e babá (para mães ou pais)Auxilio para filhos com deficiênciaAparelho celular e plano corporativoEntre outros*de acordo com a política de elegibilidade determinada pela empresa Temos uma cultura que valoriza a diversidade as diferenças e o potencial das pessoas.Agradecemos pelo seu interesse.Recursos Humanos | Telefônica,Telefônica Brasil,Há 3 dias
v1921803,Analista de Infraestrutura de TI - Pleno,Belo Horizonte,Salário a combinar,1,2019-09-05,Pleno,A TI é a protagonista da evolução e digitalização da manufatura. A ArcelorMittal Sistemas atende às empresas do Grupo ArcelorMittal no perímetro Américas: Brasil Canadá EUA México Costa Rica e Argentina sendo considerada um referencial na gestão de TI com atuação nas frentes de Sistemas e Infraestrutura de TI. Com o desafio de suportar e alavancar a digitalização das usinas em direção à Indústria 4.0 bem como obter ganho de produtividade e otimização de recursos essa área tem investido no uso de novas tecnologias como Big Data Ciências de Dados Automação Drones Robótica Cloud e busca profissionais que vão ser fomentadores dessa transformação digital.Temos em aberto uma oportunidade para Analista de Infraestrutura de TI Pleno e caso tenha interesse em vir a compor nosso Time o/a convidamos a confirmar sua inscrição.Sua principais responsabilidades serão:Administração dos SGBD realizando atividades de DBA tais como: análise/ajustes de performance análise de capacidade aplicação de Upgrade e support package migração de versão SAP homogeneous system copy execução de atividades de rotina da área atendimento de incidentes de requisições de serviços e resolução de problemas.Reuniões/Interações com clientes para apresentação de relatórios mensais sanar dúvidas explicações sobre crises etc. Isto tanto para clientes nacionais quanto internacionais. Estamos buscando profissionais que possuam os seguintes requisitos: Graduação completa em Ciência da Computação Ciência da Informação ou AfinsExperiência como Analista de Banco de dadosQue possuam inglês intermediário (desejável avançado)Conhecimento de banco de dados Oracle SQL Server Sybase e HANA (pelo menos em 2 desses SGBD).,ArcelorMittal Brasil,10/07/2019
v1922940,Analista de Segurança da Informação Sênior (Proteção de Dados),Rio de Janeiro,Salário a combinar,1,2019-09-05,Sênior,Formação acadêmica:Ensino superior completo em Ciências da Computação Tecnologia da Informação Informática Segurança da Informação Matemática ou áreas afins. Prérequisitos:Conhecimentos necessários:Sistemas Operacionais Windows e UnixBanco de dados relacionais e não Relacionais (NoSQL)Ferramentas de CASBFerramentas DLPClassificação da InformaçãoNuvens públicas e privadas (Azure AWS Oracle etc)REST JSON OpenID OAuth WebToken SAML SSOPCI\DSSMascaramento de Dados Experiências necessárias:Privacidade e/ou Proteção de Dados atuação em instituição financeira será um diferencialConstrução de controles para proteção de dadosSegurança de banco de dados para definição de hardening e assessment em ambientes críticosSegurança para big data definindo arquitetura e hardeningRequisitos para processamento seguro de dados na forma de regulamentos de privacidade (por exemplo GDPR LGPD) regulamentos específicos para computação em nuvem e outros padrões de segurança específicos de dados (por exemplo PCI DSS)Desenvolvimento de políticas de armazenamento implantações de criptografias e outrosGestão de projetos e gestão de mudanças Certificações:Certificação ISO27002 (obrigatório)Certificação Security + (desejável)Certificação CISSP (desejável) Principais responsabilidades:Desenvolver processos de classificação da informação e implementálas junto as áreas de negócioRevisar e orientar sobre a implementação dos princípios de Segurança de Dados PessoaisRealizar avaliações de risco de fornecedores conforme metodologia e processos internosDesenvolver e implementar controles para privacidades de dadosAtuar em projetos definindo requisitos de segurança da informação para proteção de dadosDesenvolver materiais produtos processos e métodos relacionados à segurança da informação  Pacote de Benefícios:Assistência médica Assistência odontológica Vale alimentação Vale refeição Vale transporte Auxílio creche ou babá Serviço de Assistência Funeral Seguro de vida Previdência privada Bônus de curto prazo (PLR),Icatu Seguros,12/07/2019
v1944988,Engenheiro de Dados,São Paulo,Salário a combinar,1,2019-09-05,Sênior,• Construir avaliar e executar scripts de atualização de dados de forma performática.• Garantir as melhores práticas em relação a modelagem e persistência de dados.• Conhecer o modelo/regras de negócio para garantir a governança da informação.• Atuar juntos desenvolvedores administradores de dados cientistas de dados equipe de infra e Product Owner a fim de criar soluções de dados.• Catalogar os produtos e serviços.• Garantir a integração dos dados para possibilitar o cruzamento de informações e acompanhamento de métricas.• Garantir que as políticas de segurança estão sendo aplicadas na camada de acesso aos dados.• Fomentar a utilização de técnicas de automação para provisionamento configuração e monitoramento dos ambientes de banco de dados. Principais Requisitos• Superior completo em Tecnologia da Informação Engenharia da Computação Ciência da Computação ou áreas correlatas.• Conhecimento de Java SQL Linux Shell• Experiência em projetos Big Data processamento distribuído (HDFS Hive ou Impala HBase Spark Kafka Scala Sqoop Storm)• Experiência em ambientes de alta criticidade.• Conhecimento. em modelagem de dados relacional e não relacional.• Experiência em banco de dados Oracle SQL Server e MySQL• Cultura DevOps (fazer parte de um time DevOps e aprender outras tecnologias de persistência de dados). São considerados Diferenciais • Experiência em banco de dados NoSQL(Hbase Cassandra MongoDB).• Experiência com ferramentas de ETL e integração de dados.• Conhecimento em ferramentas para gestão de dados (ciclo de vida de dados replicações de dados real time mascaramento de dados).• Conhecimento de sistemas distribuídos e aplicações web. O que oferecemos: • Salário CLT avaliaremos a pretensão salarial x expertise• Valerefeição de R$4500 por dia• Assistência Médica e Odontologica– SulAmérica• Auxílio Educação/Idiomas e Auxílio Faculdade/PósGraduação • Snacks e bebidas free no escritório• Pagamento semanal• Horário flexível• Convênio com Gympass• Sem Dress Code aqui você pode trabalhar de camiseta bermuda etc. afinal o que importa é seu resultado!  Achou essa oportunidade a sua cara Nós queremos te conhecer!,ATLAS QUANTUM,21/08/2019
v1935441,Assistente Administrativo de Marketing,São Paulo,Salário a combinar,1,2019-09-05,Júnior/Trainee,VAGA EXCLUSIVA PARA PESSOAS COM DEFICIÊNCIA (PCD)Você tem interesse em trabalhar na VivoNa Vivo trabalhamos para promover uma cultura inclusiva que busca equidade e valoriza a diversidade de Gênero PcD Raça e LGBT+. Todas as nossas vagas respeitam esse compromisso.É com diversidade que conseguimos transformar possibilidades em realidade. Venha construir seu futuro com a gente! Conheça nossas oportunidades.Profissionais com deficiência são muito bemvindos! Faça parte dessa história! #VemPraVivo! Conheça um pouco sobre a VP de B2B:No processo de encantamento do cliente atuar no relacionamento com grandes corporações governo pequenas médias e grandes empresas é o que mais te agradaSe é isso que faz a sua cabeça a VP B2B da Telefônica é o caminho mais promissor para você. Desenvolva canais de vendas planeje e acompanhe os processos de venda e pósvenda defina diretrizes ofertas campanhas metas comerciais e planos de incentivo. Mais do que conquistar aqui a missão é desenvolver e manter os clientes com um portfólio completo de soluções de mobilidade voz e dados fixos produtos digitais e de TI como Data Center Segurança Big Data além de inovações alinhadas à estratégia global do Grupo Telefônica. Nosso trabalho contribui com o crescimento da receita e da base de clientes corporativos da nossa organização.   Responsabilidades e atribuições: Desenvolver análises de mercado desenvolvimento da estratégia de curto a longo prazo das famílias de produto e acompanhar a implementação dos planos de ação resultantes.Pesquisar e promover potenciais oportunidades de negócio visando maximizar o resultado por linha de produto.Elaborar análises que suportem planejamento estratégico relacionado aos produtos.Interface com a área comercial auxiliando no desenvolvimento dos produtos e na elaboração de ações para rentabilização e crescimento do resultado.Acompanhamento end to end de projetos visando a melhoria dos resultados e rentabilização da empresaApresentações em geralAnalise e acompanhamento de indicadores via ExcelRequisitos e qualificações: Requisitos Imprescindíveis:Superior CompletoPerfil analíticoBom conhecimento em Word Excel (de Intermediário a Avançado) e PowerPoint. Requisitos Comportamentais:Excelente habilidade de comunicação verbal e escritaResiliência iniciativa e dinamismoAtitude “handson”Criatividade persistência e organizaçãoCapacidade de gestão de recursos tempo e pessoasVontade de aprender e foco em resultadosLiderança pensamento estratégico e analítico. Requisitos Desejáveis:Experiência em Telecom (áreas Gestão de Vendas Marketing Canais ou Regionais)Experiência em gestão de resultadosInformações adicionais: Local: São Paulo SP Zona Sul BerriniO que oferecemos para você*Remuneração compatível com o mercadoComplemento Salarial por AfastamentoHorário FlexívelDay Off no AniversárioClube de VantagensAuxílio creche e babá (para mães ou pais)Auxílio para filhos com deficiênciaAparelho celular e plano corporativoEntre outros*de acordo com a política de elegibilidade determinada pela empresaTemos uma cultura que valoriza a diversidade as diferenças e o potencial das pessoas.Agradecemos pelo seu interesse.Recursos Humanos | Telefônica,Telefônica Brasil,05/08/2019
v1926674,Management Internship In Engineering - Seropédica / Crux Plant - Eng00002158,Rio de Janeiro,Salário a combinar,1,2019-09-05,Estágio,DESCRIPTION/RESPONSIBILITIES:Do you want to be challenged since your Day 1Are you seeking experience related to your degree Looking for a challenge Want to work on leading edge technologies Experience what engineering can be like by having an internship with Procter & Gamble. Here Product Supply engineers have the technical curiosity and knowledge to develop new approaches to big problems by analyzing crafting troubleshooting and improving manufacturing process technologies systems and facilities. You will have the chance to deliver a meaningful contribution to the business while supporting your academic training with work which will allow for creativity innovation and teamwork.AS A P&G INTERN YOU WILL: Have a meaningful work with real and important challenges since the beginning of your career Work with leading Brands that are present in the homes of 95% of Brazilians Have development opportunities with structured programs and day to day mentorship and coaching to become one of our next leaders Be part of a company with strong principles and values that encourage employees to have an innovation mindset.ABOUT USP&G was established in 1837 in the United States and has been in Brazil since 1988. Committed to our mission of improving people's lives now and for future generations P&G is the largest consumer goods company in the world serving approximately 5 billion people in more than 180 countries always bringing innovation and the best products to our consumers. The company has one of the strongest portfolios of leading trusted and high quality brands including Pampers® Ariel® Always® Pantene® Gillette® Downy® OralB® Head & Shoulders® Venus ® OldSpice® among others. We care about people so we have phenomenal projects like our Children Safe Drinking Water and our Zero Waste Plants.Why work at P&GThe development of our talents is a priority we have a culture of growth and internal promotion that differentiates us. For this we offer meaningful responsibilities from day one with effective and constant training. Thus we demonstrate the strengths of our employees and develop them to become phenomenal leaders reaching the highest levels of management. In addition diversity is very important for us: we seek the most diverse talent so that we always know how to innovate exceeding the expectations of our 5 billion consumers. Therefore working at this company is the best opportunity to do what you love with constant challenges and to be recognized for its results. More than that it's the ideal opportunity to help us touch and improve billions of lives around the world every single day.BENEFITS Grant compatible with the market Meal voucher Life insurance P&G store with products with discounts Transportation benefit: parking lot shuttle or transportation voucher Health insurance Dental plan Flexible working time Physical activity benefit (GymPass) Benefit of medicines and reimbursement of vaccines Activities of our wellness programREQUIRED SKILLS:QUALIFICATIONS Graduation Date: Dec/20 to Jul/21 English skills: Fluent or advanced (mandatory) Availability to work 30h per week We are looking for someone that currently lives in the city of the internship or ought to have mobility to this city (we don't offer housing allowance) This position can be filled with people with disabilities,P&G,19/07/2019
v1947220,Assistente Jurídico,Santa Bárbara d'Oeste,Salário a combinar,1,2019-09-05,Júnior/Trainee,Requisitos:Superior em Direito com conhecimentos de direito Trabalhista Tributário Cível/Contratual e SocietárioConhecimento do sistema Office.Experiência em direito trabalhista será um diferencialInglês Avançado Principais atividades: Acompanhar e documentar o andamento dos processos de interesse do grupo bem como formar arquivos atualizados dos mesmos de procedimentos contratos e demais documentos jurídicosDiante de qualquer nova reclamatória trabalhista reunir toda a documentação e investigar detalhadamente os fatos para garantir que todas as informações precisas e relevantes à defesa dos interesses da empresa sejam reunidasControlar e conferir fluxo de informações (prazos diligências e pagamentos) com escritórios e prestadores terceirizadosLevantar sistematizar e formar relatórios de dados estatísticos das contingências e de provisão analisando defesas decisões atas de audiência etc relacionados a processos do grupoElaboração de relatórios de acompanhamento dos escritórios para gestão da performanceAuxilio na análise e revisão de contratos e seus aditivos de menor complexidade firmados pelas empresas do grupo em suas atividades correntesGestão pagamentos Judiciais honorários e reembolsos e de depósitos JudiciaisEventualmente participar como preposto em audiências trabalhistas consolidação das informações relacionadas a processo trabalhistaElaboração e controle das procurações carta de preposição e substabelecimentos.,Confidencial,26/08/2019
v1951317,Estágio em Remuneração,São Paulo,Salário a combinar,1,2019-09-05,Estágio,A área de remuneração é responsável pela gestão da Remuneração observando as políticas e diretrizes estabelecidas pela empresa visando contribuir para a manutenção do equilíbrio interno a competitividade externa das práticas de remuneração e a motivação e desenvolvimento profissional dos recursos humanos de todos os negócios da empresa. Além disso ela apoia as Relações Sindicais observando as diretrizes estabelecidas pela diretoria visando contribuir para as negociações de manutenção das convenções e acordo coletivos para todos os negócios da empresa.Atividades: • Elaboração e análise de descrição de cargos • Estudos de estrutura de cargos e salários • Participação e análise de pesquisa de mercado • Atualização de tabelas salariais • Alterações de cargos • Transferências e outros tipos de movimentação.Requisitos: • Cursando ensino superior em Administração Economia Estatística Contabilidade ou cursos correlatos com formação prevista para Dez/2021 ou Dez/2022 • Conhecimentos avançados no pacote Office principalmente Excel (Conhecimentos prévios em PROC Tabela Dinâmica Gráficos e Fórmulas Simples) • Disponibilidade para estagiar das 10h às 17hBenefícios: • Bolsa Auxilio compatível com o mercado • Vale Refeição • Assistência Médica • Assistência Odontológica • Auxílio Transporte,Confidencial,Há 2 dias
v1946809,Técnico em Segurança do Trabalho,Pouso Alegre,Salário a combinar,1,2019-09-05,Técnico,Principais responsabilidades: Cumprir toda legislação pertinente Inspecionar os equipamentos de proteção contra incêndios Promover campanhas palestras e outras formas de treinamento para a conscientização dos funcionários Garantir a execução das atividades de segurança do trabalho Assegurar que sejam minimizados ou eliminados os riscos e ocorrências de acidentes Promover inspeções nos locais de trabalho identificando riscos e tratandoos Gerir os EPIs Equipamentos de Proteção Individual (distribuição inspeção etc.) Fornecer apoio à CIPA Fornecer apoio à SIPAT organizando as atividades e recursos necessários Verificar extintores de incêndio Emitir relatório diário sobre condições de trabalho Elaborar APR (Análise Preliminar de Risco) Elaborar estatísticas Executar atividades afins necessárias ao bom desenvolvimento do setor. Formação/Conhecimentos Específicos: Curso Técnico Completo em Segurança do Trabalho Domínio do Pacote Office (Excel Word e Power Point) Imprescindível ter proficiência nas Normas: NR5 NR6 NR7 NR9 NR10 NR11 NR12 NR13 NR15 NR16 NR17 e as demais pertinentes a atividade Elaboração de APR (Análise Preliminar de Risco) Treinamentos voltados a área DDS Desejável experiência em indústria,XCMG BRASIL,26/08/2019
v1934787,Programa de Estágio 2020 - Ypê,Brasil,Salário a combinar,1,2019-09-05,Estágio,OBJETIVO DO PROGRAMAO objetivo do Programa de Estágio Ypê é proporcionar aos estudantes uma experiência de aprendizagem profissional em um ambiente onde possam desenvolver atividades de estágio de forma desafiadora criando objetivos específicos que serão guiados pelo orientador de estágio. LOCAIS DISPONÍVEIS·         Amparo (SP)·         Salto (SP)·         Anápolis (GO)·         Goiânia (GO)·         Simões Filho (BA). REQUISITOS• Cursos ElegíveisAdministraçãoAnálises de SistemasCiência da ComputaçãoCiências ContábeisDireitoEconomiaEngenharia da ComputaçãoEngenharia de Automação e controleEngenharia de ProduçãoEngenharia ElétricaEngenharia MecânicaEngenharia QuímicaEstatísticaMarketingPsicologiaPublicidade e PropagandaQuímica IndustrialRelações InternacionaisRelações Públicas • Ano de formaçãoPenúltimo e último ano da Graduação em 2020.• IdiomaInglês desejável REMUNERAÇÃO E BENEFÍCIOS·         Bolsaauxílio competitiva  ·         Fretado·         Assistência médica·         Assistência odontológica·         Vale alimentação·         Seguro de vida. PROCESSO SELETIVO ETAPAS• Inscrições e testes online 26/08 a 30/09• Dinâmica em grupo online Outubro• Painel e entrevistas presenciais com gestores  Novembro• Início do programa Janeiro/2020 Desejamos boa sorte a todos!Maiores infirmações acesse: www.estagioype.com.br,Confidencial,02/08/2019
v1947744,Estágio TI,Ribeirão Preto,Salário a combinar,1,2019-09-05,Estágio,Principais Atividades:Lançar requisições de compra e Folha de serviço no sistema SAPMonitorar as requisições de compras lançadas atuando como um facilitador entre a áreas de TI e ComprasSuporte no acompanhamento do orçamento de TI diretamente afetado pelo lançamento das requisições de comprasApoio na elaboração de controles e relatórios de status de indicadores de TIMonitorar a ferramenta de Service Desk fazendo o acompanhamento e encaminhamento das filas de chamados para os analistas das equipes de TIAnalisa e atende chamados básicos realiza testes e identifica a solução de incidentes e problemas simples e mais conhecidosEncaminhar para os analistas e especialistas à resolução de problemas mais complexos em relação ao funcionamento da operação como: paradas repentinas em servidores problemas em gerenciadores de email falhas de segurança gerenciamento de permissões etcRealizar atendimento a usuários estações de trabalho e sistema de forma remota por telefone ou no localElaborar atualizar e manter a documentação técnica básica do ambiente de TI assim como às planilhas de inventário relatórios estatísticos e os procedimentos entre outros garantindo que estejam disponíveis e atualizados.  Requisitos:Ensino Superior cursando em Tecnologia da Informação Ciências Contábeis Administração e FinançasConhecimento em Pacote Office ou Planilhas GoogleConhecimento em SAP será um diferencial.,Santa Helena,27/08/2019
v1949028,Cientista de Dados,São Paulo,Salário a combinar,1,2019-09-05,Sênior,ATIVIDADES DA ÁREA:Criar analisar e otimizar a performance e engajamento das campanhas no CRMCaptar KPI’s no CRM de dados LTV e estratégiasDefinir estratégias de retenção por categorias e desenvolver um conhecimento aprofundado do que se adequa a cada tipo de usuárioMensurar o sucesso de todas as campanhas e gatilhos através de BI e da plataforma CRM para desenvolver dados e dashboardsTrabalhar com AI na definição de perfis e critérios de segmentação de dadosDesenvolver e implementar uma estrutura analítica no contexto de performance geral dos objetivos de marketing como a efetividade das mídias otimização da taxa de otimização engajamento do consumidor e personalizaçãoEntregar alta performance de Ciência de Dados incluindo informações da fonte de dados processos modelo/algoritmo desenvolvido e tornar insights em ações recomendáveis e sistemáticasAdepto em demonstrar tecnologias analíticas resolvendo problemas de negócios ad hoc inovando em possíveis soluções futuras e trabalhando com parceiros de tecnologia para traduzir suas inovações em soluções analíticas robustas e dimensionadas. REQUISITOS:Conhecimento avançado em BI AI CRM e Data ScienceExperiência e conhecimento em linguagens como Python R JavaInglês avançado e Espanhol (desejável)Graduação completa em Engenharia Estatística Matemática Data Science Marketing correlatas.,Bridgestone,Há 7 dias
