idVaga,NomeVaga,Cidade,Salario,QuantidadeVaga,DataPesquisa,Perfil,Descricao,Empresa,DataPubli
v1948680,Analista de Expansão - Inteligência de Mercado,São Paulo,Salário a combinar,1,2019-09-05,Pleno,Descrição:Elaborar estudos de mercado zelando pelo cumprimento das premissas e normas assegurando a qualidade da expansão da redeAnalisar dados geomercadológicos de potencial de consumo concorrência barreiras geográficas perfil sócioeconômico etc para a implementação de novas lojas e apresentar estudo de viabilidade de mercado.Visitar pontos comerciais prospectados pelas equipes de expansão para avaliação do mercado.Analisar o posicionamento da concorrência no mercado em estudo e o potencial competitivo do modelo de negócio DIA.Solicitar Pesquisas ad hoc para Estudos de Canibalização Ponto Preço Tráfego de Veículos | Pedestres etc.Elaborar dossiê de expansão com condições comerciais financeiras e geomercadológicas para apresentação ao comitê de expansão.Analisar e elaborar estudos de mercado para os projetos de expansão. Requisitos:Superior completo em Marketing Estatística Administração ou Ciências Sociais Inglês e Espanhol intermediário (diferencial) Domínio em ferramentas de GeoprocessamentoExcel avançadoBusiness Intelligence (BI) intermediárioDomínio em Geomarketing e Estatística Conhecimentos em Marketing Varejo e Matemática Financeira  Local de Trabalho:São Paulo SP Horário de trabalho:De segunda a sexta das 8:00 às 17:48,Dia Brasil,28/08/2019
v1948683,Analista de Expansão - Inteligência de Mercado (PcD),São Paulo,Salário a combinar,1,2019-09-05,Pleno,Descrição:Elaborar estudos de mercado zelando pelo cumprimento das premissas e normas assegurando a qualidade da expansão da redeAnalisar dados geomercadológicos de potencial de consumo concorrência barreiras geográficas perfil sócioeconômico etc para a implementação de novas lojas e apresentar estudo de viabilidade de mercado.Visitar pontos comerciais prospectados pelas equipes de expansão para avaliação do mercado.Analisar o posicionamento da concorrência no mercado em estudo e o potencial competitivo do modelo de negócio DIA.Solicitar Pesquisas ad hoc para Estudos de Canibalização Ponto Preço Tráfego de Veículos | Pedestres etc.Elaborar dossiê de expansão com condições comerciais financeiras e geomercadológicas para apresentação ao comitê de expansão.Analisar e elaborar estudos de mercado para os projetos de expansão.Requisitos:Superior completo em Marketing Estatística Administração ou Ciências Sociais Inglês e Espanhol intermediário (diferencial) Domínio em ferramentas de GeoprocessamentoExcel avançadoBusiness Intelligence (BI) intermediárioDomínio em Geomarketing e Estatística Conhecimentos em Marketing Varejo e Matemática Financeira  Local de Trabalho:São Paulo SPHorário de trabalho:De segunda a sexta das 8:00 às 17:48,Dia Brasil,28/08/2019
v1938306,Estagiário Nível Superior,Rio de Janeiro,Salário a combinar,1,2019-09-05,Estágio,Prérequisitos:Estar cursando (preferencialmente a partir do 5º período) cursos como Relações Internacionais Engenharias Administração ou EconomiaTer disponibilidade para o período da manhã/tarde Conhecimentos Desejáveis: Pacote Office Avançado (Windows Word Excel e Power Point)MS Access e Visio desejáveisConhecimento sobre Business Intelligence e suas ferramentas (Power BI e Qlik desejáveis)Inglês avançadoEspanhol desejável Habilidades Comportamentais Desejáveis:Orientação para Resultado e QualidadeAfinidade com númerosSenso CríticoPensamento AnalíticoDinamismoCuriosidadeTrabalho em EquipeOrientação para Melhoria Contínua e Inovação Descrição das atividades:Apoio ao time de Comércio Exterior e Logística Nacional na execução da rotina operacionalCriação de pedidos de compraAvaliação de performance e KPIs de fornecedores de logística nacionalApoio na condução de processos de importação e exportação através da realização de follow up junto a agentes de cargas transportadores e despachantes no Brasil e no exteriorApoio na criação análise e acompanhamento de relatórios de performance financeira e operacional dos processos de logística nacional e comércio exterior das operações da América do SulAuxiliar os analista através do tratamento de informações e análises de mercado bids e novas oportunidades.  Local de Trabalho: Barra da Tijuca,BALL,09/08/2019
v1946507,Desenvolvedor Big Data: Senior,São Paulo,R$ 10.000 a R$ 12.000,1,2019-09-05,Sênior,REQUISITOSConhecimentos com ETLDesenvolvimento utilizando Apache Spark  Desenvolvimento utilizando HadoopDesenvolvimento utilizando ShellscriptDesenvolvimento utilizando Phyton Experiência com CassandraDesejável conhecimento em ScalaDesejável conhecimento em Spark StreamingLOCAL DE TRABALHO• ZONA SUL DE SÃO PAULO,GrupoSITI,24/08/2019
v1951025,Analista de Big Data,Rio de Janeiro,Salário a combinar,1,2019-09-05,Júnior/Trainee,ATIVIDADESAjudar a organizar nossos dados a partir das inúmeras fontes que temos.PRÉREQUISITOSConhecimentos em Python Pentaho Data Integration Hadoop Spark Hive Google Big Query.Vivência em tecnologias e ferramentas voltadas a Big Data Bancos de dados relacionais (MySQL Postgres e SQL Server)Bancos de dados não relacionais (Elastic Search Solr Mongo Dynamo) Filas paralelismo e concorrência.Conhecimentos em Tableau são diferenciais. Local de Trabalho: BotafogoCONTRATAÇÃO: CLTINICIO: IMEDIATO,GrupoSITI,Há 3 dias
v1938057,Desenvolvedor BIG Data / SP,São Paulo,Salário a combinar,3,2019-09-05,Sênior,PréRequisitosNecessário ter experiência com a prática em ambiente Cloudera ETL Scala e Hive.Conhecimentos com ETLDesenvolvimento utilizando Apache HiveDesenvolvimento utilizando Apache ImpalaDesenvolvimento utilizando Apache SparkDesenvolvimento utilizando HadoopDesenvolvimento utilizando SqoopDesenvolvimento utilizando ShellscriptDesenvolvimento utilizando PhytonExperiência com Banco de dados SQL.Desejável conhecimento em Scala Cloudera WorkbenchDesejável vivência com o fluxo Control M.Superior completo na área de TI ou correlata.Contratação CLTLocal de Trabalho: Zona Sul de SP LOCAL DE TRABALHO ZONA SUL DE SP,GrupoSITI,08/08/2019
v1926458,Analista Desenvolvedor BIG Data / SP,São Paulo,Salário a combinar,2,2019-09-05,Pleno,PréRequisitosVivencia em ETL utilizando as tecnologias Python Hive Impala e SparkVivência em Shell script (Unix)Conhecimentos em desenvolvimento web com Angular eBancos de dados baseado em SQL.Superior completo na área de TI ou correlata. Contratação CLT LOCAL DE TRABALHO ZONA SUL DE SP,GrupoSITI,18/07/2019
v1946506,Analista de BI  com vivência em Big Data,São Paulo,Salário a combinar,1,2019-09-05,Sênior,REQUISITOSEspanholLógica de ProgramaçãoPL/SQL OracleShell ScriptJava Desenvolvimento de especificação para construção de malha ControlMDesejável:Uso das Ferramentas: LiquiBase Jenkins Fortify Sonar Confluence e Jira.Conhecimento dos processos de implantação no banco.LOCAL DE TRABALHO• ZONA SUL DE SÃO PAULO,GrupoSITI,24/08/2019
v1935169,Data Analytics,Barueri,Salário a combinar,1,2019-09-05,Pleno,Os desafios desta oportunidade são:Identificar fontes de dados valiosas e automatizar os processos de coletaRealizar o préprocessamento de dados estruturados e não estruturadosDesenvolver meios eficazes de extrair dados históricos de várias fontes e configurar infraestrutura para agrupar e estruturar esses dadosSer responsável pelo desenvolvimento implementação programação e otimização de processos de automação.Apresentar informações usando técnicas de visualização de dadosPropor soluções e estratégias para desafios dos negóciosConstruir modelos para resolver problemas dos negóciosLiderar os painéis de design desenvolvimento e entrega para a equipe de vendasConstruir modelos preditivos e algoritmos de aprendizado de máquinaAnalisar grandes quantidades de informação para descobrir tendências e padrõesSão pré requisitos para esta oportunidade:Ensino Superior CompletoInglês avançadoExcelentes habilidades em Excel Word e Power PointConhecimento desejado no Salesforce SAP e Robotização tecnologias de Big Data e sistemas lacustres.Habilidades com métodos de análise matemática modelagem preditiva análises estatísticas e tecnologias de big data como Python SQL VBA DotNet e Tableau.  Somos GPTW (Great Place to Work) e a 14.ª empresa Mais Amada (ranking Love Mondays)! Compartilhe essa Oportunidade! Damos às pessoas espaço para contribuírem e crescerem pois zelamos e acreditamos que a Diversidade enriquece a colaboração e melhora as soluções potencializa inovações produtividade e gera ganho aos Colaboradores Acionistas Clientes e à Comunidade. Contamos assim com candidaturas Diversas de Negros Mulheres comunidade LGBTQI+ 50+ e de Pessoas com Deficiências (PcD).,Messer Gases,Ontem
v1912730,ESPECIALISTA - Chief Technology Information Officer - Digital Transformation - Big Data & BI Solutions Operations - TSP,Brasil,Salário a combinar,1,2019-09-05,Sênior,Descrição das atividadesGestão do ambiente NBA Next Best Action monitoração análise e correção da execução de campanhas de marketing e motor de ofertas em ambiente SAS envolvendo as tecnologias RTDM ESP. Administração e suporte ao uso da ferramenta SAS Grid. Interação com áreas clientes e pares para acordar e reportar por entregas e prazos contato com fornecedores para planejamento de ações de manutenção de HW e SW abertura de chamados e outras atividades de administração do ambiente NBA.Conhecimento e Experiência desejávelExperiência em na administração de ambientes analíticos e em Operação de TI com domínio da plataforma SAS da ferramenta ControlM e conhecimentos avançados em Linux shell script e SQL. Desejável experiência no mercado de Telecom. Habilidades de planejamento e organização negociação e relacionamento.Formação desejávelGraduação na área de informática ou exatas com pós graduação em informática.Escolaridade MínimaSuperior CompletoEmpresa e Local de TrabalhoM300 TIM S.A.SP Santo André,TIM Brasil,24/06/2019
v1934562,Business Analyst - Data Science,Rio de Janeiro,Salário a combinar,1,2019-09-05,Sênior,Estamos recebendo currículos para a contratação de Business Analyst para atuar em projeto de implantação de sistema focado no negócio de administração de fundos do BNY Mellon. Atividades do profissional:Revisão e design de fluxo de dados de sistema operacionais correlacionados a administração dos fundos administrados pelo BNY MellonConstrução do business case de design da solução de tecnologia impacto operacional plano de implementação entre outrosDeterminar e desenhar fluxo de dados (DFD) gestão de requisitos e homologação da implantação do novo sistema. Requisitos Obrigatórios:Ensino superior com graduação preferencialmente em cursos relacionados à Tecnologia e Ciência de DadosForte habilidade de comunicação em diferentes níveis organizacionais inclusive executivosExperiência sólida em projetos multidisciplinares em multinacionais com estrutura matricial complexaHabilidade de elicitar informação e influenciar colegas para concluir de forma eficienteInglês fluente.Requisitos Desejáveis:Experiência em projetos em empresas do mercado financeiro e/ou consultoria Big FourCertificação PMP ou Prince2Certificação Metodo Agile. Local de Trabalho:Centro Rio de Janeiro Venha transformar a sua carreira no The Bank of New York Mellon presente em 35 países atuante em 100 mercados e com mais de 50 mil funcionários! BNY Mellon é uma empresa que promove a igualdade de emprego para todos.,BNY Mellon Serviços Financeiros DTVM S.A.,02/08/2019
v1942211,Auxiliar Perecíveis -  Big Campo Grande/MS,Campo Grande,R$ 1.107,1,2019-09-05,Auxiliar/Operacional,Responsável por auxiliar nas atividades dos departamentos de perecíveis no setor de açougue como realizar preparações dos produtos que serão expostos nos balcões de vendas e dar suporte necessário ao bom andamento da área. Atividades:·         Receber mercadorias·         Fazer verificações de qualidade·         Auxiliar na preparação de produtos para comercialização de acordo com o sortimento·         Embalar e etiquetar produtos·         Fazer abastecimento nos balcões e exposição da mercadoria de acordo com o padrão estabelecido da loja·         Atendimento ao cliente·         Manter o setor higienizado de acordo com as regulamentações aplicáveis·         Informar sobre a necessidade de manutenção dos equipamentos dos Departamentos de Perecíveis·         Informar sobre problemas no controle de taras das balanças e datas de validade·         Organizar e armazenar produtos no estoque·         Realizar controles do Departamento·         Acompanhar e contar produtos nas áreas internas e externas do departamento em dias de inventário. Requisitos:·         Desejável vivência na área·         Necessário disponibilidade para trabalhar em escala 6x1 (feriados e finais de semana)·         Disponibilidade para atuar na região de Campo Grande/GO Tipo de contrato: Efetivo – CLTSalário: R$ 1.10700Horário de Trabalho: 14:00 às 22:20Localidade: Campo Grande/GO,Walmart,16/08/2019
v1947387,Auxiliar Perecíveis Super Center Big Guara / DF,Brasília,R$ 1.155,1,2019-09-05,Auxiliar/Operacional,Responsável por auxiliar nas atividades dos departamentos de perecíveis no setor de açougue como realizar preparações dos produtos que serão expostos nos balcões de vendas e dar suporte necessário ao bom andamento da área. Atividades:·        Receber mercadorias·        Fazer verificações de qualidade·        Auxiliar na preparação de produtos para comercialização de acordo com o sortimento·        Embalar e etiquetar produtos·        Fazer abastecimento nos balcões e exposição da mercadoria de acordo com o padrão estabelecido da loja·        Atendimento ao cliente·        Manter o setor higienizado de acordo com as regulamentações aplicáveis·        Informar sobre a necessidade de manutenção dos equipamentos dos Departamentos de Perecíveis·        Informar sobre problemas no controle de taras das balanças e datas de validade·        Organizar e armazenar produtos no estoque·        Realizar controles do Departamento·        Acompanhar e contar produtos nas áreas internas e externas do departamento em dias de inventário. Requisitos:·        Desejável vivência na área·        Necessário disponibilidade para trabalhar em escala 6x1 (feriados e finais de semana) Tipo de contrato: Efetivo – CLTSalário: R$ 1.15500Localidade: Guara/DF,Grupo BIG,27/08/2019
v1940727,Analista MIS / BI / CRM / Data Scientist Pleno,Barueri,Salário a combinar,1,2019-09-05,Pleno,Atividades:Elaboração de relatórios de acompanhamentoElaboração de estudos de propensãoElaboração de estudos para criação de campanhasIdentificação de oportunidades para incremento de receitaAcompanhamento e análise de resultados de diversos KPIs para suporte nas tomadas de decisõesAvaliação de Despesas AdministrativasAvaliação de Demonstrativo do Resultado do Exercício (DRE)Apuração de resultados para cálculo de remuneração.Pré requisitosGraduação em Sistemas Administração Matemática Estatística Economia Engenharia e áreas correlatasDesejável PósGraduação (concluída ou em andamento) em BI Big Data Data Science ou relacionada a área de finançasExperiência na manipulação de dados via ExcelExperiência na manipulação de bases de dados (SAS / SQL / Knime)Conhecimento no uso de ferramentas de self service BI (Tableau será diferencial)Experiência com linguagens de programação (VBA e/ou Python será diferencial).Local de Trabalho: Alphaville  Barueri/SP,Promotiva,14/08/2019
v1947159,Auxiliar Perecíveis Maxxi Atacadista Teresina / PI,Teresina,R$ 1.155,1,2019-09-05,Auxiliar/Operacional,Responsável por auxiliar nas atividades dos departamentos de perecíveis no setor de açougue como realizar preparações dos produtos que serão expostos nos balcões de vendas e dar suporte necessário ao bom andamento da área. Atividades:·        Receber mercadorias·        Fazer verificações de qualidade·        Auxiliar na preparação de produtos para comercialização de acordo com o sortimento·        Embalar e etiquetar produtos·        Fazer abastecimento nos balcões e exposição da mercadoria de acordo com o padrão estabelecido da loja·        Atendimento ao cliente·        Manter o setor higienizado de acordo com as regulamentações aplicáveis·        Informar sobre a necessidade de manutenção dos equipamentos dos Departamentos de Perecíveis·        Informar sobre problemas no controle de taras das balanças e datas de validade·        Organizar e armazenar produtos no estoque·        Realizar controles do Departamento·        Acompanhar e contar produtos nas áreas internas e externas do departamento em dias de inventário. Requisitos:·        Desejável vivência na área·        Necessário disponibilidade para trabalhar em escala 6x1 (feriados e finais de semana). Tipo de contrato: Efetivo – CLTSalário: R$ 1.15500Localidade: Teresina /PI,Grupo BIG,26/08/2019
v1946280,Auxiliar de Perecíveis Maxxi Atacadista Lajeado/RS,Lajeado,R$ 1.302,2,2019-09-05,Auxiliar/Operacional,Responsável por auxiliar nas atividades dos departamentos de perecíveis como realizar preparações dos produtos que serão expostos nos balcões de vendas e dar suporte necessário ao bom andamento da área. Atividades:Receber mercadoriasFazer verificações de qualidadeAuxiliar na preparação de produtos para comercialização de acordo com o sortimentoEmbalar e etiquetar produtosFazer abastecimento nos balcões e exposição da mercadoria de acordo com o padrão estabelecido da lojaAtendimento ao clienteManter o setor higienizado de acordo com as regulamentações aplicáveisInformar sobre a necessidade de manutenção dos equipamentos dos Departamentos de PerecíveisInformar sobre problemas no controle de taras das balanças e datas de validadeOrganizar e armazenar produtos no estoqueRealizar controles do DepartamentoAcompanhar e contar produtos nas áreas internas e externas do departamento em dias de inventário. Requisitos:Desejável vivência na áreaNecessário disponibilidade para trabalhar em escala 6x1 (feriados e finais de semana)Disponibilidade para atuar na região de Lajeado RS Tipo de contrato Efetivo – CLTSalário R$ 1.30200Localidade Lajeado RS,Grupo BIG,23/08/2019
v1947937,Auxiliar Perecíveis Sam´s Club Fortaleza/CE,Fortaleza,R$ 1.058,1,2019-09-05,Auxiliar/Operacional,Responsável por auxiliar nas atividades dos departamentos de perecíveis no setor de açougue como realizar preparações dos produtos que serão expostos nos balcões de vendas e dar suporte necessário ao bom andamento da área. Atividades:·        Receber mercadorias·        Fazer verificações de qualidade·        Auxiliar na preparação de produtos para comercialização de acordo com o sortimento·        Embalar e etiquetar produtos·        Fazer abastecimento nos balcões e exposição da mercadoria de acordo com o padrão estabelecido da loja·        Atendimento ao cliente·        Manter o setor higienizado de acordo com as regulamentações aplicáveis·        Informar sobre a necessidade de manutenção dos equipamentos dos Departamentos de Perecíveis·        Informar sobre problemas no controle de taras das balanças e datas de validade·        Organizar e armazenar produtos no estoque·        Realizar controles do Departamento·        Acompanhar e contar produtos nas áreas internas e externas do departamento em dias de inventário. Requisitos:·        Desejável vivência na área·        Necessário disponibilidade para trabalhar em escala 6x1 (feriados e finais de semana) Tipo de contrato: Efetivo – CLTSalário: R$ 1.05800Localidade: Fortaleza/CE,Grupo BIG,27/08/2019
v1950774,Auxiliar Perecíveis - Maxxi Atacadista Criciúma/SC,Criciúma,R$ 1.298,3,2019-09-05,Auxiliar/Operacional,Responsável por auxiliar nas atividades dos departamentos de perecíveis no setor de açougue como realizar preparações dos produtos que serão expostos nos balcões de vendas e dar suporte necessário ao bom andamento da área. Atividades:·        Receber mercadorias·        Fazer verificações de qualidade·        Auxiliar na preparação de produtos para comercialização de acordo com o sortimento·        Embalar e etiquetar produtos·        Fazer abastecimento nos balcões e exposição da mercadoria de acordo com o padrão estabelecido da loja·        Atendimento ao cliente·        Manter o setor higienizado de acordo com as regulamentações aplicáveis·        Informar sobre a necessidade de manutenção dos equipamentos dos Departamentos de Perecíveis·        Informar sobre problemas no controle de taras das balanças e datas de validade·        Organizar e armazenar produtos no estoque·        Realizar controles do Departamento·        Acompanhar e contar produtos nas áreas internas e externas do departamento em dias de inventário. Requisitos:·        Desejável vivência na área·        Necessário disponibilidade para trabalhar em escala 6x1 (feriados e finais de semana) Tipo de contrato: Efetivo – CLTSalário: R$ 1.29800Localidade: Criciúma/SC,Grupo BIG,Há 3 dias
v1948920,Auxiliar Perecíveis-Maxxi Atacadista Maracanaú/CE,Maracanaú,R$ 1.117,3,2019-09-05,Auxiliar/Operacional,Responsável por auxiliar nas atividades dos departamentos de perecíveis no setor de açougue como realizar preparações dos produtos que serão expostos nos balcões de vendas e dar suporte necessário ao bom andamento da área. Atividades:·        Receber mercadorias·        Fazer verificações de qualidade·        Auxiliar na preparação de produtos para comercialização de acordo com o sortimento·        Embalar e etiquetar produtos·        Fazer abastecimento nos balcões e exposição da mercadoria de acordo com o padrão estabelecido da loja·        Atendimento ao cliente·        Manter o setor higienizado de acordo com as regulamentações aplicáveis·        Informar sobre a necessidade de manutenção dos equipamentos dos Departamentos de Perecíveis·        Informar sobre problemas no controle de taras das balanças e datas de validade·        Organizar e armazenar produtos no estoque·        Realizar controles do Departamento·        Acompanhar e contar produtos nas áreas internas e externas do departamento em dias de inventário. Requisitos:·        Desejável vivência na área·        Necessário disponibilidade para trabalhar em escala 6x1 (feriados e finais de semana) Tipo de contrato: Efetivo – CLTSalário: R$ 1.111700Localidade: Maracanaú/CE,Grupo BIG,Há 7 dias
v1948926,Operado de Caixa - Maxxi Atacadista Maracanaú/CE,Maracanaú,R$ 1.117,4,2019-09-05,Auxiliar/Operacional,Responsável por auxiliar nas atividades dos departamentos de perecíveis no setor de açougue como realizar preparações dos produtos que serão expostos nos balcões de vendas e dar suporte necessário ao bom andamento da área. Atividades:·        Receber mercadorias·        Fazer verificações de qualidade·        Auxiliar na preparação de produtos para comercialização de acordo com o sortimento·        Embalar e etiquetar produtos·        Fazer abastecimento nos balcões e exposição da mercadoria de acordo com o padrão estabelecido da loja·        Atendimento ao cliente·        Manter o setor higienizado de acordo com as regulamentações aplicáveis·        Informar sobre a necessidade de manutenção dos equipamentos dos Departamentos de Perecíveis·        Informar sobre problemas no controle de taras das balanças e datas de validade·        Organizar e armazenar produtos no estoque·        Realizar controles do Departamento·        Acompanhar e contar produtos nas áreas internas e externas do departamento em dias de inventário. Requisitos:·        Desejável vivência na área·        Necessário disponibilidade para trabalhar em escala 6x1 (feriados e finais de semana) Tipo de contrato: Efetivo – CLTSalário: R$ 1.111700Localidade: Maracanaú/CE,Grupo BIG,Há 7 dias
