idVaga,NomeVaga,Cidade,Salario,QuantidadeVaga,DataPesquisa,Perfil,Descricao,Empresa,DataPubli,Pesquisa
v1952002,Cientista de Dados,São Paulo,Salário a combinar,1,2019-09-27,Pleno,A BRF uma das maiores empresas de alimentos do Mundo tem investido constantemente em inovação e digitalização para o crescimento e alavancagem dos nossos negócios.O Cientista de Dados será responsável por desenvolver modelos matemáticos de soluções de Business Intelligence (BI) & Analytics em interface direta com as demais áreas da companhia sendo principalmente áreas de tecnologia financeiro e operações.  Se você tem paixão por dados e números gosta de projetos de inovação tem perfil analítico e quer fazer a diferença esperamos por você!! Atividades: Desenvolver modelos matemáticos para implementação de soluções de Business Intelligence (BI) & Analytics Gerar informações requeridas pelas diversas áreas da empresa através de Dashboards Reports e base de dados nos bancos  Interfaces com demais áreas de Tecnologia da companhia e de parceiros para garantir perenidade dos processos desenhados  Realizar testes para garantir a consistência e acuracidade das informações definidas Modelagem de Dados e Gerenciamento de Múltiplas Bases de Dados  Criar e manter a documentação de projeto técnico para assegurar o desenvolvimento preciso de demandas futuras  Seguir políticas procedimentos metodologias e regras de governança de TI Requisitos: Ensino Superior em ciência da computação Estatística Engenharia Matemática ou similares  Conhecimentos necessários:Power BIPythonRSQLWeb Services (REST)ScrapingC# (.NET Core)Estrutura conceitual de Machine learning/data scienceFerramentas de visualização de dados (ex.: Seaborn/Matplotlib/Plotly)Frameworks/softwares de machine learning/data science (ex.: Scikitlearn TensorFlow Weka) Conhecimentos desejáveis:TableauHadoop (Amazon S3 Azure Data Lake Google BigTable)Tecnologias Microsoft Azure para dados (Data Warehouse DataBricks Data Lake Analysis Services Data Factory etc.) Inglês:Leitura escrita e conversação avançada.,BRF,11/09/2019,cientista-de-dados
v1957395,Cientista de Dados,São Paulo,Salário a combinar,1,2019-09-27,Sênior,Na Recovery o Cientista de dados será responsável por otimizar as estratégias digitais (canais marketing e CRM) a partir de análises de dados.O que seria bacana você ter e conhecer:Graduação: Estatística Ciência da Computação Física Matemática Engenharia ou áreas afinsConhecimentos em R Python SQL e SAS                                 Experiência com técnicas de modelagem estatística e machine learning (regressão clustering árvores de decisão redes neurais artificiais etc.)Conhecimento em Processamento de Linguagem Natural  e experiência com dados não estruturados            Experiência com banco de dados relacionais (NoSQL SQL Server Oracle MySQL PostgreSQL)Desejável conhecimento em frameworks de deep learning (Tensorflow Keras PyTorch CNTK etc). O que você terá que fazer:Estruturar bases de dados para viabilização de análises estatísticas e de aprendizado de máquina      Investigar avaliar a utilidade e criar processos de coleta de novas fontes de dados para o negócioClusterizar bases de dados para otimização das ações e testes da estratégia digital da empresaUtilizar modelagem preditiva para criação de triggers digitais a fim de maximizar a geração de receita solucionar problemas de negócio (contactabilidade e abandono) bem como melhorar a experiência do cliente e impulsionar sua adoção às plataformas digitais da empresaSelecionar e implantar técnicas de modelagem e de processamento de linguagem natural para alavancar performance dos BOTs de negociaçãoImplementação e mensuração de testes A/B para avaliação das ações testadas.              Quer saber o que temos de mais legal por aqui Dá uma olhada!Incentivamos nossa galera a buscar conhecimento sempre por isso temos um Programa de Incentivo à Educação que pode bancar parte dos estudos de quem tiver interesseUm dos momentos mais importantes na vida de uma pessoa é o nascimento do seu filho. Pensando nisso a Recovery oferece para as mamães a licençamaternidade estendida de 6 meses e para os papais a possibilidade de ficar 20 dias com a família em licençapaternidadeEstimulamos que o nosso time esteja sempre em movimento para isso temos por aqui o GymPass e Ginástica Laboral no escritórioGostamos de comemorar nosso desempenho e um dos nossos lemas é celebrar os bons momentos. Encontramos a melhor forma de fazer isso: Happy Hour com a galera no escritórioEstamos no coração de São Paulo a Avenida Paulista é a nossa casa. Quer ser parte do nosso time Vem #todosjuntos fazemos a diferença!,Grupo Recovery,12/09/2019,cientista-de-dados
v1961857,Cientista de Dados Pleno,Barueri,Salário a combinar,1,2019-09-27,Pleno,Principais atividades:Esta é uma posição especializada em Data Science com o objetivo de alavancar análise preditiva e tecnologia para selecionar as melhores personas pelos melhores meios de acionamento de acordo com estatísticas e KPIs de controle de campanhas.Buscamos um profissional analítico e que saiba mensurar campanhas em diversos meios para auxiliar o time de Marketing Services da Boa Vista.Principais responsabilidades: Construção de modelos de CRM. Acompanhamento e manutenção de modelos já existentes na empresa. Formular e analisar hipóteses que auxilie nas decisões estratégicas dos nossos clientes. Pesquisar novas técnicas e metodologias em modelagem e testar sua aplicação no negócio. Analisar/extrair insights que criem novas oportunidades de negócio. Requisitos do Perfil:Graduação completa Matemática Física Estatística Ciências da Computação Administração Engenharias e correlatas. Desejável pósgraduação em Marketing Marketing Digital Analytics.Inglês intermediário será um diferencialAtuação prévia em liderança e gestão de projetos relacionados a Data Science.Experiência com modelagem estatística análise de dados matemática aplicada. Desejável conhecimento em SAS Big Data linguagens de programação Python R SQL e Machine Learning.  Remuneração Benefícios e Vantagens:A Boa Vista SCPC oferece um programa de benefícios flexíveis e você poderá distribuílos de acordo com suas necessidades.Jornada de 40 horas semanaisRemuneração compatível com o mercadoParticipação nos Resultados (PPR)Assistência MédicaAssistência OdontológicaVale Refeição/AlimentaçãoVale transportePrevidência PrivadaSeguro de vidaConvênio farmáciaConvênio SESCDayoff no dia do seu aniversário + ingresso para cinemaEspaços exclusivos para refeições lazer e descansoAmbulatório com consultas assistenciais para dependentes legais incluindo vacinas sazonais. Local de trabalho: Alphaville (Barueri/SP),Boa Vista SCPC,Há 7 dias,cientista-de-dados
v1964226,Cientista de Dados I,São Paulo,Salário a combinar,1,2019-09-27,Pleno,Habilidade de análise de indicadores processos e melhoria contínuaConhecimentos de análise de dados e construção de painéis de indicadores e análise de resultadoComprometimento e foco no atingimento dos prazosForte habilidade de comunicação negociação e interação com parceiros internos e externosDinamismo capacidade de resolução de problemas organização controle e disciplina no planejamento e execução das atividadesConhecimento em gestão de projetosHabilidade para expor materiais de resultados/estudos através de apresentaçõesAtitude de dono e indignação construtivaVisão de processos sistêmica e holística.Análises estatística com modelos de machine Learning. Conhecimento em modelos de regressão classificação e Regressão Conhecimento em Python com foco nos pacotes ScikitLearn Pandas Numpy Keras TensorFlow Conhecimentos em técnicas de TextMining (NLP) Conhecimento em Otimização Diferencial em processamento de imagens,Itaú Unibanco,Há 3 dias,cientista-de-dados
v1925657,Cientista de Dados (Estatístico),São Paulo,Salário a combinar,1,2019-09-27,Sênior,O que você terá de responsabilidade: • Para essa vaga contamos que você nos ajude a analisar os dados disponíveis e a tirar o máximo valor destes para que possamos tomar decisões de negócio baseadas em dados e a construir novos modelos de machine learning• Sugerir novas fontes de dados além das que possuímos atualmente• Selecionar features para construir e/ou otimizar modelos utilizando técnicas de machine learning• Aprimorar/sugerir procedimentos de coleta de dados para incluir informações relevantes para a construção dos modelos• Usar modelagem preditiva para melhorar e otimizar as experiências dos clientes e outros resultados de negócios• Ter perfil de pesquisador. Explorar e estudar artigos científicos que auxiliem no desenvolvimento de novos algoritmos. Temos muitos desafios e várias investigações e pesquisas a serem feitas!  O que buscamos em você:  • Domínio de Python ou R• Desenvolvimento de APIs em Python• Feature Engineering• Jupyter numpy pandas scikitlearn matplotlib seaborn etc• Machine Learning (supervisionado e não supervisionado)• Domínio em algoritmos de processamento em linguagem natural• Mineração transformação e análise de dados• Métricas de performance de modelos: precision recall ROC F1 accuracy etc.  + Plus + • Flask• SQL (busca/recuperação de informação)• Modelagem Matemática e Estatística• Hadoop Hive Spark. O que iremos te oferecer: Pacote básico• auxílio desenvolvimento p/ cursos• auxílio creche (crianças até 5 anos)• convênio médico Porto Seguro• convênio odontológico MetLife• VT fretado ou auxílio estacionamento• VR de R$3200/dia• cesta de natal• seguro de vida     Nossos diferenciais• Great Place To Work TI (201420152016)• ambiente informal• horário flexível•possibilidade de fazer homeoffice alguns dias• café da manhã e da tarde + fruta• ginástica laboral quick massage e assessoria esportiva• parceria com a Gympass• videogame revistas & jornais• parabéns com coxinha e bolo todo mês • festas e eventos ao longo do ano• troca de conhecimento através de palestras e workshops internos• wifi aberto para dispositivos pessoais• parcerias com universidades e escolas de idiomas • fácil acesso de carro trem ou fretado Local de trabalho:Brooklin Novo (Zona Sul São Paulo/SP) Se você tem o perfil para trabalhar neste ambiente desafiador onde todos fazem o que querem e todo mundo tem tudo a ver com isso se inscreva!,VAGAS.com,17/07/2019,cientista-de-dados
v1959576,Engenheiro de Dados,São Paulo,Salário a combinar,1,2019-09-27,Pleno,Sobre a vaga:Você fará parte do time de dados que suporta todos os produtos da Geofusion. Como Engenheiro de Dados seu trabalho será desenvolver soluções confiáveis e escaláveis para nossos dados com foco em processamento armazenamento e disponibilização de grandes volumes de informação utilizando múltiplas plataformas. Para se candidatar a esta vaga precisamos que você tenha: Formação em Ciência  da Computação Engenharia de Computação Análise de Sistemas Sistemas de Informação ou área relacionada Experiência criando gerenciando e otimizando modelos de dados e databases NoSQL (MongoDB e Solr) e RDBMS (Oracle) Experiência em linguagem de programação preferencialmente Python Conhecimento em sistema Linux Experiência prática interagindo e programando em plataforma de processamento paralelo massivo em no mínimo uma das seguintes ferramentas: Hadoop Hive MapReduce Spark. Requisitos desejáveis: Experiência criando pipelines de fluxo de dados Experiência criando APIs de dados Experiência com Docker GoCD e/ou outras ferramentas de entrega contínua. Suas principais responsabilidades serão: Trabalhar nas definições de dados (levantamento e preparação) Desenvolver soluções para que as/os Cientistas de Dados e Analistas possam fazer suas análises Ajudar a definir as tecnologias de banco de dados mais indicadas apra cada tipo de cenário Resolver problemas de processamento armazenamento e disponibilização de grandes volumes de dados Implantar e escalar soluções de dados. Benefícios: Auxílio creche para crianças até 5 anos Vale refeição Vale transporte Seguro de vida Assistência Médica (AMIL) Assistência Odontológica (AMIL) Desconto no Gympass Dayoff no seu aniversário Horário flexível.,Geofusion,17/09/2019,cientista-de-dados
v1965038,Engenheiro de Dados – PJ  (Pinheiros),São Paulo,Salário a combinar,1,2019-09-27,Sênior,Requisitos • Superior completo em Tecnologia da Informação Engenharia da Computação Ciência da Computação ou áreas correlatas • Experiência em Ambientes de Alta Criticidade • Conhecimento em SQL • Conhecimentos em modelagem de dados relacional e não relacional • Experiência em banco de dados Oracle e MySQL • Conhecimento de tuning de queries • Cultura DevOps (fazer parte de um time DevOps e aprender outras tecnologias de persistência de dados) • Inglês intermediário Desejáveis• Experiência em banco de dados NoSQL• Experiência com ferramentas de ETL e integração de dados• Conhecimento em ferramentas para gestão de dados (ciclo de vida de dados replicações de dados realtime mascaramento de dados)• Conhecimento de sistemas distribuídos e aplicações web Principais Atividades • Construir avaliar e executar scripts de atualização de dados de forma performática • Garantir as melhores práticas em relação a modelagem e persistência de dados • Ser um profundo conhecedor do modelo/regras de negócio para garantir a governança da informação • Ser a cola entre desenvolvedores administradores de dados cientistas de dados equipe de infra e Product Owner a fim de criar soluções de dados • Catalogar os produtos e serviços • Garantir a integração dos dados para possibilitar o cruzamento de informações e acompanhamento de métricas • Garantir que as políticas de segurança estão sendo aplicadas na camada de acesso aos dados • Fomentar a utilização de técnicas de automação para provisionamento configuração e monitoramento dos ambientes de banco de dados,Randstad,Há 2 dias,cientista-de-dados
v1950884,Estágio em Data Science,São Paulo,Salário a combinar,1,2019-09-27,Estágio,PRINCIPAIS DESAFIOS DA POSIÇÃOA área de Data Science Business Leaders atua como um elo entre as áreas de Product Leadership Client e Retail Services contribuindo com uma visão técnica relacionada às metodologias estatísticas da Nielsen e conectada às questões de negócios dos clientes. Algumas das suas principais responsabilidades: Ajudar nos projetos de melhoria das soluções oferecidas aos clientes (como Retail Index e Scantrack). Analisar e resolver problemas direcionados para temas técnicos/metodológicos realizados por clientes internos e externos (como estudos de cobertura e comparação de resultados entre serviços).Ajudar nas reuniões com clientes entendendo suas necessidades e traduzindoas para uma linguagem comum entre os envolvidos no processo de produção dos nossos serviços. O Que BuscamosBuscamos profissionais com capacidade para aprender e adotar continuamente tecnologias e ferramentas em mudança comprometidos com resultados diferenciados engajados busquem entender as necessidades de nossos clientes e que também tenham: Curso de Estatística.Conhecimento (no mínimo intermediário) em linguagens de programação estatística preferencialmente R ou PhythonInglês IntermediárioExcel Avançado Perfil ColaborativoForte habilidade analítica e lógica Habilidade de comunicação oral e escrita                       Formação prevista entre Dez/2020 e Dez/2021 Onde fica a Nielsen Estamos localizados no KM 225 da Rodovia Raposo Tavares com fácil acesso às principais vias de São Paulo e aproximadamente 20 minutos da Linha Amarela do Metrô Butantã com diversas linhas de ônibus para os mais diferentes destinos.O que temos por perto Estamos em frente ao Shopping The Square Open Mall próximo ao Shopping Granja Vianna bancos restaurantes supermercados padarias e serviços em geral. O que oferecemosBOLSAAUXÍLIOÚltimo ano: R$1.800 Penúltimo ano: R$1.600 Anos anteriores ou Tecnológicos: R$1.400Outros benefícios: Assistência Médica Vale Transporte Estacionamento Fretado (sujeito a disponibilidade de vagas) refeitório que inclui café da manhã e almoço convênio com universidades escolas de idiomas e serviços e Programa de Bem Estar: Manicure Quick Massage Reflexologia FoodsTrucks e sextafeira curta.Faça parte da Experiência Nielsen: seja você faça a diferença e cresça conosco!,Nielsen,02/09/2019,cientista-de-dados
v1952002,Cientista de Dados,São Paulo,Salário a combinar,1,2019-09-27,Pleno,A BRF uma das maiores empresas de alimentos do Mundo tem investido constantemente em inovação e digitalização para o crescimento e alavancagem dos nossos negócios.O Cientista de Dados será responsável por desenvolver modelos matemáticos de soluções de Business Intelligence (BI) & Analytics em interface direta com as demais áreas da companhia sendo principalmente áreas de tecnologia financeiro e operações.  Se você tem paixão por dados e números gosta de projetos de inovação tem perfil analítico e quer fazer a diferença esperamos por você!! Atividades: Desenvolver modelos matemáticos para implementação de soluções de Business Intelligence (BI) & Analytics Gerar informações requeridas pelas diversas áreas da empresa através de Dashboards Reports e base de dados nos bancos  Interfaces com demais áreas de Tecnologia da companhia e de parceiros para garantir perenidade dos processos desenhados  Realizar testes para garantir a consistência e acuracidade das informações definidas Modelagem de Dados e Gerenciamento de Múltiplas Bases de Dados  Criar e manter a documentação de projeto técnico para assegurar o desenvolvimento preciso de demandas futuras  Seguir políticas procedimentos metodologias e regras de governança de TI Requisitos: Ensino Superior em ciência da computação Estatística Engenharia Matemática ou similares  Conhecimentos necessários:Power BIPythonRSQLWeb Services (REST)ScrapingC# (.NET Core)Estrutura conceitual de Machine learning/data scienceFerramentas de visualização de dados (ex.: Seaborn/Matplotlib/Plotly)Frameworks/softwares de machine learning/data science (ex.: Scikitlearn TensorFlow Weka) Conhecimentos desejáveis:TableauHadoop (Amazon S3 Azure Data Lake Google BigTable)Tecnologias Microsoft Azure para dados (Data Warehouse DataBricks Data Lake Analysis Services Data Factory etc.) Inglês:Leitura escrita e conversação avançada.,BRF,04/09/2019,cientista-de-dados
v1951998,Cientista de Dados,Curitiba,Salário a combinar,1,2019-09-27,Sênior,A BRF uma das maiores empresas de alimentos do Mundo tem investido constantemente em inovação e digitalização para o crescimento e alavancagem dos nossos negócios.O Cientista de Dados será responsável por desenvolver modelos matemáticos de soluções de Business Intelligence (BI) & Analytics em interface direta com as demais áreas da companhia sendo principalmente áreas de tecnologia financeiro e operações.  Se você tem paixão por dados e números gosta de projetos de inovação tem perfil analítico e quer fazer a diferença esperamos por você!! Atividades: Desenvolver modelos matemáticos para implementação de soluções de Business Intelligence (BI) & Analytics Gerar informações requeridas pelas diversas áreas da empresa através de Dashboards Reports e base de dados nos bancos  Interfaces com demais áreas de Tecnologia da companhia e de parceiros para garantir perenidade dos processos desenhados  Realizar testes para garantir a consistência e acuracidade das informações definidas Modelagem de Dados e Gerenciamento de Múltiplas Bases de Dados  Criar e manter a documentação de projeto técnico para assegurar o desenvolvimento preciso de demandas futuras  Seguir políticas procedimentos metodologias e regras de governança de TI Requisitos: Ensino Superior em ciência da computação Estatística Engenharia Matemática ou similares  Conhecimentos necessários:Power BIPythonRSQLWeb Services (REST)ScrapingC# (.NET Core)Estrutura conceitual de Machine learning/data scienceFerramentas de visualização de dados (ex.: Seaborn/Matplotlib/Plotly)Frameworks/softwares de machine learning/data science (ex.: Scikitlearn TensorFlow Weka) Conhecimentos desejáveis:TableauHadoop (Amazon S3 Azure Data Lake Google BigTable)Tecnologias Microsoft Azure para dados (Data Warehouse DataBricks Data Lake Analysis Services Data Factory etc.) Inglês:Leitura escrita e conversação avançada.,BRF,04/09/2019,cientista-de-dados
v1950017,Estágio - Marketing Digital,Belo Horizonte,Salário a combinar,1,2019-09-27,Estágio,Nosso time está crescendo e precisa de um reforço! Buscamos uma pessoa incrível para estagiar na nossa área de Marketing Digital aqui em BH. Para completar nosso time buscamos uma pessoa curiosa questionadora heavy user de produtos digitais e que acima de tudo tenha um mindset voltado para análise de dados. Você vai fazer parte de um time engajado em tornar  a nossa marca conhecida. Além disso você irá aprender:· Planejamento de mídia e estratégia digital· Projeção de cenários e gestão de investimento· Acompanhar e otimizar campanhas e jornadas de impacto do usuário e cliente.· Analisar e interpretar dados com criação de status report. Se você cursa do 4º ao 6º período de Publicidade Marketing Data Science Engenharia de Dados ou qualquer outro custo correlato e ficou interessado nessa super oportunidade cadastra logo seu cv!OndeLuxemburgoQuanto é o cashR$ 179600 + VT + Um ambiente massa de trabalhar!  =),BS2 TECH,30/08/2019,cientista-de-dados
v1957383,Engenheiro eletrônico com foco em micro controladores e sistemas embarcados,Rio de Janeiro,Salário a combinar,1,2019-09-27,Pleno,O candidato será o responsável pelo desenvolvimento de um módulo eletrônico para aplicação em plantas de óleo e gás offshore interagindo com a equipe de desenvolvimento de software e data Science.Formação:Graduação em engenharia eletrônica controle e automação ou mecatrônica. Outras serão consideradas no caso de relevante experiência comprovada.Conhecimentos:Programação de micro controladores (ARM DSP Raspberry pi ou equivalentes) Micro controladores de baixo consumo (ultra low power)Programação PythonProjeto de placas de circuitos eletrônicosPrototipagem teste e debug de sistemas.Sensores de movimento (IMU e GPS)Protocolos de redes de comunicação e IoTInglês fluente – obrigatório Conhecimentos desejáveis:Conhecimento de certificações usadas na indústria de Óleo e gás.Processo de patentes.Sistemas de controle de plantas offshoreMestrado ou doutorado na área.Sistemas de alimentação por baterias de Lítio.Conhecimento de redes neuraisLocal de trabalho: Ipanema. É necessária disponibilidade para viagens ocasionais.,RIO ANALYTICS,12/09/2019,cientista-de-dados
v1939844,Engenheiro de Dados SR,Não informado,Salário a combinar,1,2019-09-27,Sênior,“Na Kroton transformamos a vida de milhares de pessoas por meio da educação. Dados estão no centro do nosso negócio e geram insights que nos ajudam a melhorar os nossos produtos e a experiência dos nossos alunos. Data engineering é uma atividade chave no desenvolvimento e melhora continua da nossa plataforma big data. Como parte desse time você irá participar em projetos desafiadores de alta visibilidade e terá impacto direto no resultado do negócio. Você construirá o pipeline de dados que alimenta BI modelos de machine learning e inteligência artificial. Você ajudará a modelar a próxima geração de modelo de dados facilitando o consumo de dados por analytics ciência de dados negócio e demais stakeholders habilitando a tomada de decisões de forma melhor e mais rápida. Para ter sucesso nessa posição você é apaixonado por dados analytics e transformação digital e está acostumado em trabalhar em um ambiente desafiador e de alta velocidade.” Atividades e responsabilidades: Desenvolver rotinas ETL utilizando Spark Hadoop PowerCenter entre outros Limpar e preparar dados para análise Modelar dados definir e implementar melhores práticas Automatizar workflows e elementos recorrentes no pipeline.Características/experiências necessárias: Conhecimento em modelagem de dados e ETL Experiência sólida em Python (ou outra linguagem de script) Spark e SQL Conhecimento de ecossistema AWS e GitHub.Diferenciais Experiência com a cultura DevOps Conhecimento em automação de testes e arquitetura Conhecimento da metodologia SAFe (scaled agile framework) Experiência anterior com Analytics e Data Science.Formação Acadêmica:Nível superior completo nas áreas de TI engenharia matemática ou especialização técnica relacionada.  Local de Atuação São Paulo/SP em horário ComercialGostou do que leu Legal!Então é só se candidatar ou indicar para um amigo mas atenção ler atentamente a descrição e BOA SORTE,Kroton Educacional,13/08/2019,cientista-de-dados
