idVaga,NomeVaga,Cidade,Salario,QuantidadeVaga,DataPesquisa,Perfil,Descricao,Empresa,DataPubli,Pesquisa
v1934809,Estágio em BI (Business Intelligence),Rio de Janeiro,R$ 1.000 a R$ 1.200,1,2019-09-20,Estágio,Buscamos uma pessoa extremamente motivada para compôr o nosso SUPER time!Somos movidos por grandes desafios e precisamos de pessoas que amem aprender constantemente que sonhem grande e que tenham muita vontade de transformar a #inChurch na melhor e maior empresa global de Tecnologia e Inovação para o 3º setor.Estamos crescendo e tornando o nosso produto cada dia mais robusto por isso estamos a procura de pessoas cheias de energia que amem tecnologia que sejam fascinadas por aprender coisas novas e que queiram fazer parte de algo GRANDE!A pessoa que conquistar o estágio na área de Business Intelligence aqui na inChurch irá:✔️ Apoiar na captação e estruturação de dados✔️ Auxiliar na criação de KPI’s✔️ Acompanhar os resultados de ações com base em métricas.REQUISITOS:✔️ Estar cursando a partir do 3º período em Análise de Sistemas Engenharia Estatística Matemática ou áreas correlatas✔️ Interesse em estatística e métricas✔️ Excel a partir de intermediário✔️ Domínio da língua inglesa a partir de intermediário.DIFERENCIAIS:✔️ Conhecimento (acadêmico) da ferramenta Power BI✔️ Conhecimento (acadêmico) de alguma linguagem de programação (preferencialmente Python R ou Node JS)✔️ Conhecimento (acadêmico) em modelos Data Science/Machine Learning. SOFT SKILLS:✔️ Organização✔️ Olhar Crítico✔️ Atitude Positiva. Sobre os benefícios de ser parte do nosso time: 😊 Bolsa de R$1.20000😊 ValeTransporte😊 Assistência Médica😊 Assistência Odontológica😊 Academia😊 Horário flexível (30h semanais)😊 Chances REAIS de efetivação😊 Cultura interna de aprendizado constanteLocal de Estágio: Barra da Tijuca+ informações sobre nosso dia a dia clicando aqui :) Vem fazer parte do dream team inChurch! 🚀 Etapas do Processo Seletivo:✔️ Teste Online & Inscrição✔️ Entrevista Coletiva✔️ Entrevista Individual✔️ Proposta & Admissão,inChurch,03/08/2019,data-science
v1947674,Business Analyst,Campinas,Salário a combinar,2,2019-09-20,Sênior,Responsibilities and Skills:·        Bachelor's Degree in Computer Science or related field.·        Assists in the elicitation and documentation of business requirements.·        Collects analyzes and synthesizes data from requirements ensuring needs of client/stakeholder are met translating business requirements into systems solutions. May translate business requirements into technical solutions with guidance.·        Perform bug analysis prioritization and documentation to fix system issues.·        Maintains a relationship with stakeholders internal and external customers.·        Reviews product needs instructions regulations and/or laws on projects implementing requirements documents which may include changes to software using low to medium level programming skills testing and providing support to customers.·        Develops a strong awareness and understanding of Thomson Reuters technologies products and services in assigned area including an understanding of how technical solutions impact the business.·        Shows initiative to improve product solutions and effectiveness for different company's products.·        Implements improvements to process or product as directed by management.·        Perform General Acceptance Testing·        Participates in root cause analysis and process improvements. Desired Skills:·        Experience translating requirements for business solutions·        User requirements gathering and system design documentation including techniques such as use case and user story development.·        Solid analysis and problemsolving skills.·        Good written and oral communication skills.·        Ability to effectively facilitate meetings and works with other levels of team members (Product Manager Scrum Master Lead Manager) and development staff.·        Familiarity with Agile methodology (Scrum preferred).·        International Trade/ Foreign Trade knowledge Desired·        English ·        Spanish (Preferred),Thomson Reuters Brasil,27/08/2019,data-science
v1960207,Software Development Engineer - Java Sr.,São Paulo,Salário a combinar,15,2019-09-20,Sênior,American Multinational Company and leader in its segment is seeking professionals to act as Software Development Engineer.BASIC QUALIFICATIONS· Bachelors in Computer Science Computer Engineering or equivalent.· Relevant experience building successful production software systems.· Prociency in English language.· Experience with either Java C++ C# Python OR Ruby and web technologies (i.e. JavaScript CSS and web services).· Ability to take raw product requirements and develop software architectures and designs to bring them to life.· Experience defining system architectures and exploring technical feasibility tradeoffs.Experience developing service oriented architectures and an understanding of design for scalability performance and reliability.· Strengths in coding data structures algorithms Object Oriented design and designing for performance scalability availability plus internet and OS security fundamentals.PREFERRED QUALIFICATIONSKnowledge of professional software engineering practices & best practices for the full software development life cycle including coding standards code reviews source control management build processes testing and operations including:· Ability to take a project from scoping requirements through actual launch of the project· Experience in communicating with users other technical teams and senior management to collect requirements describe software product features technical designs and product strategy.· Experience with AWS is a plus.· Experience with NoSQL is a plus.Amazon is an equal opportunity employer and hires qualified individuals regardless of gender race sexual orientation religion nationality age or disability.Interested in sending resume in English.,Randstad,Há 2 dias,data-science
v1954121,Accounting & Purchasing Coordinator - GE - Aracaju / SE,Aracaju,Salário a combinar,1,2019-09-20,Pleno,Role Summary/Purpose :The Accounting & Purchasing Coordinator is responsible to develop implement and maintain the plant purchasing procedures that are consistent with GE's and the local regulations for purchasing.Coordinate and control all aspects of O&M plant cost control system reporting and controlling costs within the approved budget. Essential Responsibilities:As Accounting & Purchasing Coordinator you report to the Plant Manager and: Coordinate the preparation of the annual budget of the Plant and control the execution of the operation plan according to the approved budget identifying and analyzing monthly/quarter variations and reporting to the leadership. Be responsible for the contract monthly billing and cash collection. Prepare and track cash flow. Manage accounts payable and receivables.Focal point for HQ financial information requests. Purchase of materials supplies equipment and services according to GE and country specifics policies locals laws and EHS practices. Ensure quotation analysis is performed in compliance with relevant procedures. Issue Purchase Orders (PO) in compliance with the GE process flow. Maintain the track records of all purchase requisition request for quotation quotation deliberation for quotation evaluation purchase order etc… in the corresponding system. On agreed timely basis provided budget follow up report to each department manager. Ensure that an accurate and complete record of transactions and accounts imputation is maintained. Support supplier evaluation and keep the list of approved suppliers up to date in the corresponding systems.Liaise with GE Customs CoE and suppliers in the preparation of necessary documentation for import/export of parts. Provide orientation guidance and training for staff regarding purchasing process.Perform additional duties as required.  Qualifications/Requirements:Degree in Business Administration Accounting or Economic Sciences. Knowledge of procurement process.Knowledge of typical legislation associated with customs requirements. Excellent communication skills. Negotiating and supplier relationship skills. Good knowledge of Microsoft word/Excel. Ability to communicate effectively in English. Desired Characteristics :Excellent oral and written communication skills. Excellent interpersonal and leadership skills. Ability to work independently. Excellent problem solving skills. Good knowledge of Oracle and Cost Control systems. Good proven leadership skills. Trustworthy reliable. Open to criticism able to handle conflicts. Good organisational skills.,GE,06/09/2019,data-science
v1957596,QA Manager,Brazil,Salário a combinar,1,2019-09-20,Supervisão/Coordenação,BairesDev is on the mission to offer worldclass Custom Software Development services. The company employs only the Top 1% Talent to create solid engineering teams that provide endtoend delivery of Technology Solutions.BairesDev is the fastest growing software development company in the Americas with over 50% annual growth. Featured as a Top Software Engineering company by Clutch.co with more than 1000 employees working on different projects around the world BairesDev has positioned itself as a leader in the software industry.The company has offices across the US Europe and Latin America and offers an exceptional work environment in which employees can shine and thrive working in multicultural teams with flexible schedules and endless growth opportunities.We are looking for a QA Manager to join our team.He or she should be a strongly quality advocate with a good planning optimization mindset and the ability to drive against a highlevel test strategy based on a datadriven approach.We are an Argentine company with operations worldwide and customers such as Google Panasonic and Thomson Reuters. We have had a constant growth of over 50% during the last 5 years positioning ourselves as one of the largest Technology Services companies in Latin America.Your role: Delivery of projects. Development of test strategies and creation of appropriate test harnesses Technical leadership. People management and team satisfaction.What are we looking for: Solid experience in similar positions. Advanced or bilingual English level. Proven track record of managing a team of technical leads. Clientoriented work. Strong problem solving skills. Background in IT. Excellent communication skills. Nice to have: Experience working with Python and Django Experience working with SaaS applications in a cloud environment (ideally AWS) Degree in Software Development Engineering or Computer ScienceWhat we offer:One of the main values of BairesDev is to recognize that our employees are our most valuable asset. That's why we offer: Excellent salary and benefits. A challenging and resultoriented work environment.If you are interested in being part of a team of worldclass engineers and working 100% goaloriented in an innovative environment with the structure and resources of a multinational market leader do not hesitate to apply!,BairesDev,Há 7 dias,data-science
v1932975,Software Systens Engineer,São Paulo,Salário a combinar,1,2019-09-20,Pleno,In this role you will work in a team of software engineers to understand requirements develop technical solutions and set expectations for complex software projects. You will act as an individual contributor on these engagements contributing to software development of software applications and integration into enterprise system.ResponsibilitiesDevelop knowledge and experience to estimate the technical effort required to implement software solutions. Engage to the implementation of software solutions utilizing the GE software. Own technical deliverables during the entire lifecycle of the projects.  Engage throughout the full lifecycle of assigned projects participating on architecture design and functionality to keep programs on track in terms of budget time and customer expectations.Effectively leverage product capability driving standardization limiting customization and maximizing reuse of content developed for previous solutions. Effectively communicate both verbally and in writing with peers and team members as an inclusive team member. Effectively apply GE execution methodology and project standards. Maintain & continuously update technical skills and knowledge. Qualification Degree on Electrical/Computer Engineering Computer Sciences or System Information.Strong spoken and written English language skills.Demonstrates ability to diagnose and solve basic to intermediate issues.Able to isolate moderately complex scenarios down to actionable items within designated job function.Regularly updates product knowledge to understand new features and limitations.Able to write functioning code in at least one relevant programming language.Understands uses and modifies code written by others. Able to create full document sets to support a product or writes userfocused stories conceptual information.Provides API Docs and samples. Programming experience in software development with Microsoft Visual Studio / Development tools and different programming languages.Experience with data modeling for generation transmission and distribution networks.Software skills in software analysis design methodology and architecture.Design and Development experience with Web Technologies such as HTML 5 Javascript CSS and Jquery.Experience with Windows .NET SQL databases Web Services and SOA technologies. Desired CharacteristicsDemonstrated ability to learn new software development practices languages and tools.Experience with enterprise software and large distributed systems.SpanishPersonal Attributes.Persists on completion of endeavors especially in the face of overwhelming odds and setbacks.Pushes self for individual results and others through team spirit. Seeks to understand problems thoroughly before implementing solutions.Asks for clarity when ambiguities are present.Implements clean concise solutions that address the requirements at hand.,GE,Há 3 dias,data-science
v1933038,Especialista de Business Intelligence,São Paulo,R$ 8.000 a R$ 10.000,2,2019-09-20,Sênior,Requisitos Raciocínio lógico para resolução de problemas e capacidade analítica Excel avançado conhecimento em SQL e ferramentas de BI Inglês no minimo intermediário para conversação e Espanhol altamente desejável (irá interagir com mercado global) Excelente comunicação e facilidade de relacionamento para gerenciamento de conflitos.Desafios Landbased (máquinas fisicas) Transformar as estratégias da empresa em dados e informações relevantes para desenvolvimento dos serviços e produtos Acompanhar resultados gerando insights para antecipar a necessidade das operações e materializar em soluções Garantir acuracidade e confiabilidade dos dados tendências e cenários Ter visão estratégica e dominar negócio.Desafios Canais Online Prospectar globalmente novos portais online e negociar condições comerciais e contratuais para colocação dos jogos real money e sociais Analisar tendencias de mercado e de publico alvo sugerindo novos mercados de atuação parceiros temáticas e mecânicas de jogo Monitorar em tempo real resultados da operação identificando proativamente problemas e também oportunidades de maximizar receitas e sugerindo KPls de acompanhamento Planejar e executar campanhas de marketing em conjunto com os operadores visando a percepção da marca da empresa e de seus jogos nos canais online Assegurar a satisfação dos parceiros e dos jogadores finais realizando o primeiro nível de atendimento e redirecionando as questões quando necessário as demais areas internas da empresa.,INTERNATIONAL GLOBAL SOLUTIONS COMERCIO E DESENVOLVIMENTO DE,23/08/2019,data-science
v1948513,Analista de Business Intelligence,São Paulo,R$ 3.000 a R$ 3.500,1,2019-09-20,Pleno,•      Acompanhar e monitorar projetos de pequena média e grande escala relacionados à Capital Humano•      Colaborar com recursos de análise do negócio para apoiar ações e iniciativas bemsucedidas•      Realizar atividades de acompanhamento das ações de Capital Humano followup e alinhamento das áreas envolvidas•      Executar estratégias de Capital Humano junto aos líderes de cada negócio•      Apoiar e direcionar o negócio em todas as ações de Capital Humano•      Propor soluções aos líderes em qualquer evento relacionado à Capital Humano•      Apoiar o negócio no dimensionamento de headcount•      Apoiar CoEs na determinação de políticas e procedimentos•      Avaliar abertura de vagas e desligamentos•      Analisar e acompanhar KPIs de Capital Humano•      Propor e monitorar orçamento de pessoas•      Apoiar o desenvolvimento de uma cultura forte e de alto desempenho•      Apoiar líderes para mudanças culturais•      Apoiar a análise de méritos promoções reajustes salariais e transferências de colaboradores•      Acompanhar vagas de cotas: Aprendiz e PCDs•      Realizar integração de novos colaboradores•      Contribuir para uma visão global em todas as ações de Capital Humano•      Estabelecer e manter relações sólidas comunicações efetivas e regulares com as áreas de COEs e negócios.,Luandre,21/08/2019,data-science
v1946414,Analista de Business Intelligence,Campinas,Salário a combinar,1,2019-09-20,Sênior,PRINCIPAIS RESPONSABILIDADES:Pesquisa e análise de mercado formação de preços e monitoramento de mercado participação no planejamento estratégico análise de custos e busca de eficiência elaboração de tabelas comparativasREQUISITOS:Imprescindíveis:•Superior completo (Administração Economia Contabilidade Engenharia)•Experiência anterior em marketing Pricing planejamento financeiro ou    áreas correlatas•   Pacote office avançado (excel power point)•Inglês avançado e•Será um diferencial já ter atuado no segmento Agronegócio.,Confidencial,27/08/2019,data-science
v1944940,Estagiário de Business Intelligence,Rio de Janeiro,Salário a combinar,2,2019-09-20,Estágio,Principais atividades:Acompanhar os resultados de ações com base em métricasApoiar na captação e estruturação de dadosAuxiliar na criação de KPI’s. Requisitos:Superior Cursando – Tecnologia da Informação ou áreas correlatas Interesse em estatística e métricasDesejável conhecimento em SQL. Local de trabalho: Barra da Tijuca/RJ,Wooza Telecom,28/08/2019,data-science
v1948007,Estagiário - Business Intelligence,Rio de Janeiro,R$ 1.000 a R$ 1.500,1,2019-09-20,Estágio,Responsabilidades e atribuições• Estruturar indicadores para análise de performance da área• Confecção de relatórios para clientes internos e externos.• Atualização e sugestão de melhoria de controles da área.• Estudar mercado para entender potenciais clientes e práticas de concorrentes. Requisitos e qualificaçõesCursando Ensino Superior com formação prevista a partir de Jun/2021.Ter inglês avançado.Conhecimento avançado em Excel e gostar de atuar com indicadores.Experiência com Power BI será um diferencial (projetos da faculdade e atividades extracurriculares contam como experiência).,Page Interim,31/07/2019,data-science
v1953436,Analista de Business Intelligence,São Paulo,Salário a combinar,1,2019-09-20,Júnior/Trainee,Principais Atividades:• Criar novas ferramentas e procedimentos utilizando tecnologias de banco de dados e programação• Realizar analises preditivas• Pesquisar novas tecnologias focando na inovação e otimização de processos• Atuar próximo aos clientes internos para entender as necessidades e propor soluções.                                                                                                                                                                         Requisitos:• Formação superior completa em Engenharia da Computação Sistemas da Informação Ciência da Computação ou em áreas relacionadas à tecnologia• Inglês avançado• Necessário ter conhecimento em SQL• Será um diferencial ter conhecimento em PLSQL .NET r Visual Studio Qlik Sense Pentaho e/ou Azure. Horário: AdministrativoLocal: Sede GOL São PauloBaseamos nossa atuação no respeito a todas as pessoas em suas individualidades por isso oferecemos oportunidades a todos.Se você tem os requisitos solicitados deficiência ou não inscrevase para essa vaga.Acreditamos que juntos somos melhores!,GOL - &#8203;Vaga Efetivas,05/08/2019,data-science
v1935988,Analista de Business Intelligence,Rio de Janeiro,Salário a combinar,1,2019-09-20,Pleno,Atribuições: Implementar painéis de controle com indicadores de gestão através do BI em todas as áreas operacionaisPadronizar e converter os principais relatórios gerenciais para a ferramenta do BIPromover treinamentos com as equipes de gestão Necessário: Ensino superior completo em Sistemas de Informação/ Tecnologia da Informação/ Engenharia da computação/ Ciência da ComputaçãoBons conhecimentos em QLIK sense Oracle Power BI,Confidencial,06/08/2019,data-science
v1953984,Estágio Business Intelligence,São Paulo,Salário a combinar,1,2019-09-20,Estágio,Buscamos jovens estudantes com perfil próativo focado ágil organizado responsável e 'handson'.O que você irá fazer Suporte nas atividades de inteligência de mercado atualizações dos relatórios suporte na análise de indicadores e apresentações. Será responsável por todas as atividades de arquivamento e organização da área colaborando com os processos internos e fluxo de trabalho. O que você precisa terCursando Superior preferencialmente a partir do 2º ano nos cursos de Engenharia Economia Administração ou Estatística.Excel Avançado (Mandatório)Inglês IntermediárioO que você vai encontrar na Herbalife·      Day Off  dia livre no dia do aniversário para comemorar e aproveitar o seu dia.·      Temos um bicicletário se você gosta de qualidade de vida e chegar pedalando no trabalho.·      Conte com uma Van para o deslocamento dos colaboradores na estação da Lapa até a Herbalife.·     Programa Qualidade de Vida: com frutas no escritório Programa de Nutrição atendimento Psicológico e muito mais!·     Temos um espaço de lazer do nosso escritório para jogar basquete e ping pong com os colegas nos momentos de intervalo.·     Pode contar com um espaço Zen um ambiente tranquilo para relaxar nos pufs e sofás.·     Disponibilizamos um espaço para lanches e refeições além das máquinas com lanches refri e guloseimas.·     Ah e contamos com um clima muito agradável e informal os meninos por exemplo podem vir trabalhar de bermuda 😊A Herbalife Nutrition é uma empresa global de nutrição que busca profissionais que se identificam com o propósito de contribuir com um mundo mais saudável e feliz! Se você se identificou com o nosso propósito juntese à nós! Gostei quero me candidatar! Se você se identificou e quer fazer parte do nosso time candidatese.Havendo compatibilidade de vagas e de perfil entraremos em contato para o agendamento de uma entrevista.,Herbalife International do Brasil,05/09/2019,data-science
v1935173,Analista de Business Intelligence Júnior,Rio de Janeiro,R$ 3.400 a R$ 3.500,1,2019-09-20,Júnior/Trainee,Desafios do cargo:Desenvolver Projetos de Business Intelligent e oferecer suporte ao processo de implantação da Ferramenta Power BI na empresa Principais Atividades:Dar suporte a gestão do BI acompanhar rotinas de atualizações e evoluções do processo atualDar suporte a modelagem e implementação do processo de ETL e alimentar o Data WarehouseLevantar as fontes de informações em diferentes sistemas (SAP / Sistema WEB) e estruturar os dados de maneira organizadaDesenvolver KPI's e Dashboards de acordo com as necessidades definidas junto aos gestores das áreas Competências Técnicas Esperadas:Conhecimento de Desenvolvimento Power BI DAX MDX (Avançado)Conhecimento Excel (Intermediário)Conhecimento Linguagem SQL (Intermediário) Dados da vaga:Local de trabalho: Barra de Tijuca RJHorário: 08:45 às 18:30,Carvalho Hosken,06/09/2019,data-science
