idVaga,NomeVaga,Cidade,Salario,QuantidadeVaga,DataPesquisa,Perfil,Descricao,Empresa,DataPubli,Pesquisa
v1949951,Analista de BI Sr,Rio de Janeiro,Salário a combinar,1,2019-09-20,Sênior,Requisitos:Ensino superior completo Conhecimentos em Ferramenta de ETL PL/SQL (avançado) OLAP Big Data e Modelagem de Dados.  Atividades:  Analisar o ambiente de banco de dados Data Warehouse (DW) prestando suporte técnico a clientes internos monitorando performances corrigindo falhas de sistemas                                                                     Zelar pela segurança das informações armazenadas no DW elaborando e divulgando documentação técnica padronizada visando atender ao cliente interno conforme padrões estabelecidos                      Apoiar o planejamento de atividades e processos em que atua contribuindo na definição de demandas e prioridades junto aos superiores seguindo diretrizes gerais                                                                   Monitoramento da capacidade dos bancos de dados e implantação de rotinas de otimização de performance                                                                                     Atuação técnica na manutenção dos bancos de dados DS ODS DWH e SASDesenvolvimento de especificação técnica de DW/SASCriação de modelagem dimensional (Dimensões Fatos e Agregadas) para atender as necessidades do DW/SAS Criação implantação e manutenção das rotinas de ETL (Extração Transformação e Carregamento de dados),Confidencial,30/08/2019,big-data
v1960640,Analista de Software (Product Owner),São Paulo,Salário a combinar,1,2019-09-20,Pleno,Requisitos Imprescindíveis: Conhecimentos em Jira Confluence ou outra ferramenta colaborativa. Habilidades de comunicação e resolução de conflitos Ferramentas de apoio (excel powerpoint word e outras) em nível intermediário Superior Completo. Requisito Desejável: Vivência em projetos de desenvolvimento de software Atividades:Atuação como Product Owner junto aos clientes parceiros e os times de desenvolvimento em projetos inovadores de desenvolvimento de Software IoT e Big Data: Conduzir o levantamento dos requisitos junto ao cliente Comunicar as necessidades para o time de projeto Negociar com o time cliente e outros stakeholders as prioridades Manter a comunicação sobre o projeto/produto junto ao cliente e à gestão da empresa Acompanhar a execução de eventuais fornecedores externos  Local de Trabalho: São Paulo/BarueriHorário Comercial,Logicalis,Há 2 dias,big-data
v1957276,Estágio em Consultoria Estratégica - Análise de Dados,São Paulo,R$ 1.000 a R$ 2.000,1,2019-09-20,Estágio,Descrição da vaga: Essa função apresenta novas oportunidades para extrair insights de dados de maneiras inovadoras lidando com conjuntos de dados maiores do que nunca. Você estará envolvido em projetos avaliados em milhões. Com muita autonomiaVocê estará lidando com diferentes metodologias e será responsável para que os resultados do projeto estejam alinhados com as expectativas dos clientes internos/externos e consistentes.Você estará focado em fornecer informações de alta qualidade aos projetos dos clientes e em todo o ciclo de vida dos projetos mais inovadores da companhia.Terá entre suas responsabilidades a de comunicar resultados tanto internamente como externamente.Trabalhe na construção novos produtos de dados fazendo a carga e manipulação de dados na infraestrutura de big data da companhia.Tenha as mais avançadas tecnologias do momento em suas mãos para analisar dados criar modelos e criar visualizações.Avaliar novas iniciativas para determinar o esforço de trabalho e estimar o tempo necessário para a conclusão.Documentar novos desenvolvimentos procedimentos ou planos de teste conforme necessário.Participar de compilações de dados e projetos de execução. Ajude a amadurecer nossas metodologias internas e a criar novas. Requisitos:Graduando em Engenharia Estatística Ciência da Computação Matemática Economia ou outro campo relacionadoExperiência com análise de dados e/ou consultoria será um diferencialConhecimento avançado de powerpoint e excelConhecimento em ferramentas de visualização de dados (e.g. PowerBI Tableau) será um diferencialConhecimento em R e/ou Python será um diferencialInglês avançado (falado e escrito)Perfil analítico proativo curioso e de fácil aprendizadoNão é necessário que o candidato tenha experiência nas áreas de data science e big data entretanto ser um entusiasta da área e ter interesse em ingressar nela é um prérequisito.Remuneração / Benefícios:Bolsa auxílio: R$ 1.61100 mensais (por 6hs de estágio/dia)Benefícios: VR (3000/dia) + VT + VA+ Assistência médica e odontológica + Seguro de vida.Local de estágio: Escritório da IQVIA na Chácara Santo Antonio próximo à estação CPTM Granja Julieta.,IQVIA,12/09/2019,big-data
v1950623,"Especialista Sênior - Chief Technology Information Officer - Digital Transformation - Digital, Analytics & AI Solutions",Rio de Janeiro,Salário a combinar,1,2019-09-20,Supervisão/Coordenação,Descrição das atividades Acompanhar time técnico de desenvolvedores e fábrica de software Trabalhar em colaboração diretamente com as áreas de Marketing e Customer Experience suportando o desenho e desenvolvimento da estratégia de experiência do cliente utilizando as plataformas de gestão de campanhas da TIM Acompanhar o escopo e as priorizações de projetos /demandas garantindo que as soluções sejam padronizadas escaláveis e flexíveis utilizando o potencial tecnológico disponível Desenho de soluções técnicas em conjunto com os times de Arquitetura demais times do CTIO Fornecedores e Fábricas de desenvolvimento Assumir um papel de liderança em iniciativas de desenvolvimento e fornecer orientação para desenvolvedores menos experientes.Conhecimento e Experiência desejável Experiência em projetos de gestão de campanhas trabalhando com conjunto com times de marketing vendas e atendimento Excelente entendimento de conceitos orientados a objetos e padrões de design bem como experiência em desenvolvimento com linguagens OO (Java Ruby C # C ++ etc.) Experiência e conhecimento de bancos de dados relacionais incluindo trabalho com MySQL SQL Server Oracle ou outro RDBMS comum. Experiência na condução de análises de processos técnicos UATs técnicos e trabalho em parceria com consultores de negócios Conhecimento de práticas de desenvolvimento ágil particularmente planejamento e avaliação de sprint Experiência em desenvolvimento de sistemas nas áreas de BI Big Data e Analytics Experiência atuando em desenvolvimento de soluções de customer engagement e gestão de campanhas Experiência em desenho de soluções de gestão de campanhas on e off line utilizando as plataformas SAS (MA ESP RTDM) Sales Force Adobe ou outras de mercado Experiência com liderança técnica.Formação desejável Formação em Ciência da Computação Informática Engenharia ou áreas afins Desejável Especializações nas áreas de BI Analytics Customer Engagement Marketing Big Data CRM Desejável Certificação Scrum Master.   Escolaridade MínimaSuperior CompletoEmpresa e Local de TrabalhoM300 TIM S.A.RJ Rio de Janeiro,TIM Brasil,02/09/2019,big-data
v1952941,Engenheiro de Software / Devops,Campinas,Salário a combinar,1,2019-09-20,Pleno,A NeuralMind (www.neuralmind.ai) está com uma vaga para engenheiro de computação e afins com experiência em computação em nuvem e machine learning.Requisitos exigidos:   Superior Completo / Experiência com infraestrutura cloud (AWS)/ Proficiência em GNU/Linux / Linguagem PythonDiferenciais: Experiência em trabalhar com metodologias ágeis (Scrum)Requisitos desejáveis (proficiência em pelo menos um dos assuntos):  Desenvolvimento fullstack em cloud applications: Javascript (NodeJS e React) e Python (Django). Experiência em deploy de pipeline de modelos preditivos usando metodologias de machine learning ou deep learning. Experiência em otimização de banco de dados relacionais e não relacionais Experiência em ElasticSearch Descrição das atividades: Trabalhar principalmente na  manutenção de infraestrutura Cloud (AWS) com projetos envolvendo áreas como machine learning deep learning big data analytics reconhecimento de imagens e análise de texto.,NEURALMIND,05/09/2019,big-data
v1958677,Estágio em Linux,São Bernardo do Campo,Salário a combinar,1,2019-09-20,Estágio,• Perfil:Imprescindíveis: Conhecimento em Linux Pacote Office intermediário Lógica de Programação. Inglês avançado • Horário: 08h às 15h. • Atividades: Monitoração de file systems Configuração de crontab Configuração de backup Monitoração e análise de consumo de CPU e memória Instalação e configuração de Linux e AIX Suporte a demandas administrativas perninentes a área Atendimento de tickets abertura e execução de Changes Criação e manutenção de Shell Scripts para fins de automação de processos Reuniões operacionais internas e com o cliente Criação e expansão de file system \ LVMs Atuação em projetos envolvendo soluções de big data (Hadoop). Local:São Bernardo do Campo / SP.Benefícios:Vale Refeição Vale TransporteAssistência MédicaAssistência OdontológicaSeguro de Vida. VAGA EXCLUSIVA PARA PESSOAS COM DEFICIÊNCIA,T-Systems,Há 4 dias,big-data
v1948467,Analista de Desenvolvimento de Software Sr,Jaguariúna,Salário a combinar,1,2019-09-20,Sênior,ANALISTA DE DESENVOLVIMENTO DE SOFTWARE SÊNIORRequisitos necessários:Superior completo ou cursando Ciências da Computação ou áreas afinsResidir em Campinas Hortolândia Sumaré Jaguariúna PaulíniaInglês avançado. Atividades:Programar Big Data desenvolver algoritmos e possui boa experiência com a linguagem de programação PhythonRealizar o desenvolvimento de sistemas componentes e aplicações para diferentes plataformas codificando programas mediante análise da documentação técnica fornecida atentandose para os padrões de desenvolvimento (Design Patterns)Modificar programas ou rotinas de sistemas alterando o processamento a codificação e demais elementos a fim de corrigir falhas ou atender alterações de sistemas e novas necessidadesRealizar testes unitários em ambiente de desenvolvimento efetuar correção de defeitos apontados no processo de testes da soluçãoRecomendar ou aplicar novos procedimentos de desenvolvimento de software,HM CONSULTORIA E RECURSOS HUMANOS EIRELI,28/08/2019,big-data
v1946234,Analista de Churn Pl,São Paulo,Salário a combinar,1,2019-09-20,Pleno,Este profissional realizará a extração de relatórios criação manutenção e gestão de banco de dados e desenvolve estudos e orienta as tendências operacionais por meio da mensuração de resultados e comparativos para tomada de decisão. Atividades:Elaboração de relatórios de acompanhamento da operação de Gestão de Base e Estratégia de Churn (rankings projeções diárias monitoramentos em geral)Desenvolvimento da estrutura do banco de dados que é usado garantindo que as tabelas estejam sempre padronizadas e disponíveisCriação homologação e produção das tabelas no Big Data. Requisitos:Ensino Superior CompletoExcel: avançado (se possível conhecimentos em Macros/VBA OLAPs)Pacote SAS ou Ferramentas SQL: avançado (macros e automatização de processos)PowerPoint: intermediário (apresentações)Conhecimento dos indicadores de Churn (voluntário e involuntário)Inglês: intermediário (interpretação de materiais em inglês da VRIO/AT&T).,SKY HDTV é Isso,23/08/2019,big-data
v1947181,Engenheiro de Dados,São Paulo,Salário a combinar,4,2019-09-20,Sênior,Nós da Korn Ferry estamos apoiando a Gerdau em seu processo de Transformação Digital. A Gerdau é a maior empresa brasileira produtora de Aço além de ser uma das principais fornecedoras de Aço Longo na América Latina e Aços Especiais no Mundo. Atualmente ocupa o posto de maior recicladora da América Latina.Venha fazer parte deste Time como:  Engenheiro de DadosVocê quer mudar a experiência das pessoas dentro do setor industrial Tem vontade de aprender e se desenvolver no assunto de Industria 4.0 explorando dados de equipamentos e disponibilizando as nossas bases em um Data Lake GlobalEstamos procurando Engenheiros de Dados com conhecimentos em Automação (DevOps) para se juntar ao nosso time e que irão construir as plataformas tecnológicas que ajudarão a implementar a nossa visão digital. Responsabilidades e atribuiçõesApoiar os times de cientista de dados e analytics capturando e disponibilizando os dados em plataformas para processamentoGarantir que as soluções sejam escaláveis com baixa latência e resilientesDesenvolvimento de plataforma de Pipeline de DevSecOps (GoCD e Git)Desenvolvimento de plataforma de provisionamento automatizadoTer experiência com operação de software em produção e sejam capazes de prever como o sistema afetará o ambiente de produçãoConhecimento de boas práticas tais como 12 fatores SOLID e reactive programming. Requisitos e qualificações.Experiência com ferramentas de big data: Hadoop Spark KafkaConhecimento de bancos de dados SQL e NoSQL como: PostgreSQL SQL Server Mongo e HBaseExperiência em Infraestrutura Cloud (AWS) e OnPremisesConhecimento da linguagem Python e Shell Script para automaçãoExperiência na captura de dados das mais variadas fontesExperiência na construção e otimização de pipelines de big data arquiteturas e datasetsExperiência com ferramentas de Workflow como ControlM / AirflowHistórico de processamento e extração de datasets desconectadosConhecimento de enfileiramento de mensagens processamento de dados em streaming e armazenamento de dados em em larga escalaConhecimento sobre como trabalhar com dados não estruturadosExcelente Troubleshooting e Desenvolvimento de SoftwareExperiência com ferramentas de automação de configuração e infraestrutura (Ansible Terraform Chef e Puppet)Conhecimentos em SAP BW Hana e ECC serão diferenciaisExcelente habilidade de comunicação verbal e escritaInglês avançadoProatividade sentimento de dono e perfil colaborativo são características obrigatórias Contratação: CLTBenefícios: Assistência Médica Odonto Seguro de Vida Estacionamento ou VT e Previdência   ValeRefeição.Escritório próximo dos principais pontos de transporte – Prédio Eldorado Tower em Pinheiros ao lado do Shopping.,Korn Ferry,26/08/2019,big-data
v1927401,Especialista de Desenvolvimento,São Paulo,Salário a combinar,1,2019-09-20,Sênior,AtividadesEntendimento das necessidades das áreas usuárias através de reuniões ou sessões de design thinking impactando em incremento do backlog do portfólio com a inclusão de necessidades que tenham aderência ao produto geridoDefinição das funcionalidades sistêmicas através da escrita de histórias que abastecerão aesteira do time de desenvolvimentoPriorização das necessidades dentro do roadmap de evolução do produto de acordo com o alinhamento ao planejamento estratégico permitindo sincronicidade das entregas com a estratégia do HospitalIdentificação de MVPs (produtos mínimos viáveis) através do conhecimento do problema da área usuária permitindo redução do tempo de entrega de soluçõesAvaliação da entrega através da validação do produto e permitindo que as áreas demandantes recebam a funcionalidade que vai lhes ajudar na solução de um problemaRequisitosEnsino Superior CompletoExperiência como PO de time ágilConhecimentos básicos de data analytics/Big Data/Inteligência artificialDesejável Certificação de Product Owner da Scrum.org ou Scrum AllianceHorário de Trabalho08:00 18:00 horas (2ª a 6ª feira)LocalUnidade Bela Vista São Paulo/SP (próximo ao Metrô Trianon/MASP) No SírioLibanês temos o compromisso com a diversidade e a inclusão. Todas as nossas vagas respeitam essas premissas. Faça parte da nossa equipe!,Hospital Sírio-Libanês,21/07/2019,big-data
v1947950,Consultor Júnior - Desenvolvidor Phyton,Rio de Janeiro,Salário a combinar,1,2019-09-20,Júnior/Trainee,Requisitos:Formação: Ensino Superior completo em Ciência da Computação e áreas correlatasConhecimento: Rede Banco de dados Windows Linux Desenvolvimento de Software com metodologias ágeis SCRUM programação em Phyton e Node JS Web service e aplicações Web Princinpais Atividades:Consultoria aos Clientes em tecnologias de Information Management Big Data e AnalyticsInstalação e configuração de soluções de Software EmpresarialDesenvolvimento de componentes específicos de software incluindo principalmente as linguagens de programação Phyton e Node JsFornecimento de suporte especializado de 2º nível as áreas de TI dos Clientes nas diversas soluções da empresa. Jornada e Horário de Trabalho: 40 horas semanais sendo 8 horas diárias de segundafeira a sextafeira Tipo de Oportunidade: Efetiva (CLT) Salário: A combinar Benefícios: Vale Transporte Vale Refeição Assistência Médica Assistência Odontológica e Treinamento Certificado Local de Trabalho: Rio de Janeiro RJ,Adecco,27/08/2019,big-data
v1954924,Analista de Segurança da Informação (Gestão de Riscos),Rio de Janeiro,Salário a combinar,1,2019-09-20,Pleno,Requisitos:Superior completo em Ciência da Computação Análise e Desenvolvimento de Sistemas Segurança da Informação ou áreas afins.Sólidos conhecimentos de requisitos de segurança para: sistemas elementos de rede fornecedores APPs etc. Sólidos conhecimentos no software GRC Archer (usuário e configuração). Bom português. Conhecimentos de Segurança da informação. Habilidade para realizar reuniões e auxiliar as áreas relacionadas a responderem corretamente todos requisitos de segurança. Habilidade para verificar se os planos de ação estão em conformidade com o que é solicitado e se as evidências de implementação estão em conformidade com o definido. Conhecimento de segurança em Cloud BYOD BIG DATA dispositivos móveis e processo de desenvolvimento DEVOPS. Inglês intermediário/ avançado Atividades: Classificar e manter o PDCA do processo de Gestão de Riscos de Segurança do cliente rodando dentro do prazo e escopo estipulado. Auxiliar a equipe de Mapeamento e melhoria de processos em Segurança nos temas relacionados a Gestão de Riscos de Segurança.  Local de Trabalho: Barra da Tijuca,Ericsson Gestão e Serviços de Telecomunicações,09/09/2019,big-data
v1958740,Analista de Inteligência de Mercado,São José dos Pinhais,Salário a combinar,1,2019-09-20,Pleno,Vaga extensiva a PCD'sAtividades: Monitorar informações (investimentos etc) e tendências de mercado identificar novas oportunidades de negócio. Monitorar principais clientes (ou segmentos de mercado) identificando tendências e oportunidades. Recomendar potenciais inciativas estratégicas relativas a cobertura de mercado e lançamentos de produtos para diferentes regiões e /ou segmentos de mercado. Desenvolver relatórios diversos (ad hoc) que reforcem a tomada de decisão da Gerência e Diretoria. Desenvolver relatórios de vendas e dashboards através da ferramenta Power BI. Mapeamento e organização das informações. Mapear e monitorar a concorrência. Analisar carteiras potenciais e novas oportunidades/estratégias de atendimento da Força de Vendas. Acompanhar as campanhas de vendas.Requisitos: Ensino superior completo em Administração Matemática Engenharia Economia ou área afins. Desejável formações adicionais em Big Data Inteligência de Mercado e Sales Analytics. Inglês intermediário. Excel avançado. Disponibilidade para atuar em São José dos Pinhais.,Bematech,Há 4 dias,big-data
v1939394,Especialista de PDV,São Paulo,Salário a combinar,1,2019-09-20,Sênior,Descrição: Administrar e estar alinhado com as prioridades do product backlog de desenvolvimento e entregas dentro das prioridades da CIA trabalhando as prioridades buscando a melhor eficiência e com melhor resultado para CIA. Desenvolver administrar reportar prestar suporte e cobrar as incidências encontradas dentro das prioridades de operações e da CIA trabalhando e buscando a melhor eficiência e com melhor resultado para CIA. Garantir que o Product Backlog esteja sempre visível à todos de forma clara e transparente com datas e expectativas de entregas para que todos estejam alinhadas com as prioridades de operações e da CIA. Desenvolver novas funcionalidade e atualizações no qual seja específica de PDVs a fim de garantir umaentrega rápida e um baixo backlog de desenvolvimento. Relacionamento e coordenação técnica com a equipe da Espanha a fim de manter uma boa comunicação e efetividade das entregas garantido a correta evolução do sistema. Participar e pilotar projetos que envolvam a parte de informática do ponto de venda para garantir o que é possível fazer e adequar novas tecnologias e novos equipamentos de acordo com a estratégia de negócio da empresa. Entender criticar questionar e mapear as necessidades dos processos de negócio garantindo alta eficiência e performance dos interessados na criação e entrega das soluções de tecnologias propostas. Manter os produtos já entregues e desenvolvidos devidamente atualizados garantindo a disponibilidade de serviços e correto funcionamento das aplicações. Levantar requisitos funcionais e não funcionais de sistema a fim de garantir qualidade e cobertura em todos os pontos das solicitações e necessidades Mapear e descrever atores e casos de usos/user stories de sistema a fim de cobrir todas as áreas a serem envolvidas no projeto necessidades e treinamento. Definir complexidade dos requisitos de negócio através de ferramentas como a matriz de esforço e impacto e 5W2H a fim de definir a prioridade correta de cada necessidade. Elaborar documento de escopo do sistema garantindo que tenham claro a necessidade e com o melhor aproveitamento evitando retrabalho. Realizar reuniões de requisitos a fim de garantir a cobertura completa de necessidades de todos os possíveis interessados.Requisitos:Graduação em TINoções de sistemas integrados Windows Android Pacote Office Big data desenvolvimento em linguagem C sobre Linux(C++) Linux console scripts(Bash) sistema de arquivos sockets pacotes(tgz rpm) ssh ftp programação de estrutura de dados clássica(pilhas ponteiros) abstração de dados sistema de controle de versão(cvs svn git) conhecimento webservice SOAP REST XML XSD Espanhol avançadoCompetências Técnicas:  Domínio – Análise de documento e sistemas. Domínio – Excel Domínio – Sistemas integrados e Big Data. Metodologia de trabalho Scrum Domínio – Desenvolvimento sobre Linux C++ Conhecimento WebserviceLocal de Trabalho: São Paulo SPHorário de Trabalho:De segunda a sextas das 8:00 às 17:48,Dia Brasil,12/08/2019,big-data
