idVaga,NomeVaga,Cidade,Salario,QuantidadeVaga,DataPesquisa,Perfil,Descricao,Empresa,DataPubli
v1945218,Atuário / Estatístico Sr.,São Paulo,Salário a combinar,1,2019-09-05,Sênior,Atividades do cargo: Elaboração de nota técnica atuarial Precificação de planos de saúde Provisões técnicas Análise de indicadores por carteira (por produto tipo de contratação etc.) Teste de Adequação de Passivo e Cálculo de capital mínimo Acompanhar obrigações junto a ANS Apuração de despesas assistenciais (sinistralidade) Análise demográfica dos beneficiários. Conhecimentos necessários: Ensino Superior completo em Ciências Atuariais Matemática ou Estatística Pósgraduação cursando/completa em áreas relacionadas (Finanças Economia Estatística Matemática e afins) Excel avançado Conhecimento em programas estatísticos como: SAS SQL R Pyton Stata SPSS etc Desejável inglês intermediário Essencial ter atuado em empresas dos ramos de: assistência médica previdência ou seguros.,UNIMED FESP,22/08/2019
v1943426,Consultor Sênior - Marketing - CRM - Estatístico (Telecomunicações),Rio de Janeiro,Salário a combinar,1,2019-09-05,Sênior,Descrição das atividades Monitoramento de novas receitas do negócio PréPago (TIM Ads e Crédito Especial) Análises estatísticas para subsidiar o negócio pré pago por novas formas de receita Alinhamento de Projetos das demais áreas que impactam o negócio Pré Pago Análises dos impactos ou possíveis impactos nos indicadores Pré Pago das novas receitasConhecimento e Experiência desejável Experiência no mercado de Telecom Conhecimento em SAS SQL Excel Power Point Bom relacionamento interpessoal com áreas paresFormação desejávelEstatística Administração Engenharia da Produção Ciência de Dados Sistemas de InformaçãoEscolaridade MínimaSuperior CompletoEmpresa e Local de TrabalhoM300 TIM S.A.RJ Rio de Janeiro,TIM Brasil,26/08/2019
v1941042,Estágio em Engenharia ou Estatística - Gestão Operacional e Qualidade,Paulínia,R$ 1.530 a R$ 1.750,1,2019-09-05,Estágio,.Requisitos obrigatórios: Cursando Penúltimo Ano de Engenharia ou Estatística   Inglês Intermediário / Avançado Domínio do Pacote Office com Excel Avançado .Atividades do Estagiário: Treinamento em ISO 9001 ISO 14001 Excelência e Seis Sigma (noções básicas) e participação em auditorias internas.Suporte à implementação do Plano anual de Excelência/Qualidade.Desenvolvimento e manutenção de ferramentas que auxiliam a medição de indicadores críticos para Qualidade e Excelência (Flash Qualidade BSC Vazamentos Horas Extras entre outros).Atuar nos projetos na área de Excelência.,Willisa,14/08/2019
v1940030,"Estágio em Administração de Empresas, Eng. Produção, Estatística - Dasa / PE",Recife,Salário a combinar,1,2019-09-05,Estágio,Requisitos:Cursando Administração de Empresas Matemática Eng. Produção com formação prevista a partir de 12/2020Área Atuação/ Atividades:Núcleo Técnico Operacional –  (1 vagas)Acompanhamento de IndicadoresGestão do Modelo DASA de ProduçãoDesenvolvimento de dashboard de indicadores da produção e acompanhamentoRelatórios gerenciais Bolsa Auxílio e Benefícios:Bolsa estágio: R$ 95500Possibilidade de prorrogação de contratoPossibilidade de efetivaçãoHorário de Estágio:6 horas/dia das 9h às 16hLocais de Estágio: RecifeBOA VIAGEM/ PE,Instituto Via de Acesso,13/08/2019
v1940106,Analista de Risco,Fortaleza,Salário a combinar,2,2019-09-05,Pleno,REQUISITOS Ensino superior completo em Estatística Economia Engenharia Matemática e áreas afins Pacote office avançado conhecimento em VBA SPSS Python Power BI e R Organizado(a) com senso de urgência perfil analítico e visão crítica.ATIVIDADES Responsável pela identificação desenvolvimento e implantação das estratégias de Modelos Estatísticos Construção de Banco de Dados que permitam evoluir no processo de desenvolvimento e Gestão dos Modelos EstatísticosTrabalhar com os Fornecedores e Pares para o desenvolvimento de: Credit Scores Behaviour Scores e Collection Score Avaliar continuamente os resultados dos Modelos Estatísticos incluindo riscos e oportunidades Monitoramento dos Modelos Estatísticos através de  MIS Entre outras atividades.,Fortbrasil,13/08/2019
v1939529,Analista de Modelagem de Crédito Sr,São Paulo,Salário a combinar,1,2019-09-05,Sênior,REQUISITOS: Formação Superior em Estatística/Matemática/Física/Economia/ Administração de Empresas. Desejável Pósgraduação Experiência em instituições financeiras com criação de modelos estatísticos de crédito Pessoa Física Mensuração e analise de resultados Estudos comportamentais de clientes.,CV Consult,12/08/2019
v1948756,Estágio área de Supply Chain,Vinhedo,Salário a combinar,1,2019-09-05,Estágio,Multinacional em parceria com a Global Empregos Requisitos: Cursando Engenharia Matemática ou Estatística• EXCEL AVANÇADO• CONHECIMENTO EM BANCO DE DADOS• POWER POINT INTERMEDIÁRIO• INGLÊS INTERMEDIÁRIO Benefícios: Vale alimentação vale transporte convênio médico refeição no local e seguro de vidaHorário: 07h30 às 14h30 ou 10h13 as 17h13 – segunda a sextaResponsabilidades: dar Suporte quantitativo ao setor de Supply Chain através do mapeamento análise e geração de dados estatísticos para fundamentar a tomada de decisão minimizando os riscos e automatizando as decisões com assertividade nos resultados. Extração de relatório do SAP realização de carga tratamento e extração de dados no Banco de Dados do Excel (construir modelos estatísticos). Auxiliar na análise estatística dos dados propondo melhor modelo estatístico e ajudar na implementação de melhorias. Auxiliar na criação de indicadores de Gestão do Supply Chain e acompanhar os indicadores de gestão realizando melhorias nas bases de dados e suportando as melhorias nos processos da área de Supply Chain. Domínio do MS Excel e bom uso do MS PowerPoint. Pesquisar novas técnicas e metodologias em modelagem e testar sua aplicação no negócio.,Global Empregos,28/08/2019
v1943791,Analista de Modelagem Sênior,Rio de Janeiro,Salário a combinar,1,2019-09-05,Sênior,Prérequisito:Graduação em Estatística Matemática Atuária ou Engenharia.Experiência com Bancos de DadosDomínio dos indicadores de performance de carteira e indicadores de performance de modelos estatísticos (árvore de decisão e regressão logística) de scoring.Vivência com ferramenta SAS e Modelos de segmentação Excel Avançado Programação SAS ou SQL.Necessário experiência com Modelagem.Atividades:Elaborar/acompanhar modelos estatísticos de risco oportunidade e perfil para operadora de saúdeGerar Leads para açõesOtimizar política de retenção e fidelizaçãoTratar as bases de dados e compilar informações. Oferecemos: Salário compatível com o mercado + benefícios.,Confidencial,20/08/2019
v1946843,Cientista de Dados,Distrito Federal,Salário a combinar,1,2019-09-05,Sênior,Conhecimentos: Conhecimentos avançados em Data Mining Conhecimento avançado de SQL Conhecimento e experiência no desenvolvimetno de modelos utilizando algoritmos de Machine Learning Regressão logísticaÁrvore de decisão KNN Random Forests Técnicas resampling Validação de Performance de Modelos Domínio de um pacote estatístico R ou Python ou SASVisualização de Dados Será um diferencial:  Conhecimento de SAS enterprise Miner – Reiforcement Learning Redes Neurais autoregressivas e Modelos Bayesianos – Experiência em estatística aplicada a serviços financeiros (Banking)Atividades a serem Desenvolvidas:Análise exploratória dos dadosImplantação e desenvolvimento de modelos estatísticos Validação de performance dos modelos,Vert Soluções em TIC,26/08/2019
v1949959,Analista Operacional,Canaã dos Carajás,Salário a combinar,1,2019-09-05,Pleno,Principais Requisitos:•             Conhecimento com tratamento estatístico de dados•             Conhecimento na aplicação de softwares estatísticos•             Elaboração e aplicação de PDCA•             Aplicação da metodologia de 6 Sigmas para tratamento de desvios e problemas tratando a causa raiz.Controle operacional de variáveis de processo análise estatística de dados.Acompanhar as operações das Usinas monitorando as variáveis de processo controlando e fazendo as tratativas de desvios e Não conformidadesFazer interface da operação dos turnos com a gestão das UsinasIdentificação de riscos e de melhorias e atuar para a manutenção dos níveis de produtividadeAssessorar o planejamento estratégico da operação de UsinaCoordenar e/ou orientar as ferramentas da qualidade e segurança.Disponibilidade para atuar com revezamento de turno.,Search Consultoria em Recursos Humanos,Há 6 dias
v1946961,Analista de Modelagem Pleno,Barueri,Salário a combinar,1,2019-09-05,Pleno,Horário: das 8h00 às 17:00 (2ª à 6ª feira) O que a área faz:Através de dados estudos análises e raciocínio sistêmico a área de Analytics e Modelagem Estatística auxilia na tomada de decisão do negócio buscando impactar na lucratividade da companhia. O que você precisa ter:Superior completo em Estatística (ou áreas afins) e Inglês básico para leitura. Também buscamos pessoas que tenham conhecimento em SAS SQL e em outras ferramentas de manipulação de banco de dados ou software estatístico. O que você irá entregar:Estudos/hipóteses a partir da análise de dados apoiar nas atividades de homologação e manipulação dessa base criar modelos estatísticos realizar a manutenção dos modelos existentes desenvolver apresentações executivas e realizar pesquisas a respeito de outras técnicas e metodologias em modelagem/ analytics e suas respectivas aplicações. O que nós oferecemos:Vale Transporte Vale Refeição Vale Alimentação participação nos lucros da empresa auxílio creche e babá para os seus filhos assistência médica e odontológica desconto em academias pelo Gympass descontos exclusivos em produtos da seguradora café da manhã e um salário compatível com o mercado.,Bradesco Seguros,26/08/2019
v1892675,Cientista de Dados,São Paulo,Salário a combinar,1,2019-09-05,Pleno,Requisitos: Linguagens Python ou R Estatística básica: conhecimento sobre médias medianas quartis desvio padrão probabilidade testes estatísticos entre outros conceitos. Aprendizado de máquina: conhecimento dos principais algoritmos quando utilizálos e forma correta de realizar experimentos e engenharia de features. Desejável: SQL Demonstrar experiência com Hadoop e Spark  Demonstrar experiência com bancos de dados NoSQL MongoDB Cassandra Neo4j. Profissional PJ (Prazo indeterminado).Local: Butantã (próximo à USP).,Quantum IT,20/08/2019
v1943684,Consultor Data Science - Júnior,São Paulo,Salário a combinar,1,2019-09-05,Júnior/Trainee,Funções:          Tratamento estatístico de dados (data mining).          Modelagem preditiva mediante técnicas de machine learning e data science          Modelagem de eventos temporais (séries temporais modelos ARIMA).          Desenvolvimento de modelos de simulação (Monte Carlo).          Revisão e validação de modelos de rating e scoring RAROC e parâmetros de risco.          Apoio matemático ao negócio: desenvolvimento de algoritmos estatística e probabilidade.          Projetos de I+D (Pesquisa e desenvolvimento).  Requisitos:         Estudantes com formação em Julho de 2019 nos cursos: Matemática Física Estatística Engenharia ou outros estudos com forte componente quantitativo.         Também valorizamos conhecimento de técnicas de modelagem (logit GLM séries temporais árvores de decisão clustering etc.) linguagens de programação estatística (SAS R Python Matlab etc) e ferramentas de plataformas de Big Data (Hadoop MongoDB Cassandra Pig Hive etc.)          Valorizamos a realização de estudos específicos de pósgraduação em especial Data Science Finanças Quantitativas ou similar         Alto nível de inglês e conhecimento de outros idiomas.         Disponibilidade para viajar.Outros aspectos: sólida trajetória acadêmica dinamismo vontade de superação capacidade de trabalho Maturidade responsabilidade e facilidade de integração em equipes de trabalho multidisciplinar.Vaga disponível para PCD's,MANAGEMENT SOLUTIONS,Há 6 dias
v1945123,Analista de Planejamento e Analytics,Fortaleza,Salário a combinar,1,2019-09-05,Pleno,REQUISITOSEnsino superior completo em Estatística Engenharias Economia Administração Ciência ou Engenharia da Computação e afinsConhecimento em Alteryx R Python Tableau e Power BI serão diferenciais.Informática Avançada. ATIVIDADESRealizar análises de performance operacionalColaborar na construção de testes piloto x controle para aprimoramento das políticas de cobrançaTrabalhar com banco de dadosElaborar M.I.S operacionais e gerenciaisAtuar como suporte na construção de modelos estatísticos e estratégiasEntre outras atividades.,Fortbrasil,22/08/2019
v1945989,Analista de Planejamento de Materiais,Manaus,R$ 3.000 a R$ 4.000,1,2019-09-05,Pleno,Grande Indústria Distribuidora de Energia localizada em Manaus/AM busca profissional para ocupar a posição de Planejador de Materiais (TEMPORÁRIO COM CHANCES DE EFETIVAÇÃO). Formação em Superior Completo em Administração ou Logística Experiência na área de planejamento de estoques Conhecimento em conceitos como classificação ABC PQR XYZ 123 e Estatística (Estatística Descritiva Inferência e modelos de previsão) Conhecimento em indicadores de estoque (Giro Cobertura de Estoque e Nível de Serviço). Domínio no Pacote Office Excel avançado Residir em Manaus.,Luandre,23/08/2019
v1946337,Cientista de Dados (Vaga para Maringá - PR),Maringá,Salário a combinar,1,2019-09-05,Sênior,ATIVIDADES:Mineração e análise de grande volume de dados com o objetivo de prover informações estratégicas para a instituiçãoUtilização de dados para propor melhorias de processos e novos produtosDesenvolvimento de algoritmos de prediçãoTrabalhar em conjunto com outras áreas da empresa e propor soluções.FORMAÇÃO:Curso superior completo em Estatística Economia Tecnologia da Informação Engenharia MatemáticaCONHECIMENTOS TÉCNICOS NECESSÁRIOS:Python / R / SQL avançadosEstatísticaBig Data BI Machine Learning e  IAConhecimento Contábil e Sistema FinanceiroExperiência na área.,Sicoob Central Unicoob,23/08/2019
v1952032,Assistente de Marketing,Santos,R$ 1.600 a R$ 2.000,1,2019-09-05,Júnior/Trainee,Preparação de estatísticas: Utilização de Excel e Power Bi Apresentações em Powerpoint criação de banners. Controle e suporte na confecção pedido e entrega de brindes.,Confidencial,Ontem
v1946164,Analista de Prevenção a Fraude Pleno,Rio de Janeiro,Salário a combinar,1,2019-09-05,Pleno,Principais responsabilidades:Elaborar estudos e modelos estatísticos com o objetivo de identificar vendas que tenha alta probabilidade de serem fraudulentasPropor regras de procedimentos de avaliação de riscoGerenciar o sistema de regras antifraude sendo responsável pela inclusão alteração e desativação de regras Propor melhorias no sistema antifraude garantindo a constante aderência á evolução do mercado bem como aos processos internos. Requisitos:Superior Completo em Estatística ou áreas correlatasPacote Office Avançado (será testado) Local de trabalho: Barra da TijucaOferecemos salário compatível com o mercado política de benefícios atrativa e oportunidade de crescimento.,Wooza Telecom,23/08/2019
v1918393,Bolsista Programa Inova Talentos - IEL / CNPq,Osasco,Salário a combinar,5,2019-09-05,Sênior,Mestres e Doutores em: Matemática Aplicada Estatística e áreas afinsComo utilizar métodos analíticos para gerar vantagem competitiva em uma organização inserida em um ambiente altamente competitivo Conhecimento técnico: Capacitado em técnicas e ferramentas para o tratamento de grande volumes de dados. Ferramentas Estatística (SAS SQL R SPSS Stata)Carga horária de acordo com o plano de atividades acordado com o Tutor do Projeto. Duração: 12 meses. Valor da bolsa: R$3.00000 para MESTRES com no máximo 5 (cinco) anos de titulação.R$4.50000 para DOUTORES com no máximo 5 (cinco) anos de titulação.  Local: Osasco SP,IEL /SP - Inova Talentos,07/08/2019
v1939154,Analista de Revenue Assurance Jr,São Paulo,Salário a combinar,1,2019-09-05,Júnior/Trainee,ATIVIDADES E RESPONSABILIDADES Atendimento a requisitos de faturamento e reconhecimento de receita Auxílio ao desenvolvimento e implementação de testes na cadeia de receita Análise e diagnósticos das inconsistências encontradas Elaboração de indicadores de monitoramento da receita Auxiliar na elaboração de solicitações de auditoria e projetos conforme necessário Efetuar análises e estudos utilizando ferramentas estatísticas Gerar e analisar indicadores da área transformando dados para auxiliar na decisões de negócios. FORMAÇÃO ACADÊMICA NECESSÁRIAEnsino Superior em Contabilidade Administração Economia Estatística ou áreas correlatas.CONHECIMENTOS ESPECÍFICOSConhecimento em Pacote Office intermediário e SQL/SAS básico.HORÁRIO DE TRABALHO Segunda a Sextafeira.LOCAL DE ATUAÇÃOSão Paulo/SP.,Kroton Educacional,12/08/2019
v1922282,Técnico de Laboratório Dimensional,Betim,Salário a combinar,1,2019-09-05,Técnico,Requisitos da Vaga:Ensino Técnico Competências Técnicas  Equipamentos de Medição Tridimensional   Análise de dados estatísticos  Leitura e interpretação de desenho  Processo Produtivo/Usinagem  Equipamento de Rugosidade  FMEA Diferencial:InglêsEnsino Superior,Nemak Alumínio do Brasil,11/07/2019
v1911451,Analista de Inteligência de Dados,Rio de Janeiro,Salário a combinar,1,2019-09-05,Pleno,DESCRIÇÃOAtuar na interface entre a área de negócios e cientistas de dados para auxiliar no desenvolvimento de estratégias segmentadas para otimização do valor da base de clientes.Análise e discussão das estratégias de segmentação e das campanhas.Criação e análise de KPIs para monitorar a performance do programa e contribuir com o desenvolvimento de ações de marketing que potencializem as oportunidades de retenção de clientes e expansão do programa assim como mensurar a rentabilização do programa.Aplicação de inteligência analítica em negócios.Formular e analisar hipóteses que ajudem na tomada de decisões estratégicas.Dar suporte às ações de planejamento e gestão de resultados com a finalidade de garantir a rentabilidade sustentabilidade e crescimento dos negócios. Auxiliar no desenvolvimento e mensuração de Testes A/B e na modelagem das análises estatísticas do programa. PRÉREQUISITOS Formação superior completa em Estatística Engenharia Ciência da computação e afins. Experiência com inteligência analítica aplicada a campanhas de aquisição de clientes retenção ou criação de estratégias ou ofertas personalizadas Raciocínio analítico Domínio do Pacote Office e conhecimento avançado de Excel Disponibilidade para viagens Nível mínimo do idioma Inglês: intermediário DESEJÁVEL Habilidade de Comunicação Conhecimento de Microstrategy (ferramenta de Business Intelligence BI) Experiência com criação de indicadores de performance ou criação de modelos de propensão Conhecimento em estatística Desejável conhecimento de marketing estratégico e experiência em varejo Experiência com gestão de base de clientes,Ipiranga Produtos de Petróleo S/A,Há 7 dias
v1941288,Analista de Produtos Pleno,São Paulo,Salário a combinar,1,2019-09-05,Pleno,** TODAS AS NOSSAS POSIÇÕES TAMBÉM SÃO DESTINADAS A PESSOAS COM DEFICIÊNCIA** Responsável por elaborar e fazer a gestão da precificação dos produtos relacionados aos Riscos Patrimoniais com foco no aumento da produção e a rentabilidade da companhia através da seleção dos melhores riscos da otimização do prêmio a ser cobrado da fidelização dos clientes com as melhores margens e do monitoramento dos indicadores de desempenho internos (relatórios estatísticos) e externos (análises de mercado). ATIVIDADES:Gestão da TarifaDesenvolvimento de estudos e análises para avaliação (e implantação) de produtos em relação ao mercadoElaboração e desenvolvimento de relatórios gerenciais e dashboardsGestão e utilização de informações disponíveis nas bases de dados de negócioOrganização e consolidação de dadosCriação de KPI's (Key Performance Indicator)Análise de relatórios e identificação de oportunidades de negócios alinhados com a estratégia do GrupoAnálise de padrões de comportamento tendências simulações de cenários e revisõesModelagem REQUISITOS: Atuação no Mercado Segurador sobretudo nos ramos PatrimoniaisSuperior Completo em exatas: desejável Administração Engenharia Matemática ou EstatísticaPacote Office: Excel e Access avançadosSAS (programação mandatória)SAS Miner (desejável)Conhecimento em estatística extração e mineração (tratamento de base de dados e informações). BENEFÍCIOS:ValeRefeição Vale Alimentação ValeTransporte Assistência Médica Assistência Odontológica Seguro de Vida Seguro Decessos Previdência Privada Participação nos Lucros e Resultados Auxílio Creche / Babá Treinamentos Internos e Capacitações.,BRASILSEG,14/08/2019
v1939368,Analista de Dados,Rio de Janeiro,Salário a combinar,1,2019-09-05,Pleno,MISSÃO: Responsável por participar da consistência e validação de informações geradas pelos diversos sistemas legados e o Sislíder bem como dos paineis gerados pelo BI controlando e analisando a consistência de dados. Analisar diversas fontes de dados extraindo informações para guiar ações e medir resultados.  PRINCIPAIS RESPONSABILIDADES: Tratar bases de dados necessários à produção de informações oficiais do SeguroEstruturar o acesso às informações institucionais externas e internas de forma ágil e amigávelAnalisar a base de dados utilizada pela Gerência de Estudos Atuariais e Estatisticas (confiabilidade dos dados)Realizar pesquisas para identificação de oportunidades e desenvolvimento de soluções para melhoria resultados e incremento da tecnologia aplicada na área para divulgação e consolidação das informações oficiais Conhecimentos:  Utilização da software estatístico SAS Excel avançado e PowerBi nas rotinas e projetos da área Conhecimento do PowerBI,SEGURADORA LIDER,12/08/2019
v1939283,Pesquisador,Iracemápolis,Salário a combinar,1,2019-09-05,Júnior/Trainee,O que irei fazerPlanejar implementar e conduzir ensaios de pesquisa e desenvolvimento de fertilizantes de estimulantes e de produtos biológicos em campo casa de vegetação e/ou laboratório dentro e fora do centro de pesquisa gerando resultados e relatórios que auxiliam na tomada de decisão sobre o desenvolvimento do produto de nutrição vegetal fisiológicos e biológicos.Formação: Engenharia Agronômica ou Agronomia Mestrado na área de nutrição vegetal fisiologia de plantas bioquímica de plantas ou fitotecnia. Desejável doutorado na área de nutrição vegetal fisiologia de plantas bioquímica de plantas ou fitotecnia.Experiência comprovada em desenvolvimento de pesquisa agrícola com amplo conhecimento em experimentação agrícola. Conhecimento em estatística.Conhecimento desejável do mercado de fertilizantes foliares e especiais. Experiência com pesquisa a campo na cultura do milho e/ou soja.Informática: Pacote Office programas de estatística (ex. Minitab) Idioma: Inglês avançadoLocal de trabalho: Iracemápolis / SP,Confidencial,12/08/2019
v1939418,CONSULTOR SENIOR - Marketing Consumer - High End Segment - CRM | Rentabilização  - HQ,Rio de Janeiro,Salário a combinar,1,2019-09-05,Sênior,Descrição das atividadesResponsavel pela definição dos clusters propensos a rentabilização de basePlanejamento e acompanhamento E2E dos clientes migrados garantindo o life time do cliente na base controle e pos pagoTer conhecimento financeiro/crédito para identificar melhores clusters propensos (score IP...)Construção de relatórios de acompanhamento dos resultados dos canais de venda Responsável pelo report mensal de performance das operações outbound versus mailing enviadoConceitos estatísticos/ matemáticos/ tendências businessCapacidade analítica e resolução de problemasCapacidade de desenvolver testar e validar soluções para melhor reflexo no negócioConhecimento e Experiência desejávelConhecimento de banco de dados SQL (avançado) e SAS (intermediário)Conhecimento com ferramentas de modelagem estatística para desenvolver iniciativas de clusterização e segmentação (diferencial)Excel (avançado)Big Data (desejável)Formação desejávelEngenharia de produçãoEconomiaAdministraçãoEstatísticaEscolaridade MínimaSuperior CompletoEmpresa e Local de TrabalhoM300 TIM S.A.RJ Rio de Janeiro,TIM Brasil,19/08/2019
v1942102,Analista Garantia Qualidade Pl (RPP) - Vaga Temporária,Hortolândia,Salário a combinar,1,2019-09-05,Pleno,Vaga temporária Cobrir licença maternidade Requisitos:Conhecimento em RPP (Revisão Periódica de Produto)Conhecimento em EstatísticaVivência com Boas práticas de FabricaçãoConhecimento em Legislação Nacional e InternacionalConhecimento SAPExcel Avançado O profissional será responsável pelas rotinas de Revisão Periódica de produto,EMS,Há 3 dias
